source,title,url,published_date,author,category,content,all_kecamatan,primary_kecamatan,latitude,longitude
malangposco,Segera Petakan Kelayakan Rute Transjatim Kepanjen-Hamid Rusdi,https://malangposcomedia.id/segera-petakan-kelayakan-rute-transjatim-kepanjen-hamid-rusdi/,2026-06-22 14:30:00+00:00,,,"MALANG POSCO MEDIA – Dinas Perhubungan Provinsi Jawa Timur (Dishub Jatim) bersama tim teknis pemda Malang Raya dijadwalkan turun ke lapangan untuk melakukan survei rute bus Transjatim dalam waktu dekat.
Survei ini menjadi langkah konkret terdekat guna merealisasikan operasional bus Transjatim koridor II yang ditargetkan mulai mengaspal pada tahun 2026 ini.
Rencana operasional koridor baru yang akan menghubungkan Terminal Talangagung di Kabupaten Malang dengan Terminal Hamid Rusdi dan Terminal Arjosari di Kota Malang ini terus dimatangkan.
Kepala Seksi Sarana Angkutan Jalan Dishub Jatim, Cito Eko Yuly Saputro, menjelaskan bahwa survei ini untuk memetakan kelayakan rute dari berbagai usulan yang masuk.
“Kami akan mengadakan survei bersama terkait rute-rute usulan itu dalam waktu dekat. Paling lambat dua minggu ke depan,” ujar Cito kepada Malang Posco Media, Senin (22/6) kemarin.
Meskipun rute detailnya masih belum finalisasi, namun Dishub Jatim telah “mengunci” titik asal dan tujuan (origin-destination) bus Transjatim.
Bus Transjatim Koridor II akan bergerak dari Terminal Talangagung di Kepanjen Kabupaten Malang menuju Terminal Hamid Rusdi, dan berakhir di Terminal Arjosari di Kota Malang.
“Tapi untuk rute-rutenya butuh pendekatan dengan beberapa angkutan eksisting dan lain-lain, makanya kami belum finalisasi,” kata Cito.
Survei lapangan, lanjutnya, juga memetakan potensi permintaan dan penawaran (demand and supply) penumpang di sekitar fasilitas publik seperti rumah sakit, sekolah, tempat ibadah, dan kawasan permukiman.
Selain itu, ketersediaan lahan untuk pembangunan halte menjadi poin krusial yang akan diverifikasi langsung di lapangan.
“Walaupun di situ demand-nya tinggi, harus dipikirkan ketersediaan lahan untuk pembangunan halte. Karena konsep Transjatim kan naik dan turun penumpang di halte,” urai Cito seraya memberikan pemda mengusulkan jumlah halte sebanyak-banyaknya.
Cito menegaskan optimis bus Transjatim koridor II bisa mengasapal tahun ini. Namun beberapa syarat harus terpenuhi terkait rute seperti tidak ada resistensi atau penolakan, potensi permintaan dan penawaran  penumpang harus ada agar Transjatim bermanfaat bagi masyarakat, serta jarak tempuh tidak boleh lebih dari 48 hingga 50 km.
“Tahun ini kami optimis karena menjawab kebutuhan masyarakat Malang Raya. Jika tahun lalu ke arah Batu dan Kota Malang, sekarang kami mengakomodasi masyarakat Kabupaten Malang supaya aksesnya ke kota, ke Arjosari, atau ke Batu menjadi lebih mudah,” tambah Cito.
Bila survei tidak ada kendala teknis yang berarti di lapangan, Transjatim koridor II ditargetkan meluncur sesuai jadwal, dengan 14 bus operasional dan satu unit sebagai cadangan.
“Kalau sesuai rencana, target kami di bulan Oktober,” pungkas Cito. (den/van)",['Kepanjen'],Kepanjen,-8.1333,112.5667
malangposco,Terus Sosialisasikan Aplikasi SIMPAS ke Pedagang,https://malangposcomedia.id/terus-sosialisasikan-aplikasi-simpas-ke-pedagang/,2026-06-22 14:25:39+00:00,,,"MALANG POSCO MEDIA, MALANG – Dinas Perindustrian dan Perdagangan Kabupaten Malang memiliki Aplikasi SIMPAS (Sistem Informasi Pasar). Aplikasi ini terus disosialisasikan. Tidak hanya kepada seluruh Koordinator dan Operator Pasar Daerah. Sosialisasi juga dilakukan kepada Pengurus Paguyuban Pedagang Kabupaten Malang.
Kepala Dinas Perindustrian dan Perdagangan Kabupaten Malang Astri Lutfiatunnisa, S.T., M.M., mengatakan aplikasi SIMPAS dibuat guna meningkatkan kualitas pengelolaan data dan pelayanan pasar daerah.
“Salah satu manfaat dari aplikasi ini adalah transaksi retribusi cukup menggunakan scan QR Code pedagang. Pelaporan pendapatan dapat dipantau secara real-time, serta mengurangi ketergantungan terhadap karcis fisik sehingga pengelolaan retribusi menjadi lebih transparan dan akuntabel,’’ katanya.
Dia juga berharap seluruh pengelola pasar dapat memanfaatkan teknologi informasi secara maksimal untuk mendukung tata kelola pasar yang modern dan responsif.
“Jadi nanti petugas tidak perlu membawa karcis untuk diberikan kepada pedagang. Tapi cukup membayar restribusi dengan scan QR. Lebih mudah dan praktis. Uangnya juga langsung masuk dalam kas daerah, sehingga dapat meminimalisir kebocoran,’’ ungkapnya.
Astri yakin, semua pedagang dapat menggunakan aplikasi SIMPAS. Terlebih saat ini, semua pedagang telah membawa smartphone. Yang mana perangkat itu dapat mescand QR.
“Nanti akan pelan-pelan kami sampaikan ke pedagang. Kemarin sudah, diwakili oleh paguyuban. Alhamdulillah, mereka menerima,’’ pungkasnya .(ira/jon)",[],,,
malangposco,7.500 Hektare Lahan untuk Bongkar Ratoon,https://malangposcomedia.id/7-500-hektare-lahan-untuk-bongkar-ratoon/,2026-06-22 14:24:57+00:00,,,"MALANG POSCO MEDIA, MALANG – Seluas 7. 500 hektare lahan di Kabupaten Malang akan menjadi target program bongkar ratoon tahun 2026 ini. Hal ini sebagai upaya Pemkab Malang menggenjot produktivitas sektor perkebunan, khususnya komoditas tebu.
Kepala Dinas Tanaman Pangan, Hortikultura dan Perkebunan (DTPHP) Kabupaten Malang, Avicenna M Saniputera, mengungkapkan dari luas 7.500 hektare, potensi lahan bongkar ratoon yang sudah ada dan siap di angka sekitar 2.500 hektare.
“Tapi data tersebut perlu kami verval (verifikasi faktual) nanti kami akan koordinasi validasi usulan lahan untuk bongkar ratoon,” ujar Avicenna, usai menghadiri kegiatan panen dan tanam tebu serentak program bongkar ratoon di Desa Putukrejo, Kecamatan Gondanglegi, Kabupaten Malang, Kamis (18/6) lalu.
Bagi kelompok tani yang ingin mendapatkan kuota program bongkar ratoon ini, Avicenna menyebutkan syarat utamanya adalah kesediaan bergabung, kepemilikan lahannya ada, serta pemenuhan administrasi melalui koordinasi dengan penyuluh.
Pada tahun lalu, Kabupaten Malang berhasil mencatatkan produksi tebu mencapai lebih dari 4 juta ton. Di tengah bayang-bayang tantangan iklim tahun ini, Avicenna berharap jumlah tahun lalu dapat dipertahankan.
“Tahun ini jangan sampai turun. Tapi dengan adanya perbaikan benih atau bongkar ratoon ini saya rasa ada peningkatan,” tambahnya.
Namun, ia menekankan bahwa intervensi di hulu harus diimbangi dengan perbaikan di sisi hilir, yaitu revitalisasi mesin-mesin pabrik gula.
“Seperti yang sering disampaikan oleh Pak Bupati, efisiensi di pabrik gula harus ditingkatkan dan direkondisi,” pungkasnya . (den/jon)",['Gondanglegi'],Gondanglegi,-8.1667,112.6333
malangposco,"Capai Target PBB, Terus Galakkan BMW",https://malangposcomedia.id/capai-target-pbb-terus-galakkan-bmw/,2026-06-22 14:24:08+00:00,,,"MALANG POSCO MEDIA, MALANG – Beragam upaya dilakukan Bapenda Kabupaten Malang untuk meningkatkan pendapatan Pajak Bumi dan Bangunan (PBB). Salah satunya dengan program Bapenda Menyapa Warga (BMW).
Kepala Bapenda Kabupaten Malang Made Arya Wedanthara mengatakan mengatakan sampai dengan akhir pekan lalu perolehan Pajak Bumi dan Bangunan dikatakan saat ini sudah tercapai 35,82 persen. Atau Rp 44.979.241.286 dari target Rp 125.556.388.953.  Made mengaku hal itu wajar mengingat SPT baru disebar. “Kami terus galakkan BMW untuk bisa mencapai target PBB,” kata Made.
BMW ditegas pria asal Bali ini digelar  sepekan dua kali. Kegiatan ini digelar bergulir di desa / kelurahan se Kabupaten Malang.
“BMW tidak sekadar sebagai upaya meningkatkan pendapatan PBB. Namun juga sebagai upaya kami untuk mendekatkan pelayanan kepada masyarakat,’’ urainya.
Lebih lanjut Made mengatakan bahwa respon dari masyarakat sangat bagus terhadap keberadaan BMW. Itu terbukti, setiap digelar lebih dari 100 warga yang mengurus pelayanan.
“Karena tidak hanya membayar pajak saja. Tapi bisa mengajukan perbaikan data untuk SPT, dan lainnya. Jadi masyarakat sangat terbantu disitu,’’ ujarnya.
Sementara sampai dengan akhir pekan kemarin,  capaian pendapatan dari sektor pajak tertinggi adalah Pajak Kesenian dan Hiburan Kabupaten Malang. Pendapatan di sektor ini   tertinggi dibandingkan dengan perolehan 11 pajak lainnya yang dikelola Bapenda. Data Badan Pendapatan Daerah Kabupaten Malang menyebutkan sampai dengan kemarin perolehan Pajak Kesenian dan Hiburan Kabupaten Malang   mencapai Rp 4.736.806.237 dari target Rp 8.138.978.570.
Made mengatakan tingginya perolehan pajak kesenian dan hiburan ini seiring dengan banyaknya even yang digelar di Kabupaten Malang. Mantan kepala Dinas Pariwisata dan Kebudayaan Kabupaten Malang ini tidak merinci even apa saja yang digelar. Yang jelas, dari beragam even itulah, pendapatan untuk pajak hiburan diperoleh.
“Dari Januari sampai Juni ini banyak even di Kabupaten Malang. Ini yang menyumbang pendapatan. Kalau diprosentase sekarang perolehannya sudah 58,20 persen. Kami yakin akhir tahun ini tercapai lebih dari 100 persen,’’ kata Made.
Keyakinan itu lantaran masih banyak even yang digelar di Kabupaten Malang. Baik itu yang digelar lokal, regional maupun nasional.
“Untuk evennya, dapat dikonfirmasi ke Dinas Pariwisata ya. Cukup banyak, sehingga akan menyumbang pendapatan,’’ urainya.
Made mengatakan selain Pajak Kesenian dan Hiburan, ada beberapa pendapatan pajak lain yang capaiannya sudah lebih 50 persen. Yaitu pajak makanan dan minuman yang mencapai 55,98 persen, pajak MBLB tercapai 56,07 persen. Sedangkan lainnya, berkisar 20-40 an persen.
“Kalau dari data pajak reklame paling minim perolehannya. Yaitu 23,45 persen, dari target Rp 5.126.462.764,’’ ujar Made.
Rendahnya perolehan dari pajak reklame ini dikatakan Made bukan karena pihaknya tidak bekerja. Namun dia mengatakan banyak pelaku usaha yang kurang taat. “Kami masih banyak melihat di jalan reklame yang tidak dilaporkan pemasangannya. Kami pun sudah berkoordinasi dengan Satpol PP terkait hal ini, agar segera dilakukan penertiban. Harapannya ke depan, tidak ada lagi pelaku usaha yang abai, dan tertib membayar pjak reklame sebagai media promosi,’’ pungkasnya .(ira/jon)",[],,,
malangposco,"Perampokan di Sumberpucung; Ibu Lansia Disekap, Mobil Jazz Digondol",https://malangposcomedia.id/perampokan-di-sumberpucung-ibu-lansia-disekap-mobil-jazz-raib/,2026-06-22 14:23:11+00:00,,,"MALANG POSCO MEDIA, MALANG – Aksi perampokan menimpa sebuah rumah di Jalan KH Ahmad Dahlan Desa/Kecamatan Sumberpucung Kabupaten Malang, Minggu (21/6).  Pelaku yang bertindak seorang diri nekat masuk ke dalam kamar, menodongkan senjata tajam (sajam), dan menyekap seorang ibu lansia sebelum membawa kabur satu unit mobil Honda Jazz.
Pihak kepolisian saat ini masih melakukan penyelidikan terhadap pelaku. Terpantau polisi sedang mengumpulkan rekaman kamera pengawas atau CCTV di sekitar lokasi kejadian, Senin (22/6).
Peristiwa perampokan tersebut menimpa Jatiningwigati, seorang ibu lansia berusia 62 tahun yang diketahui istri pensiunan Polri. Suaminya yang disebut warga sekitar bernama Pak Harto’ telah wafat.
Jatiningwigati kini tinggal berdua bersama anak bungsunya, Aaron Nicholas Oto, 18 tahun. Sedangkan dua anak lainnya berada di Bandung, Jawa Barat.
Anak korban, Aaron Nicholas Oto menceritakan bahwa detik-detik peristiwa mencekam itu berlangsung sekitar pukul 24.00 WIB.
Saat itu, sang ibu sudah dalam kondisi tertidur di kamarnya. Sementara, Nicho sedang tidak berada di rumah karena tengah pergi bersama temannya malam mingguan.
“Pas waktu ibu sedang tidur itu, pelaku langsung masuk ke kamar ibu saya. Orangnya langsung menodongkan pisau di leher ibu,” ujar Nicho saat ditemui di rumahnya, Senin (22/6).
Di bawah ancaman sajam, pelaku mendesak korban untuk menyerahkan buku pemilik kendaraan bermotor (BPKB) dan kunci mobil.
Pelaku menyekap korban, Jatiningwigati dengan matanya ditutup lakban, kemudian dibekap dengan kain slayer, serta kedua tangannya diikat ke depan.
“Pelaku menanyakan BPKB sama kunci mobil. Setelah itu, ibu saya dilakban di bagian mata, terus diikat slayer dan tangannya diikat di depan,” beber Nicho sambil memperagakan kondisi ibunya saat peristiwa.
Pelaku berada di dalam rumah kurang lebih selama satu jam. Alhasil, pelaku membawa kabur satu unit mobil Honda Jazz dan sebuah dompet kecil berisi uang.
Berdasarkan keterangan keluarga, pelaku diduga dapat masuk karena gerbang dan pintu rumah dalam kondisi tidak terkunci.
“Pintu dan gerbang rumah tidak terkunci, hanya ditutup. Soalnya saya masih di luar. Memang biasanya begitu kalau saya keluar, supaya kalau pulang bisa langsung masuk,” jelas Nicho, seraya menyampaikan bahwa dirinya pergi malam mingguan bersama temannya.
Pelaku diduga melarikan diri melalui gerbang depan rumah dengan mobil Jazz hasil curian tersebut setelah berhasil menguasai kunci kontak kendaraan dan kunci pagar yang jadi satu.
Nicho menambahkan, meski hanya satu pelaku masuk ke dalam kamar ibunya, pihak keluarga tidak mengetahui pasti apakah ada pelaku lain yang mengawasi situasi di luar rumah.
“Kalau yang masuk rumah cuma satu orang. Tapi tidak tahu di luar ada berapa,” kata pria tiga bersaudara tersebut.
Pascakejadian, korban Jatiningwigati  berada di rumah saudaranya. Peristiwa kriminalitas yang menimpanya telah dilaporkan ke Polsek Sumberpucung.
“Ibu sekarang ada di rumah saudara. Saya sama ibu cuma tinggal berdua saja. Bapak sudah meninggal sudah lama,” pungkas Nicho.
Kapolsek Sumberpucung IPTU Choirul Mustofa saat ditemui membenarkan peristiwa tersebut. Saat ini pihaknya masih melakukan penyelidikan terhadap pelaku.
“Iya benar, saat ini masih penyelidikan. Sedangkan kondisi korban hanya luka gores kecil di leher,” tambahnya. (den/jon)
Perampokan di Sumberpucung
Waktu kejadian
* Minggu 21 Juni 2026 dini hari
TKP
* Jalan KH Ahmad Dahlan Desa/Kecamatan Sumberpucung Kabupaten Malang
Korban
* Jatiningwigati, 62 tahun
Barang hilang
* Mobil Jazz
* Dompet berisi uang",['Sumberpucung'],Sumberpucung,-8.1667,112.5333
malangposco,PLN Tak Bisa Pastikan Waktu Pemadaman,https://malangposcomedia.id/pln-tak-bisa-pastikan-waktu-pemadaman/,2026-06-21 16:10:46+00:00,,,"MALANG POSCO MEDIA – Pemadaman listrik di wilayah Malang Raya membuat semua mata tertuju kepada pelayanan PLN. Banyak pihak mempertanyakan dan mengeluhkan pelayanan PLN di tengah situasi perekonomian yang berat ini.
Merespon keluhan masyarakat tersebut, Manager PT PLN (Persero) UP3 Malang Agung Wibowo menjelaskan saat ini pihaknya memang tengah melakukan manajemen beban secara terbatas di sebagian wilayah layanan.
Langkah ini sebagai bagian dari upaya penguatan dan pemeliharaan jaringan distribusi guna menjaga keandalan sistem kelistrikan.
“Untuk itu, sebagian pelanggan akan mengalami penghentian sementara aliran listrik dengan durasi yang disesuaikan dengan kondisi operasional sistem di masing-masing wilayah,” jelas Agung.
Oleh karena itu, Agung menyebut, pemadaman bergilir selama ini memiliki durasi yang bervariasi. Mulai sekitar 30 menit hingga tiga jam, bergantung pada kondisi jaringan dan lokasi terdampak.
“Sesuai arahan dari pusat, ada pengaturan beban. Untuk jumlah pasti tidak menentu. Jumlah bisa berubah setiap jam, durasi bisa 2,5 jam sampai 3 jam,” sebut dia.
Apabila akan ada pemadaman, pihaknya segera memberikan informasi atau pemberitahuan kepada wilayah yang terdampak. Informasi itu juga bisa diakses melalui media sosial resmi dari PLN maupun notifikasi di aplikasi PLN Mobile.
Lebih lanjut Agung belum bisa pastikan kapan maupun dimana lokasi pemadaman bergiliran.
“Hingga saat ini belum dapat dipastikan kapan pemadaman listrik bergilir akan berakhir. Seluruh proses masih bergantung pada penyelesaian perbaikan jaringan dan pemulihan sistem kelistrikan,” terangnya.
Namun demikian, Agung menegaskan pihaknya tetap berkomitmen menjaga pasokan listrik tetap andal, dengan melakukan pengaturan sistem secara terukur. Selain itu mengoptimalkan pola operasi jaringan, serta meminimalkan dampak kepada pelanggan.
“Seluruh petugas operasional juga disiagakan untuk memastikan sistem kelistrikan tetap aman dan andal. Kami menyampaikan permohonan maaf atas ketidaknyamanan yang terjadi,” katanya.
Manajer PLN ULP Batu Redi Ramadhan memastikan bahwa pihaknya telah memberikan sosialisasi terlebih dahulu kepada masyarakat Kota Batu terkait pemadaman listrik bergilir yang terjadi beberapa hari ini.
“Ada kami infokan sebelum pelaksanaan di grup Sahabat PLN Batu,” ujar Redi saat dikonfirmasi Malang Posco Media.
Terkait dengan jadwal pemadaman bergantian untuk wilayah Kota Batu, pihaknya tidak bisa memastikan kapan pemadaman dilaksanakan. Khususnya untuk tanggal 22-27 Juni.
“Untuk sementara ini belum ada (jadwa pemadaman.red), mohon maaf. Namun (akan.red) kami infokan sebelum pelaksanaan di Grup Sahabat PLN Batu,” imbuhnya singkat.
Untuk informasi, wilayah kerja PLN ULP Batu mencakup tiga kecamatan di Kota Batu. Kemudian empat  kecamatan di Kabupaten Malang, yaitu Kecamatan Karangploso, Kecamatan Pujon, Kecamatan Ngantang, dan Kecamatan Kasembon. (ian/eri/van)","['Karangploso', 'Kasembon', 'Ngantang', 'Pujon']",Karangploso,-7.9333,112.6167
malangposco,Ekonomi Suram Akibat Pemadaman Bergiliran,https://malangposcomedia.id/ekonomi-suram-akibat-pemadaman-bergiliran/,2026-06-21 16:10:16+00:00,,,"MALANG POSCO MEDIA -Pemadaman bergiliran listrik yang terjadi belakangan  memukul sejumlah usaha  di Malang Raya. Omzet usaha jatuh. Bahkan hingga 60 persen. Apalagi mati lampu pada jam produktif. (baca grafis)
Terutama bagi pelaku usaha yang bergantung pada energi listrik. Seperti salah satunya usaha fotokopi dan percetakan, yakni Rifa Digital Printing yang berlokasi di Jalan LA Sucipto.
Pemilik Rifa Digital Printing, Fahaza sangat kecewa dengan pelayanan PLN. Bukan tanpa sebab, belum genap dua minggu terakhir saja, pemadaman sudah terjadi tiga kali. Dua kali pemadaman diberikan pemberitahuan, sementara satu kali tidak ada informasi maupun pemberitahuan sama sekali.
Pemadaman bergilir yang terjadi itu dirasakan berat karena waktu pemadaman yang dilakukan pada jam produktif. Yakni mulai pagi hingga siang, bahkan sore. Hal ini berdampak secara langsung pada pemasukan atau omzet hariannya.
Apabila per hari setidaknya ada 70 konsumen, ketika pemadaman akibatnya menolak hingga 30 konsumen lebih. Bahkan ia menengarai ada salah satu mesinnya mengalami kerusakan juga akibat pemadaman tersebut.
“Dampaknya sangat ngefek sekali bagi saya secara pemasukan atau income  saya. Bisa turun 60 persen lebih. Minimal mati listrik itu kan tiga jam, lalu yang paling lama kemarin itu kan enam jam,” keluh Fahaza.
Ia pun mengaku sebenarnya telah melayangkan aduan dan protes kepada PLN. Sayangnya respon yang diterima tidak cukup memuaskannya. Banyak juga rekannya sesama pelaku usaha yang mengeluhkan kondisi tersebut.
Kondisi yang hampir sama dirasakan Tria Kusumawardani, salah satu pelaku usaha laundry di Jalan Ahmad Yani. Oleh sebab usahanya sangat bergantung pada kelistrikan, pemadaman listrik seperti belakangan ini membuatnya sangat jengkel.
Keluhan massal datang dari para pelaku usaha dan pedagang di kawasan Kota Batu. Pemadaman listrik bergilir yang dilakukan oleh pihak PLN tanpa adanya sosialisasi atau pemberitahuan terlebih dahulu dinilai sangat mencekik urat nadi perekonomian warga.
Tidak sedikit pedagang yang harus menelan kerugian karena kehilangan waktu operasional emas (prime time) mereka, terutama saat akhir pekan (weekend). ​Kondisi yang kian sering terjadi ini memicu kekhawatiran mendalam di kalangan pelaku usaha.
Dampak paling nyata dirasakan para pedagang di kawasan Alun-Alun Kota Batu. Ketua Paguyuban Pelaku Niaga Sipil (PNS) Alun-Alun Kota Batu, Puspita Herdysari, mengungkapkan pemadaman yang terjadi pada akhir pekan kemarin berlangsung cukup lama dan berada di jam-jam krusial tempat orang mencari rezeki.
​”Kemarin mati sejak pukul 15.00,  baru nyala pukul 19.15 WIB. Pas nyala, pengunjung wes (sudah) hilang. Satu hari pas weekend itu kita kehilangan prime time 4 jam tidak bisa melayani pembeli,” kelih  Puspita dengan nada kecewa.
​Pipit sapaan akrabnya menambahkan, untuk pedagang yang sangat bergantung pada listrik seperti penjual es yang menggunakan blender dan cup sealer, pemadaman ini otomatis menghentikan total aktivitas jualan mereka.
​ Menurutnya, ini sudah kali kedua terjadi pemadaman berdurasi lama tanpa ada notifikasi atau warning apa pun dari pihak PLN.
Keluhan senada juga disampaikan Risma, pemilik usaha Rental Risma PS di Kota Batu. Sebagai lini bisnis yang 100 persen menggunakan daya listrik, pemadaman bergilir ini menjadi hantaman keras bagi pendapatannya.
​Tidak hanya sektor kuliner dan hiburan, sektor industri rumahan (home industry) seperti produsen roti dan keripik buah juga dibuat kelimpungan. Khamim Tohari, salah satu pelaku usaha keripik buah di Kota Batu, menyebut pemadaman ini mengacaukan target waktu produksi.
​”Usaha saya semua pakai listrik. Kalau mati lampu, otomatis tidak bisa kerja. Dampaknya bukan cuma penurunan omset, tapi waktu produksi yang molor. Biasanya sore sudah selesai, ini harus sampai malam,” jelas Khamim.
Menggeser waktu produksi ke malam hari juga bukan perkara mudah bagi Khamim. Mesin pengolah keripik buah miliknya mengeluarkan suara yang cukup keras, sehingga berpotensi mengganggu kenyamanan tetangga jika dioperasikan malam hari. Akibatnya, volume produksi terpaksa menurun.
​Khamim menyayangkan sikap PLN yang terkesan abai terhadap nasib rakyat kecil yang sedang berjuang memutar roda ekonomi.​
Perhimpunan Hotel dan Restoran Indonesia (PHRI) Kota Batu menyatakan  pemadaman ini memberikan dampak signifikan terhadap operasional akomodasi. Terlebih saat ini tengah memasuki masa liburan sekolah yang menjadi momen krusial bagi kunjungan wisatawan.
​Ketua PHRI Kota Batu, Sujud Hariadi, mengungkapkan dampak paling nyata yang dirasakan pihak hotel,  membengkaknya biaya operasional secara tajam. Ketika aliran listrik dari PLN terputus, pihak hotel terpaksa mengalihkan sumber daya ke generator set (genset).
“Penggunaan genset ini memakan biaya yang jauh lebih tinggi lantaran harga BBM  industri saat ini masih menyentuh kisaran Rp 25 ribu per liter, sebuah angka yang dinilai sangat memberatkan manajemen hotel,” ungkapnya.
​Selain masalah biaya, Sujud juga menyoroti kendala teknis terkait kapasitas genset. Menurutnya, tidak semua hotel memiliki kapasitas genset yang mampu menutup seluruh kebutuhan listrik pada saat beban pemakaian maksimal.
Sujud menjelaskan bahwa sebagian besar hotel di Kota Batu menjual daya tarik berupa pemandangan malam hari (night view) yang dapat dinikmati langsung dari kamar atau restoran hotel. Dalam kondisi normal, tamu dapat menikmati kemilau cahaya lampu dari wilayah pusat kota ke arah Batu utara. Pemadaman bergilir ini otomatis menghilangkan keindahan panorama tersebut, yang berpotensi menurunkan tingkat kepuasan para tamu yang menginap.
Wilayah Kecamatan Singosari Kabupaten Malang kebagian pemadaman lampu bergilir. Pemadaman yang diketahui karena adanya kendala teknis operasional ini berlangsung pada Sabtu (20/6) lalu.
Salah satu titik terdampak pemadaman lampu di lingkungan RW 8 Desa Candirenggo Kecamatan Singosari. Lampu mengalami pemadaman sekitar  tiga jam.
Masyarakat kini berbondong-bondong  membeli generator set (genset), agar listrik tetap menyala saat terjadi pemadaman sewaktu-waktu.
Salah satu toko yang melayani penjualan genset yakni Mega Teknik di Jalan Sutan Syahrir Kecamatan Klojen Kota Malang. Pemilik toko, Agus, mengatakan kenaikan penjualan ini terjadi sejak selama dua pekan lalu, yang mencapai 25 hingga 50 persen.
Ia menyebut, pembelian genset didominasi oleh pemakaian rumah tangga hingga industri. Pelangganya banyak yang membeli genset untuk kapasitas 2.000 hingga 5.000 watt.
“Kalau untuk rumahan atau pedagang biasa, seperti di tenda atau kios kecil, biasanya yang dicari kapasitas 1.000 sampai 2.000 watt. Dan sekarang yang banyak dicari itu, untuk kapasitas 2.000 hingga 5.000 watt,” sebutnya.
Pria berusia 43 tahun ini menjelaskan, pelangganya tak hanya terbatas di wilayah Malang Raya saja. Melainkan, sampai ke wilayah Bali hingga Papua.
“Banyak juga permintaan dari luar pulau. Kami berusaha terus memenuhi stok, karena sejak terjadinya konflik internasional di selat Hormuz beberapa waktu lalu, ini juga berdampak terkait beberapa ketersediaan barang, termasuk genset ini,” lanjut Agus. (ian/eri/den/rex/van)",['Singosari'],Singosari,-7.9,112.6667
