title,published_date,scraped_at,author,category,content,url,source,image_url
Pemkot Malang pastikan laporan dugaan pelanggaran THR bersifat anonim,"Pewarta: Ananto Pradana Editor : Vicki Febrianto COPYRIGHT © ANTARA 2026 Dilarang keras mengambil konten, melakukan crawling atau pengindeksan otomatis untuk AI di situs web ini tanpa izin tertulis dari Kantor Berita ANTARA.",2026-07-02T05:13:29.767878+00:00,,,"Malang Raya (ANTARA) - Pemerintah Kota (Pemkot) Malang memastikan dua laporan soal dugaan pelanggaran pembayaran tunjangan hari raya (THR) yang masuk posko di Mal Pelayanan Publik (MPP) Merdeka bersifat anonim sehingga tak bisa berlanjut ke proses penanganan. Kepala Dinas Tenaga Kerja, Penanaman Modal, dan Pelayanan Terpadu Satu Pintu (Disnaker-PMPTSP) Kota Malang Arif Tri Sastyawan di Kota Malang, Jawa Timur, Kamis, menyampaikan petugas posko sudah membuka ruang untuk memverifikasi laporan tersebut, namun pihak pelapor tak kunjung melakukan tindak lanjut. ""Kami menunggu yang laporan resminya, ternyata tidak ada, tidak berlanjut. Sudah klir,"" katanya. Laporan tersebut juga tak dilengkapi dengan identitas dan bukti pendukung sehingga petugas posko tidak bisa melakukan tindak lanjut dengan mekanisme resmi. Dia juga tak menutup kemungkinan laporan yang sebelumnya masuk meja pengaduan telah diselesaikan langsung secara internal oleh pihak perusahaan dengan pekerja. ""Mungkin yang anonim itu sudah selesai di bipartitnya,"" ucap dia. Oleh karenanya, ia memastikan secara keseluruhan posko untuk pengaduan THR yang dibuka tahun ini sama sekali tidak menerima laporan resmi mengenai dugaan pelanggaran, termasuk mengenai keterlambatan pembayaran tunjangan hari raya oleh pelaku usaha kepada pegawai. Kondisi yang ada ini lebih baik jika dibandingkan periode Lebaran tahun lalu, di mana dinas terkait masih menerima satu sampai dua laporan dari pekerja yang merasa tak mendapatkan hak atas THR. Dia menjelaskan bahwa tak adanya pengaduan pelanggaran soal THR mengindikasikan adanya peningkatan kepatuhan dan kesadaran dari pelaku atau manajemen perusahaan dalam melaksanakan peraturan dari pemerintah. Hal tersebut juga dipastikan oleh jajaran Disnaker-PMPTSP dengan melaksanakan inspeksi ke perusahaan di daerah setempat sekaligus melakukan sampling untuk mengukur tingkat kepatuhan mengenai pembayaran THR. ""Belum ada sama sekali,"" ujar Arif. Meski demikian, Pemkot Malang tetap mengoperasikan posko pengaduan di MPP hingga H+7 untuk memberikan pelayanan dan membantu proses tindak lanjut jika sewaktu-waktu mendapati adanya laporan dugaan pelanggaran pembayaran THR. Pewarta: Ananto Pradana Editor: Vicki Febrianto COPYRIGHT © ANTARA 2026 Dilarang keras mengambil konten, melakukan crawling atau pengindeksan otomatis untuk AI di situs web ini tanpa izin tertulis dari Kantor Berita ANTARA.",https://jatim.antaranews.com/berita/1050598/pemkot-malang-pastikan-laporan-dugaan-pelanggaran-thr-bersifat-anonim,antara_jatim,https://img.antaranews.com/cache/350x233/2026/03/26/1001136098.jpg
KAI minta warga Malang Raya maksimalkan diskon harga tiket,"Pewarta: Ananto Pradana Editor : Vicki Febrianto COPYRIGHT © ANTARA 2026 Dilarang keras mengambil konten, melakukan crawling atau pengindeksan otomatis untuk AI di situs web ini tanpa izin tertulis dari Kantor Berita ANTARA.",2026-07-02T05:13:31.144828+00:00,,,"Malang Raya (ANTARA) - PT Kereta Api Indonesia (KAI) Daerah Operasi 8 Surabaya meminta masyarakat di Malang Raya memaksimalkan berbagai program diskon harga tiket untuk melakukan perjalanan arus balik Lebaran 2026. Manajer Humas PT KAI Daerah Operasi 8 Surabaya Mahendro Trang Bawono di Kota Malang, Jawa Timur, Kamis, mengatakan sejak diberlakukannya Angkutan Lebaran 2026, stasiun di wilayah Malang Raya telah melayani total 135.297 penumpang, dengan rincian 71.433 pelanggan berangkat dan 63.864 pelanggan datang. ""Arus balik di wilayah Malang Raya masih berlangsung cukup tinggi. Namun masyarakat tidak perlu khawatir karena KAI masih menyediakan tiket melalui program diskon maupun promo tarif khusus,"" kata Mahendro. Adapun stasiun di Malang Raya, yakni Stasiun Malang dan Stasiun Malang Kota Lama di Kota Malang. Lalu, ada Stasiun Lawang, Stasiun Kepanjen dan Stasiun Sumberpucung di Kabupaten Malang. Berdasarkan data dari KAI Surabaya, tingkat penjualan tiket program diskon 30 persen untuk kereta api ekonomi komersial yang berlaku pada 14 hingga 29 Maret 2026 di wilayah Malang Raya telah menyentuh 86 persen atau sebanyak 40.191 tiket dari kuota 46.848 tiket. KAI memperkirakan jumlah tiket program tersebut yang masih bisa dibeli oleh masyarakat tersisa sekitar 6 ribu tiket. Selain itu, KAI Surabaya juga menghadirkan promo tarif parsial untuk kereta api kelas eksekutif melalui program Tabur Berkah Hari Raya yang melayani relasi Malang-Yogyakarta dengan titik pemberangkatan dari Stasiun Malang. Promo tarif parsial berlaku untuk periode 22 hingga 30 Maret 2026. Total kuota yang dibuka sebanyak 7.190 tiket dan saat ini tersisa 746 tiket. Selanjutnya, KAI Daerah Operasi 8 juga akan menghadirkan diskon harga tiket sebesar 20 persen melalui Promo Silahturahmi 2026 yang diberlakukan untuk Kereta Api Ijen Ekspres relasi Malang-Ketapang, dengan periode keberangkatan 30 Maret sampai 1 April 2026, Mahendro mengatakan bahwa penyediaan promo dan diskon harga tiket untuk memudahkan masyarakat mendapatkan akses perjalanan ke daerah tujuan pada arus balik 2026. ""Masyarakat bisa menempuh perjalanan yang lebih hemat dan nyaman,"" ujar dia. Pewarta: Ananto Pradana Editor: Vicki Febrianto COPYRIGHT © ANTARA 2026 Dilarang keras mengambil konten, melakukan crawling atau pengindeksan otomatis untuk AI di situs web ini tanpa izin tertulis dari Kantor Berita ANTARA.",https://jatim.antaranews.com/berita/1050534/kai-minta-warga-malang-raya-maksimalkan-diskon-harga-tiket,antara_jatim,https://img.antaranews.com/cache/350x233/2026/03/26/1001136071.jpg
Wali Kota Malang terapkan kebijakan Jumat Bersih demi Gerakan Indonesia ASRI,"Pewarta: Ananto Pradana Editor : Astrid Faidlatul Habibah COPYRIGHT © ANTARA 2026 Dilarang keras mengambil konten, melakukan crawling atau pengindeksan otomatis untuk AI di situs web ini tanpa izin tertulis dari Kantor Berita ANTARA.",2026-07-02T05:13:31.846164+00:00,,,"Malang, Jawa Timur (ANTARA) - Wali Kota Malang Wahyu Hidayat memberlakukan program Jumat Bersih bagi seluruh aparatur sipil negara (ASN) di lingkungan pemerintah daerah setempat guna mendukung Gerakan Indonesia ASRI (Aman, Sehat, Resik, Indah) yang diinisiasi oleh Presiden Prabowo Subianto. Wahyu di Kota Malang, Jawa Timur, Rabu, mengatakan, program Jumat Bersih itu mencakup sejumlah kebijakan, seperti memprioritaskan penggunaan sepeda. ""Teman-teman ASN kan banyak yang suka bersepeda, dikarenakan masuk (bekerja) setelah senam, kemudian ada kegiatan bersih-bersih (kerja bakti). Saya akan memberlakukan Jumat Bersih sesuai tagline ASRI,"" kata Wahyu. Dia menyampaikan bahwa program Jumat Bersih yang ditujukan bagi seluruh ASN Pemkot Malang direncanakan mulai digulirkan pada Jumat (27/3). Program Jumat Bersih yang diinisiasi oleh Wahyu ini, selain bertujuan menjaga kebersihan lingkungan dan kesehatan fisik, juga menjadi upaya menghemat pengeluaran harian para ASN. Oleh karena itu, bagi ASN yang tidak memiliki sepeda, kata Wahyu, tak dipaksa untuk membeli tetapi lebih diarahkan memprioritaskan dan memaksimalkan pemanfaatan keberadaan moda transportasi umum ketika akan menempuh perjalanan dari rumah ke kantor. ""Ada TransJatim kan sekarang, itu sudah melalui Balai Kota Malang,"" ucapnya. Pada kesempatan itu, ia menambahkan bahwa per hari ini seluruh ASN Pemkot Malang juga telah kembali bekerja dari kantor. Pemerintah daerah setempat tidak memberlakukan sistem bekerja dari rumah (WFH) maupun bekerja dari mana saja (WFA) setelah rampungnya masa libur Lebaran 2026. Menurutnya, langkah ini diambil guna memastikan efektivitas kinerja setiap organisasi perangkat daerah (OPD), khususnya yang memiliki wewenang tugas pada bidang pelayanan. Wahyu memastikan pengawasan terhadap tingkat kehadiran ASN akan dilaksanakan secara ketat dan rutin untuk memperkuat budaya disiplin kerja yang telah terbangun. ""Kalau sampai sekarang belum ada laporan (ASN absen bekerja), insya Allah tidak ada yang bolos. Nanti akan dicek lagi dan biasanya data baru rekap itu sore, pelaporannya berjenjang,"" tutur dia. Pewarta: Ananto Pradana Editor: Astrid Faidlatul Habibah COPYRIGHT © ANTARA 2026 Dilarang keras mengambil konten, melakukan crawling atau pengindeksan otomatis untuk AI di situs web ini tanpa izin tertulis dari Kantor Berita ANTARA.",https://jatim.antaranews.com/berita/1050234/wali-kota-malang-terapkan-kebijakan-jumat-bersih-demi-gerakan-indonesia-asri,antara_jatim,https://img.antaranews.com/cache/350x233/2026/03/25/1001134761.jpg
Wali Kota Malang: Pelayanan beroperasi optimal di hari pertama kerja,"Pewarta: Ananto Pradana Editor : Vicki Febrianto COPYRIGHT © ANTARA 2026 Dilarang keras mengambil konten, melakukan crawling atau pengindeksan otomatis untuk AI di situs web ini tanpa izin tertulis dari Kantor Berita ANTARA.",2026-07-02T05:13:32.124284+00:00,,,"Malang Raya (ANTARA) - Wali Kota Malang Wahyu Hidayat memastikan seluruh pelayanan publik di Mal Pelayanan Publik (MPP) Merdeka, Kota Malang, Jawa Timur beroperasi optimal pada hari pertama bekerja, seusai berakhirnya masa cuti bersama dan libur Lebaran 2026, Rabu. Wahyu di MPP Merdeka mengatakan dari hasil peninjauan seluruh gerai pelayanan yang ada di lokasi itu telah beroperasi dan langsung melayani setiap permohonan layanan yang diajukan oleh masyarakat. ""Seluruh tenant di MPP sudah siap memberikan pelayanan sejak hari pertama,"" katanya. Berdasarkan data dari Pemerintah Kota Malang, per hari ini MPP Merdeka mencatat sebanyak 452 pengunjung telah mengakses berbagai layanan yang tersedia, seperti pembuatan dan pembaruan KTP dari Dinas Kependudukan dan Pencatatan Sipil (Dispendukcapil) hingga reaktivasi kepesertaan BPJS Kesehatan dari BPJS Kesehatan. Wahyu tak memungkiri bahwa jumlah pemohonan layanan di MPP pada hari pertama jam kerja efektif baru sekitar 50 persen jika dibandingkan hari normal. Namun, kondisi itu dikatakannya justru membuat pengerjaan dokumen yang diajukan oleh masyarakat berjalan lebih cepat dan tak sampai memunculkan antrean di setiap gerai layanan. ""Sehingga masyarakat dapat terlayani dengan lebih optimal,"" ujarnya. Mantan Sekretaris Daerah (Sekda) Kabupaten Malang, Jawa Timur ini meminta kepada seluruh petugas di masing-masing instansi supaya memegang komitmen menjaga kualitas pelayanan publik supaya bisa berjalan profesional dan efektif. Selama di MPP Merdeka, Wahyu tak hanya meninjau operasional pelayanan tetapi turut mengecek tingkat kehadiran para aparatur sipil negara (ASN) yang berkantor di gedung tersebut. Ia menyampaikan tak menemukan adanya ASN yang absen atau tidak masuk bekerja pada hari ini. ""Di beberapa dinas pelayanan, seperti Disnaker PMPTSP, kehadiran ASN mencapai 100 persen tanpa ada yang izin. Hal ini sejalan dengan kebijakan bahwa perangkat daerah pelayanan tidak mendapatkan cuti tambahan,"" tutur dia. Pewarta: Ananto Pradana Editor: Vicki Febrianto COPYRIGHT © ANTARA 2026 Dilarang keras mengambil konten, melakukan crawling atau pengindeksan otomatis untuk AI di situs web ini tanpa izin tertulis dari Kantor Berita ANTARA.",https://jatim.antaranews.com/berita/1050210/wali-kota-malang-pelayanan-beroperasi-optimal-di-hari-pertama-kerja,antara_jatim,https://img.antaranews.com/cache/350x233/2026/03/25/1001134618.jpg
Polres Batu duga kecelakaan di Jalur Klemuk disebabkan rem blong,"Pewarta: Ananto Pradana Editor : Vicki Febrianto COPYRIGHT © ANTARA 2026 Dilarang keras mengambil konten, melakukan crawling atau pengindeksan otomatis untuk AI di situs web ini tanpa izin tertulis dari Kantor Berita ANTARA.",2026-07-02T05:13:32.524807+00:00,,,"Korban meninggal dunia di lokasi selanjutnya jenazah dibawa ke Rumah Sakit Bhayangkara Hasta Brata Kota Batu. Diduga karena rem blong Malang Raya (ANTARA) - Kepolisian Resor (Polres) Kota Batu menduga kecelakaan di Jalur Klemuk atau Jalan Raya Rajekwesi yang menewaskan satu pengendara sepeda motor disebabkan kondisi disfungsi sistem pengereman atau rem blong. Kepala Satuan Lalu Lintas Polres Batu AKP Kevin Ibrahim di Kota Batu, Jawa Timur, Rabu, mengungkapkan identitas korban tewas adalah Ari Wibowo (38) asal Kota Surabaya, Jawa Timur. ""Korban mengalami cedera pada kepala, korban meninggal dunia di lokasi selanjutnya jenazah dibawa ke Rumah Sakit Bhayangkara Hasta Brata Kota Batu. Diduga karena rem blong,"" kata Kevin. Polisi juga menyampaikan kejadian ini tidak disebabkan oleh faktor cuaca. Berdasarkan rekaman video yang diunggah di akun media sosial @infobatusam memperlihatkan bahwa tempat kejadian perkara tidak sedang diguyur hujan dan jalur tersebut nampak kering. Berdasarkan keterangan kepolisian, kecelakaan yang terjadi sekitar pukul 12.41 WIB itu bermula ketika sepeda motor bernomor polisi L 6167 UA yang dikendarai oleh korban dan membonceng tiga orang, yakni bernama Rahayu (45), Dhio Bintang Septian (12), dan Nasyawa Aqeela Ramadhani (9) melaju dari arah barat ke timur Jalur Klemuk. Saat melintasi jalan yang lurus dan berkontur menurun itu, tiba-tiba sepeda motor yang dikendarai oleh Ari Wibowo hilang kendali, dan oleng ke sebelah kanan hingga membentur tembok dengan kecepatan tinggi dan menyebabkan kendaraan korban mengalami kerusakan. Kejadian itu, juga menyebabkan tiga orang yang dibonceng oleh korban mengalami luka-luka dengan kategori ringan hingga berat. ""Rahayu mengalami memar di wajah, Dhio Bintang Septian mengalami patah tulang pada kedua kakinya, dan Nasyawa Aqeela Ramadhani mengalami luka babras (luka gores). Ketiga korban bawa dan dirawat di Rumah Sakit Bhayangkara Hasta Brata,"" ucap dia. Pewarta: Ananto Pradana Editor: Vicki Febrianto COPYRIGHT © ANTARA 2026 Dilarang keras mengambil konten, melakukan crawling atau pengindeksan otomatis untuk AI di situs web ini tanpa izin tertulis dari Kantor Berita ANTARA.",https://jatim.antaranews.com/berita/1050170/polres-batu-duga-kecelakaan-di-jalur-klemuk-disebabkan-rem-blong,antara_jatim,https://img.antaranews.com/cache/350x233/2026/03/25/1001134586.jpg
Polres Malang perketat pengawasan jalur wisata,"Pewarta: Ananto Pradana Editor : Vicki Febrianto COPYRIGHT © ANTARA 2026 Dilarang keras mengambil konten, melakukan crawling atau pengindeksan otomatis untuk AI di situs web ini tanpa izin tertulis dari Kantor Berita ANTARA.",2026-07-02T05:13:33.376423+00:00,,,"Malang, Jawa Timur (ANTARA) - Kepolisian Resor (Polres) Malang memperketat pengawasan di sejumlah titik yang menjadi akses ke daerah wisata seiring meningkatnya volume kendaraan pada hari terakhir Libur Lebaran 2026, Selasa. ""Kami melihat adanya lonjakan signifikan pada arus keluar kendaraan, khususnya menuju jalur wisata seperti Kota Batu dan kawasan pantai selatan. Hal ini menjadi perhatian kami dalam pengaturan lalu lintas,"" kata Kepala Satuan Lalu Lintas Polres Malang AKP Muhammad Alif Chelvin Arliska di Kabupaten Malang, Jawa Timur. Data terakhir dari Pos Terpadu Karanglo, Kabupaten Malang menyatakan volume kendaraan dari Exit Tol Singosari ke arah masuk wilayah Malang menunjukkan peningkatan. Volume kendaraan tertinggi tercatat terjadi pada rentang pukul 10.00-11.00 WIB, yaitu sebanyak 1.473 unit melintas masuk ke Malang dari sebelumnya sebanyak 1.391 unit kendaraan pada 09.00-10.00 WIB. Lalu, pada rentang pukul 11.00-12.00 WIB tercatat volume kendaraan sedikit turun ke angka 1.431 unit, dan pada pukul 10.00-11.00 WIB sebanyak 1.473 unit kendaraan. Kemudian, volume kendaraan kembali turun pada pukul 12.00-13.00 WIB menjadi 1.308 unit kendaraan. Meski ada penurunan, namun angka volume kendaraan tercatat masih berada di atas 1.000 unit per jam. Hal ini menjadi atensi kepolisian dalam membendung potensi kepadatan arus, terlebih volume kendaraan yang mengarah ke gerbang masuk Tol Singosari dari Kota Batu dan Malang mengalami peningkatan. Tercatat, volume kendaraan yang keluar wilayah Malang Raya melalui pintu Tol Singosari paling tinggi terjadi pada rentang pukul 12.00-13.00 WIB, yakni sebanyak 1.419 unit. Oleh karena itu, Polres Malang memastikan telah menyiagakan personel di sejumlah titik strategis untuk mengantisipasi kepadatan arus lalu lintas. ""Pengaturan lalu lintas terus dilakukan, kami juga melaksanakan patroli untuk memastikan arus tetap lancar dan aman,"" ujarnya. Terpisah, Kepala Unit Pengaturan, Penjagaan, Pengawalan, dan Patroli (Turjawali) Satuan Lalu Lintas Polres Malang Iptu Andi Agung menyatakan arus lalu lintas masih dalam kondisi ramai lancar, meski ada peningkatan volume kendaraan yang keluar maupun masuk ke Malang melalui Tol Singosari. ""Kondisi lalu lintas masih ramai lancar,"" ujarnya. Petugas yang bersiaga di kawasan jalan tol tersebut terus melakukan pemantauan sebagai bentuk kesiapsiagaan menanggulangi potensi kepadatan arus lalu lintas. Polres Malang mengimbau kepada seluruh pengendara supaya tetap berhati-hati selama melakukan perjalan liburan maupun saat akan kembali ke daerah asal. Selain itu, pengendara juga diingatkan agar selalu mematuhi aturan berlalu lintas demi memastikan keselamatan bersama. Pewarta: Ananto Pradana Editor: Vicki Febrianto COPYRIGHT © ANTARA 2026 Dilarang keras mengambil konten, melakukan crawling atau pengindeksan otomatis untuk AI di situs web ini tanpa izin tertulis dari Kantor Berita ANTARA.",https://jatim.antaranews.com/berita/1049906/polres-malang-perketat-pengawasan-jalur-wisata,antara_jatim,https://img.antaranews.com/cache/350x233/2026/03/24/1001132871.jpg
KAI catat 9.351 penumpang padati stasiun di Malang Raya saat puncak balik,"Pewarta: Ananto Pradana Editor : Astrid Faidlatul Habibah COPYRIGHT © ANTARA 2026 Dilarang keras mengambil konten, melakukan crawling atau pengindeksan otomatis untuk AI di situs web ini tanpa izin tertulis dari Kantor Berita ANTARA.",2026-07-02T05:13:33.709982+00:00,,,"Malang, Jawa Timur (ANTARA) - PT Kereta Api Indonesia (KAI) Daerah Operasi 8 Surabaya melayani 9.351 penumpang di stasiun Malang Raya pada puncak arus balik Lebaran 2026, Selasa ini. ""Pada puncak arus balik hari ini ada sebanyak 9.351 penumpang terlayani, terdiri atas 5.503 penumpang datang dan 3.848 penumpang berangkat,"" kata Manajer Humas KAI Daerah Operasi 8 Surabaya Mahendro Trang Bawono di Kota Malang, Jawa Timur. Angka tersebut merupakan akumulasi dari jumlah keseluruhan penumpang yang melakukan perjalanan maupun tiba di seluruh stasiun se-Malang Raya, yakni Malang dan Malang Kota Lama di Kota Malang. Kemudian, Stasiun Kepanjen, Stasiun Lawang, dan Stasiun Sumberpucung di Kabupaten Malang. Berdasarkan data KAI Surabaya, jumlah penumpang yang melakukan perjalanan pada puncak arus balik ini lebih rendah dibandingkan puncak mudik pada 14 Maret 2026. Saat itu, PT KAI Daerah Operasi 8 Surabaya melayani 9.654 penumpang di seluruh stasiun wilayah Malang Raya. ""Dari total 9.654 penumpang itu, terdapat 6.055 penumpang berangkat dan 3.599 penumpang datang,"" ujarnya. KAI Surabaya juga menyampaikan bahwa sepanjang berjalannya masa angkutan Lebaran 2026, yaitu periode 11-24 Maret 2026, jumlah penumpang yang dilayani sebanyak 115.605 orang, terdiri atas 63.252 penumpang berangkat dan 52.353 penumpang tiba. Mahendro menyampaikan dari jumlah tersebut, Stasiun Malang menjadi stasiun dengan volume penumpang paling padat, yakni 97.509 orang. Disusul, Stasiun Kapanjen melayani total 8.435 orang selama berlangsungnya angkutan Lebaran tahun ini. ""Kemudian, Stasiun Malang Kota Lama sebanyak 6.373 penumpang, serta Stasiun Lawang dan Stasiun Sumberpucung yang secara total melayani 3.288 penumpang,"" tuturnya. Pihaknya pun mengimbau seluruh masyarakat merencanakan keberangkatan ke daerah tujuan dengan baik, khususnya bagi mereka yang akan melakukan arus balik. Pewarta: Ananto Pradana Editor: Astrid Faidlatul Habibah COPYRIGHT © ANTARA 2026 Dilarang keras mengambil konten, melakukan crawling atau pengindeksan otomatis untuk AI di situs web ini tanpa izin tertulis dari Kantor Berita ANTARA.",https://jatim.antaranews.com/berita/1049854/kai-catat-9351-penumpang-padati-stasiun-di-malang-raya-saat-puncak-balik,antara_jatim,https://img.antaranews.com/cache/350x233/2026/03/24/1001133102.jpg
Polresta Malang ringkus dua tersangka pembunuhan juru parkir,"Pewarta: Ananto Pradana Editor : Astrid Faidlatul Habibah COPYRIGHT © ANTARA 2026 Dilarang keras mengambil konten, melakukan crawling atau pengindeksan otomatis untuk AI di situs web ini tanpa izin tertulis dari Kantor Berita ANTARA.",2026-07-02T05:13:33.990441+00:00,,,"Malang, Jawa Timur (ANTARA) - Kepolisian Resor Kota (Polresta) Malang Kota meringkus dua pria berinisial FNA (45) dan SNS (24) tersangka pembunuhan seorang juru parkir di salah satu kafe di Jalan Ijen, Kota Malang, Jawa Timur. Kepala Satuan Reserse Kriminal Polresta Malang Kota AKP Rahmad Aji Prabowo di mapolresta setempat, Selasa, menyampaikan kedua tersangka ditangkap setelah pihaknya melakukan serangkaian penyelidikan terhadap peristiwa pembunuhan yang terjadi pada, Jumat (20/3) itu. ""Terdapat dua tersangka yang ditangkap FNA dan SNS, sedangkan korban berinisial SA (42). Penyelidikan yang kami lakukan, baik dari melakukan pemeriksaan CCTV hingga meminta keterangan dari para saksi,"" kata Aji. Aji menjelaskan sebelum pembunuhan itu terjadi, korban bersama kedua tersangka melakukan aktivitas mengonsumsi minuman keras di lokasi kejadian. Saat itu, tersangka FNA merasa tersinggung lantaran menduga korban SA telah menggoda teman wanitanya. Hal itu pun akhirnya memicu cekcok dan pertengkaran diantara keduanya. FNA pun ketika itu langsung menusuk tubuh korban sebanyak tujuh kali menggunakan sebilah pisau yang memang telah dibawa untuk berjaga-jaga. ""Ketiga orang sama-sama petugas parkir. Teman satunya (SNS) membantu memegangi korban. (Luka pada tubuh korban) kebanyakan di daerah dada,"" ujar dia. Setelah melakukan aksi penusukan itu, FNA dan SNS meninggal TKP menggunakan sepeda motor menuju ke kosan serta mengganti pakaian. Tak berselang lama, kedua pria itu pun melarikan diri dari Kota Malang menuju ke Bendung Selorejo, Kabupaten Malang untuk membuang barang bukti pisau yang telah digunakan untuk menusuk korban. Setelah dari Bendungan Selorejo, FNA dan SNS melanjutkan perjalanan dan diduga kabur ke Kabupaten Blitar. Penangkapan dilakukan setelah kepolisian setempat mendapatkan informasi tentang keberadaan FNA dan SNS, yakni di wilayah Kabupaten Blitar, Jawa Timur dari Polsek Garum, Blitar, pada Sabtu (21/3). ""Tim kami meluncur ke Blitar kemudian dibantu oleh Polsek Garum, Blitar melakukan penangkapan terhadap kedua pelaku,"" ucapnya. Atas perbuatannya FNA dan SNS dijerat dengan Pasal 459 subsider Pasal 458 ayat 3 lebih subsider Pasal 262 ayat 4 Undang-Undang Nomor 1 Tahun 2023 tentang KUHP. ""Ancaman Pasal 459 KUHP pidana mati dan/atau penjara seumur hidup dan/atau paling lama 20 tahun. Untuk subsider Pasal 458 ayat 3 ancaman 20 tahun penjara dan lebih subsider Pasal 262 ayat 4 ancaman 12 tahun penjara,"" tuturnya. Pewarta: Ananto Pradana Editor: Astrid Faidlatul Habibah COPYRIGHT © ANTARA 2026 Dilarang keras mengambil konten, melakukan crawling atau pengindeksan otomatis untuk AI di situs web ini tanpa izin tertulis dari Kantor Berita ANTARA.",https://jatim.antaranews.com/berita/1049822/polresta-malang-ringkus-dua-tersangka-pembunuhan-juru-parkir,antara_jatim,https://img.antaranews.com/cache/350x233/2026/03/24/1001132996.jpg
