title,published_date,scraped_at,author,category,content,url,source,image_url
Pemkot Malang fokuskan bantuan seragam gratis bagi pelajar tak mampu,"Pewarta: Ananto Pradana Editor : Vicki Febrianto COPYRIGHT © ANTARA 2026 Dilarang keras mengambil konten, melakukan crawling atau pengindeksan otomatis untuk AI di situs web ini tanpa izin tertulis dari Kantor Berita ANTARA.",2026-07-02T05:12:36.331827+00:00,,,"Malang Raya (ANTARA) - Pemerintah Kota Malang, Jawa Timur memfokuskan pemberian bantuan seragam sekolah gratis pada tahun ajaran 2026/2027 hanya bagi para pelajar baru dari keluarga tidak mampu. ""Bantuan seragam sekolah gratis hanya diberikan kepada pelajar baru yang berasal dari keluarga tidak mampu,"" kata Wali Kota Malang Wahyu Hidayat ditemui di Kota Malang, Selasa. Peruntukan bantuan ini memang mengalami perubahan skema, sebab pada tahun ajaran 2025/2026 seluruh siswa siswi baru di jenjang pendidikan SD maupun SMP mendapatkan seragam sekolah gratis secara merata, tanpa melihat latar belakang penerima. Wahyu menjelaskan bahwa kebijakan yang diambil menjadi bentuk penyesuaian terhadap kebijakan efisiensi anggaran yang diberlakukan oleh pemerintah pusat. Bantuan yang diberikan oleh pemkot tidak langsung berupa seragam sekolah, melainkan masih dalam bentuk kain bahan. ""Karena kalau seragam jadi banyak yang tidak sesuai (ukuran) dan akhirnya tidak bisa digunakan langsung,"" ucapnya. Sementara itu, Kepala Dinas Pendidikan dan Kebudayaan Kota Malang Suwarjana memperkirakan jumlah penerima bantuan seragam sekolah gratis nantinya hanya sekitar 1.000an pelajar. Jumlah itu lebih kecil ketimbang saat pembagian pada tahun ajaran 2025/2026 sebanyak 16.500 pelajar. Para pelajar penerima bantuan adalah mereka yang menempuh pendidikan di SD maupun SMP negeri dan belum memperluas sasarannya ke siswa siswi di sekolah swasta. ""Untuk tahun ini tidak (ke sekolah swasta) sebab ada efisiensi anggaran,"" kata dia. Setiap sekolah nantinya melakukan pendataan terhadap pelajar yang masuk dalam data kemiskinan. Setelahnya, data jumlah penerima manfaat akan dikirimkan ke Pemkot Malang untuk dilakukan proses realisasi dan pendistribusian. Ia menyampaikan, masing-masing pelajar akan mendapatkan dua seragam, terdiri dari putih merah untuk SD, putih biru untuk SMP, pramuka, beserta atribut sekolah, seperti dasi. ""Yang mengetahui kondisi muridnya itu masing-masing sekolah,"" ujar Suwarjana. Pewarta: Ananto Pradana Editor: Vicki Febrianto COPYRIGHT © ANTARA 2026 Dilarang keras mengambil konten, melakukan crawling atau pengindeksan otomatis untuk AI di situs web ini tanpa izin tertulis dari Kantor Berita ANTARA.",https://jatim.antaranews.com/berita/1061325/pemkot-malang-fokuskan-bantuan-seragam-gratis-bagi-pelajar-tak-mampu,antara_jatim,https://img.antaranews.com/cache/350x233/2026/04/28/1001201798.jpg
Pemkab Malang: 79 gedung KDMP selesai dibangun 100 persen,"Pewarta: Ananto Pradana Editor : Vicki Febrianto COPYRIGHT © ANTARA 2026 Dilarang keras mengambil konten, melakukan crawling atau pengindeksan otomatis untuk AI di situs web ini tanpa izin tertulis dari Kantor Berita ANTARA.",2026-07-02T05:12:36.645528+00:00,,,"Malang, Jawa Timur (ANTARA) - Pemerintah Kabupaten (Pemkab) Malang menyebut 79 fasilitas gedung Koperasi Desa Merah Putih (KDMP) di wilayah setempat telah selesai dibangun 100 persen. ""Terdapat 79 KDMP di wilayah kami yang pembangunannya sudah selesai 100 persen,"" kata Kepala Dinas Koperasi dan Usaha Mikro Kabupaten Malang Tito Fibrianto di Malang, Jawa Timur, Senin. Dia menyampaikan infrastruktur gedung tersebut difungsikan sebagai sarana operasional dan pemanfaatannya disesuaikan dengan kesiapan masing-masing pengurus dan anggota KDMP dalam menjalankan sejumlah unit usaha yang ditetapkan di dalam program itu, seperti gerai sembako, logistik, unit simpan pinjam, dan gudang pendingin. ""Contoh di Randugading itu dari koperasi yang sudah ada gerai. Jadi dia mengembangkan diri menjadi Koperasi Desa Merah Putih,"" ujar dia. Dinas Koperasi dan Usaha Mikro Kabupaten Malang menyatakan saat ini terdapat 237 gedung lainnya yang sedang dalam proses pengerjaan pembangunan. Dengan begitu, jumlah keseluruhan gedung yang telah dibangun dan masih dalam tahap pengerjaan di Kabupaten Malang mencapai 316 bangunan. Sedangkan, untuk keseluruhan Koperasi Merah Putih di wilayah setempat mencapai 390 unit. Tito menyampaikan terdapat 74 gedung yang belum dibangun karena masih menunggu tuntasnya proses administrasi terkait pemanfaatan lahan. ""Iya ada yang di lahan Perhutani, ada di kawasan hutan produksi dan kami memohonkan untuk dipakai pembangunan. Secara prinsipil dari pihak Perhutani sudah menjawab itu namun masih proses administrasinya,"" ujar dia. Pemkab Malang memastikan mendukung penuh KDMP yang telah menjadi program dari Presiden Prabowo Subianto. Menurut dia, program ini merupakan sebuah terobosan memastikan membangun dan menguatkan sistem perekonomian masyarakat di wilayah desa. ""KDMP akan menjadi pusat perekonomian karena usahanya berbasis anggota yang merupakan masyarakat. Seluruh kebutuhan di desa akan dipenuhi melalui koperasi ini dan keuntungannya kembali lagi ke masyarakat,"" katanya. Pewarta: Ananto Pradana Editor: Vicki Febrianto COPYRIGHT © ANTARA 2026 Dilarang keras mengambil konten, melakukan crawling atau pengindeksan otomatis untuk AI di situs web ini tanpa izin tertulis dari Kantor Berita ANTARA.",https://jatim.antaranews.com/berita/1061033/pemkab-malang-79-gedung-kdmp-selesai-dibangun-100-persen,antara_jatim,https://img.antaranews.com/cache/350x233/2026/04/27/1001199727.jpg
Dishub Kota Malang evaluasi layanan parkir guna tingkatkan retribusi,"Pewarta: Ananto Pradana Editor : Vicki Febrianto COPYRIGHT © ANTARA 2026 Dilarang keras mengambil konten, melakukan crawling atau pengindeksan otomatis untuk AI di situs web ini tanpa izin tertulis dari Kantor Berita ANTARA.",2026-07-02T05:12:36.898366+00:00,,,"Malang, Jawa Timur (ANTARA) - Dinas Perhubungan (Dishub) Kota Malang, Jawa Timur, melakukan evaluasi terhadap tata kelola layanan parkir di wilayah setempat guna mendongkrak penerimaan retribusi dari sektor tersebut. Kepala Dishub Kota Malang Widjaja Saleh Putra di Kota Malang, Jawa Timur, Senin, mengatakan, mekanisme yang diperketat adalah pelaksanaan pengawasan terhadap penyerahan karcis parkir sebagai tanda bukti pembayaran layanan oleh juru parkir kepada pengguna layanan. ""Tentu kami meningkatkan capaian retribusi dengan cara melakukan perbaikan untuk meningkatkan layanan dengan memastikan juru parkir selalu memberikan karcis tarif sesuai ketentuan,"" kata dia. Dishub Kota Malang menargetkan pada 2026 penerimaan retribusi dari sektor parkir mencapai Rp15 miliar, terdiri dari Rp8,5 miliar berasal dari retribusi penyediaan pelayanan parkir di tepi jalan umum dan Rp6,5 miliar dari retribusi pelayanan tempat khusus parkir. Berdasarkan data dari Dishub setempat, hingga triwulan I 2026 penerimaan retribusi dari sektor tersebut telah tercapai Rp2,55 miliar atau baru 17,02 persen dari target tahun ini. Apabila dirinci, maka penerimaan retribusi penyediaan pelayanan parkir di tepi jalan umum sebesar Rp1,21 miliar dan retribusi pelayanan tempat khusus parkir sebesar Rp1,33 miliar. Widjaja menyampaikan jumlah retribusi itu bersumber dari 806 titik parkir tepi jalan umum resmi se-Kota Malang yang mengacu dari hasil setoran juru parkir berdasarkan penerbitan virtual account dari Dishub setempat. ""Mereka biasanya menggunakan sistem shift, ada yang jaga pagi, siang, dan seterusnya. Juru parkir total sekitar 3.400an orang yang di parkir resmi,"" katanya. Sedangkan, parkir khusus milik Dishub di Kota Malang sejauh ini telah didirikan di tujuh lokasi, yakni Malang Creative Center, Stadion Gajayana, Rumah Sakit Umum Daerah Kota Malang, Mini Block Office, Terminal Madyopuro, dan kawasan gedung parkir di kawasan Kayutangan Heritage. Dia menambah bahwa jumlah retribusi mengacu dari jumlah karcis parkir yang diberikan oleh juru parkir kepada pengguna layanan. Oleh karena itu, ia mengingatkan kepada seluruh juru parkir tak boleh acuh dengan tidak memberikan karcis kepada masyarakat karena itu merupakan bagian dari ketentuan pelayanan. Apabila tidak menerima, maka pengguna layanan parkir punya hak untuk meminta karcis. Pewarta: Ananto Pradana Editor: Vicki Febrianto COPYRIGHT © ANTARA 2026 Dilarang keras mengambil konten, melakukan crawling atau pengindeksan otomatis untuk AI di situs web ini tanpa izin tertulis dari Kantor Berita ANTARA.",https://jatim.antaranews.com/berita/1061008/dishub-kota-malang-evaluasi-layanan-parkir-guna-tingkatkan-retribusi,antara_jatim,https://img.antaranews.com/cache/350x233/2026/04/27/1001199475.jpg
Pemkot Malang canangkan dua pasar ber-SNI pada 2026,"Pewarta: Ananto Pradana Editor : Astrid Faidlatul Habibah COPYRIGHT © ANTARA 2026 Dilarang keras mengambil konten, melakukan crawling atau pengindeksan otomatis untuk AI di situs web ini tanpa izin tertulis dari Kantor Berita ANTARA.",2026-07-02T05:12:37.494387+00:00,,,"Malang, Jawa Timur (ANTARA) - Dinas Koperasi, Perindustrian, dan Perdagangan (Diskopindag) Kota Malang mencanangkan dua lokasi pasar tradisional di wilayah setempat bisa memiliki Standar Nasional Indonesia (SNI) pada 2026. Kepala Diskopindag Kota Malang Eko Sri Yuliadi di Kota Malang, Jawa Timur, Senin, mengemukakan dua pasar yang ditargetkan bisa ber-SNI itu, yakni Pasar Sawojajar dan Pasar Bunul. ""Kami sedang mengupayakan Pasar Sawojajar dan Pasar Bunul untuk diajukan mendapatkan SNI tahun ini (2026),"" kata Eko. Saat ini terdapat dua pasar tradisional di Kota Malang yang telah lebih dulu ber-SNI, yaitu Pasar Oro-Oro Dowo pada 2018 dan Pasar Kasin pada 2022. Data dari Diskopindag Kota Malang menyebutkan penerimaan retribusi pasar per tahun sekitar Rp9,5 miliar dan diproyeksikan mampu mencapai lebih dari Rp10 miliar per tahun apabila jumlah pasar SNI bertambah menjadi empat lokasi. ""Jadi tahun ini (2026) diproyeksikan bisa empat pasar yang (ber-) SNI,"" ujar dia. Diskopindag Kota Malang kini sedang mempersiapkan pemenuhan pelbagai persyaratan sebagai persiapan awal mengajukan dua pasar tersebut untuk mendapatkan SNI, salah satunya adalah tata kelola manajemen pasar dengan menggunakan sistem zonasi atau pengelompokan lokasi berdagang berdasarkan komoditas. ""Kalau sekarang kan masih bercampur, itu tidak boleh. Jadi, nanti pedagang daging tidak lagi bercampur dengan pedagang sayuran tapi sendiri, sehingga kami akan menata ulang semuanya,"" ujar dia. Dinas terkait memastikan upaya memenuhi persyaratan tetap dikomunikasikan bertahap dengan para pedagang, khususnya menyangkut sistem zonasi area dagang tersebut sehingga tak sampai menimbulkan permasalahan yang akan menghambat proses penetapan Pasar Sawojajar dan Pasar Bunul mendapatkan SNI. Soal pembayaran digital, Eko menyampaikan aspek itu merupakan komponen pendukung dalam pemenuhan pengajuan syarat SNI. Konsep tersebut kini telah diterapkan oleh mayoritas pedagang di setiap pasar di Kota Malang. ""Kalau revitalisasi, penyesuaian ketinggian bedak (meja kios), sarana pendukung sudah sesuai semuanya,"" katanya. Pewarta: Ananto Pradana Editor: Astrid Faidlatul Habibah COPYRIGHT © ANTARA 2026 Dilarang keras mengambil konten, melakukan crawling atau pengindeksan otomatis untuk AI di situs web ini tanpa izin tertulis dari Kantor Berita ANTARA.",https://jatim.antaranews.com/berita/1060983/pemkot-malang-canangkan-dua-pasar-ber-sni-pada-2026,antara_jatim,https://img.antaranews.com/cache/350x233/2026/04/27/1001199360.jpg
Pemkot Malang optimalkan becak listrik jadi layanan wisata,"Pewarta: Ananto Pradana Editor : Vicki Febrianto COPYRIGHT © ANTARA 2026 Dilarang keras mengambil konten, melakukan crawling atau pengindeksan otomatis untuk AI di situs web ini tanpa izin tertulis dari Kantor Berita ANTARA.",2026-07-02T05:12:37.820492+00:00,,,"Malang Raya (ANTARA) - Pemerintah Kota (Pemkot) Malang menyusun skema optimalisasi operasional becak listrik bantuan Presiden Prabowo Subianto sebagai bagian dari layanan wisata. Kepala Dinas Kepemudaan, Olahraga, dan Pariwisata Kota Malang Baihaki di Kota Malang, Jawa Timur, Minggu, mengatakan sudah berkoordinasi dengan Perhimpunan Hotel dan Restoran Indonesia (PHRI), Himpunan Pramuwisata Indonesia (HPI), dan Dinas Perhubungan setempat untuk mematangkan pembentukan peraturan wali kota tentang pemanfaatan angkutan tersebut untuk menunjang sektor pariwisata. ""Regulasi teknis berupa peraturan wali kota untuk becak listrik masih dipersiapkan. Pembahasannya melibatkan pihak-pihak terkait,"" kata Baihaki. Bantuan becak listrik untuk Kota Malang diperuntukkan bagi 200 pengayuh becak berusia lansia. Serah terima angkutan kepada penerima manfaat dilakukan, pada 20 Januari 2026 di balai kota setempat. Beberapa poin yang sedang dibahas, yakni menyangkut detail rute, titik pemberhentian, dan konsep layanan becak listrik berbasis aplikasi digital seusai arahan dari Wali Kota Malang Wahyu Hidayat. Baihaki optimistis dengan penataan operasional becak listrik akan meningkatkan kualitas layanan dan menghadirkan kemudahan kepada wisatawan untuk melakukan perjalanan ke setiap destinasi pariwisata di Kota Malang. ""Setelah semuanya berjalan kami akan menghitung dan mengevaluasi bagaimana dampaknya terhadap kunjungan wisata,"" kata dia. Berdasarkan data dari Dinas Kepemudaan, Olahraga, dan Pariwisata Kota Malang, target kunjungan wisata pada tahun 2026 telah ditetapkan sebesar 3,4 juta wisatawan. Berdasarkan laporan kuartal I 2026 angka kunjungan wisata ke kota itu mencapai 796.688 wisatawan, terdiri dari 787.047 wisatawan nusantara dan 9.841 wisatawan mancanegara. Dikonfirmasi terpisah, Kepala Dishub Kota Malang Widjaja Saleh Putra menyampaikan sudah mendapatkan pelimpahan kewenangan dari Dinas Kepemudaan, Olahraga, dan Pariwisata untuk menyiapkan rute becak listrik. Pihaknya dalam waktu dekat akan membahas hal tersebut dengan paguyuban becak listrik. ""Kalau sementara ini hanya kawasan tertib lalu lintas (KTL) di Jalan Ijen yang tidak boleh dilalui becak tanpa mesin,"" ujarnya. Sementara itu, Ketua PHRI Kota Malang Agoes Basoeki menyatakan akan mempersiapkan tempat pemberhentian atau pool khusus becak listrik di setiap hotel yang dekat dengan tempat pariwisata. Jumlah becak listrik yang dinilainya paling relevan untuk ditempatkan di hotel minimal dua sampai tiga unit. Kemudian, dilengkapi koordinator angkutan dari Pemkot Malang. Dia berharap penyusunan regulasi bisa secepatnya tuntas sehingga becak listrik bisa segera beroperasi untuk melayani wisatawan. ""Tamu hotel banyak yang menanyakan soal ini, mereka merasa kalau jalan-jalan ke Kota Malang naik becak lebih berkesan. Kalau dulu itu ada becak kayuh yang melayani tamu-tamu kami,"" tuturnya. Pewarta: Ananto Pradana Editor: Vicki Febrianto COPYRIGHT © ANTARA 2026 Dilarang keras mengambil konten, melakukan crawling atau pengindeksan otomatis untuk AI di situs web ini tanpa izin tertulis dari Kantor Berita ANTARA.",https://jatim.antaranews.com/berita/1060633/pemkot-malang-optimalkan-becak-listrik-jadi-layanan-wisata,antara_jatim,https://img.antaranews.com/cache/350x233/2026/04/26/1001197574.jpg
Pemkot masukkan ajang Malang Half Marathon ke dalam kalender daerah,"Pewarta: Ananto Pradana Editor : Vicki Febrianto COPYRIGHT © ANTARA 2026 Dilarang keras mengambil konten, melakukan crawling atau pengindeksan otomatis untuk AI di situs web ini tanpa izin tertulis dari Kantor Berita ANTARA.",2026-07-02T05:12:38.045025+00:00,,,"Malang Raya (ANTARA) - Pemerintah Kota (Pemkot) Malang akan memasukkan ajang Malang Half Marathon ke dalam kalender daerah periode 2027 karena dinilai mampu berdampak positif bagi pergerakan industri pariwisata, khususnya sektor perhotelan. ""Pelaksanaan tahun ini menjadi yang pertama dan sudah memberikan dampak bagus ke industri pariwisata, salah satunya hotel. Maka dari itu, kami akan memasukkan sebagai event tahunan di Kota Malang,"" kata Wahyu seusai pelaksanaan Malang Half Marathon di Stadion Gajayana, Kota Malang, Jawa Timur, Minggu. Dia menyampaikan perlombaan lari tersebut tidak hanya diikuti oleh warga Kota Malang, tetapi juga sejumlah daerah di Indonesia. Para peserta sudah datang dan menginap di hotel yang berada di Kota Malang sejak Kamis (23/4/2026) dan Jumat (24/4/2026). Mereka juga menghabiskan waktu dengan berpelesir ke destinasi wisata di wilayah setempat. ""Tadi saya keliling di setiap titik (rute), warga Kota Malang antusias menyambut pelari,"" ucapnya. Di tempat yang sama, Kepala Dinas Kepemudaan, Olahraga, dan Pariwisata Kota Malang Baihaki mengatakan ajang lari tersebut akan menjadi rangkaian acara peringatan Hari Jadi Kota Malang ke-113 tahun. Rencana memasukkan Malang Half Marathon ke dalam kalender daerah tidak hanya melihat sisi dampak terhadap sektor pariwisata, tetapi juga pada aspek kesiapan dan profesionalitas pihak penyelenggara dalam menggelar agenda itu. ""Penyelenggara memiliki keseriusan meningkatkan level (kompetisi) dan jumlah pesertanya. Ini merupakan strategi lebih memperkenalkan nama Kota Malang,"" kata dia. Berdasarkan keterangan dari dinas terkait dari total tujuh ribu peserta, sebanyak 52 persen peserta merupakan warga asal luar daerah. Pemkot mencatat hingga kuartal I 2026 Kota Malang telah dikunjungi 796.688 wisatawan, terdiri atas 787.047 wisatawan nusantara dan 9.841 wisatawan mancanegara. Sedangkan, kunjungan wisata tahun ini ditargetkan sebesar 3,4 juta orang. Sementara itu, Penggagas Malang Half Marathon Gilang Widya Permana menyampaikan penyelenggaraan ajang maraton merupakan hasil kolaborasi antara pihak swasta dan pemerintah daerah yang tujuannya memberikan kebermanfaatan bagi seluruh warga Kota Malang. ""Jujur, swasta kalau bergerak sendiri tidak bisa dan Pak Wali Kota menggerakkan kelurahan sampai RT/RW untuk menyukseskan acara. Dampak yang dihadirkan luas, perputaran ekonomi diperkirakan di atas Rp20 miliar,"" katanya. Dia menambahkan mencoba menghadirkan konsep baru pada gelaran tahun depan dan menargetkan jumlah peserta mencapai 12-14 ribu pelari. ""Kami mendorong agar tidak hanya half marathon tetapi bisa full marathon,"" tuturnya. Pewarta: Ananto Pradana Editor: Vicki Febrianto COPYRIGHT © ANTARA 2026 Dilarang keras mengambil konten, melakukan crawling atau pengindeksan otomatis untuk AI di situs web ini tanpa izin tertulis dari Kantor Berita ANTARA.",https://jatim.antaranews.com/berita/1060612/pemkot-masukkan-ajang-malang-half-marathon-ke-dalam-kalender-daerah,antara_jatim,https://img.antaranews.com/cache/350x233/2026/04/26/1001196584.jpg
Pemkot Malang usul tambahan rute TransJatim guna penuhi akses angkutan,"Pewarta: Ananto Pradana Editor : Vicki Febrianto COPYRIGHT © ANTARA 2026 Dilarang keras mengambil konten, melakukan crawling atau pengindeksan otomatis untuk AI di situs web ini tanpa izin tertulis dari Kantor Berita ANTARA.",2026-07-02T05:12:38.398607+00:00,,,"Malang Raya (ANTARA) - Pemerintah Kota (Pemkot) Malang mengusulkan penambahan rute baru bus TransJatim kepada Pemerintah Provinsi Jawa Timur, salah satunya di Jalan Soekarno-Hatta untuk memenuhi kebutuhan akses angkutan umum bagi masyarakat di daerah itu. Wali Kota Malang Wahyu Hidayat di Kota Malang, Jawa Timur, Minggu, mengatakan, Jalan Soekarno-Hatta menjadi salah satu pusat aktivitas masyarakat, karena terdapat area perkantoran, tempat hiburan, dan kampus. ""Kami sudah memberikan usulan sewaktu diskusi. Ada beberapa ruas jalan belum dijangkau TransJatim, seperti Soekarno-Hatta,"" kata Wahyu. Ia menyampaikan bahwa usulan itu merupakan aspirasi langsung dari masyarakat setempat yang menginginkan adanya kemudahan dalam melaksanakan mobilitas sehari-hari. Wahyu menuturkan tata letak halte pemerintah provinsi tetap dikomunikasikan dengan pemerintah daerah, sama seperti ketika penentuan titik pemberhentian bus TransJatim yang telah dibuka. ""Beberapa masih kami pilih supaya tidak sampai menyebabkan kemacetan. Kami akan melihat karena nanti akan banyak menggunakan lahan milik pemkot,"" ucap dia. Hingga saat ini bus TransJatim baru terdapat satu koridor dengan panjang rute sekitar 52 kilometer, dari Terminal Hamid Rusdi kemudian ke Terminal Landungsari di Kabupaten Malang, dan Terminal Batu di Kota Batu. Khusus di Kota Malang, moda transportasi tersebut saat ini telah beberapa titik strategis, seperti Stasiun Malang, Jalan Basuki Rahmat atau Kayutangan, Terminal Madyupuro, Jalan Dinoyo, dan Jalan Veteran dengan load factor atau rasio kapasitas layanan mencapai 61 persen per hari. Oleh karenanya, ia menilai bahwa bus TransJatim yang bergerak dari Kota Malang begitu diminati oleh masyarakat. Bahkan, setiap armada bus yang melintas selalu penuh oleh penumpang. Meski demikian, pihaknya tetap menyerahkan seluruh keputusan final perihal realisasi dibukanya rute baru kepada Pemerintah Provinsi Jawa Timur. ""Apalagi bus ini lintas daerah (Malang Raya) sehingga peranannya kebanyakan di provinsi,"" ujarnya. Pewarta: Ananto Pradana Editor: Vicki Febrianto COPYRIGHT © ANTARA 2026 Dilarang keras mengambil konten, melakukan crawling atau pengindeksan otomatis untuk AI di situs web ini tanpa izin tertulis dari Kantor Berita ANTARA.",https://jatim.antaranews.com/berita/1060577/pemkot-malang-usul-tambahan-rute-transjatim-guna-penuhi-akses-angkutan,antara_jatim,https://img.antaranews.com/cache/350x233/2026/04/26/1001197329.jpg
Polisi selidiki penyebab kebakaran gudang pabrik rokok di Kota Malang,"Pewarta: Ananto Pradana Editor : Vicki Febrianto COPYRIGHT © ANTARA 2026 Dilarang keras mengambil konten, melakukan crawling atau pengindeksan otomatis untuk AI di situs web ini tanpa izin tertulis dari Kantor Berita ANTARA.",2026-07-02T05:12:39.649113+00:00,,,"Untuk penyebab kebakaran masih dalam penyelidikan Malang Raya (ANTARA) - Pihak kepolisian melakukan penyelidikan guna mengetahui penyebab terjadinya kebakaran yang melanda sebuah gudang pabrik rokok di wilayah Kecamatan Kedungkandang, Kota Malang, Jawa Timur, Jumat. ""Untuk penyebab kebakaran masih dalam penyelidikan,"" kata Kepala Unit Pembinaan Masyarakat Polsek Kedungkandang Ipda Agus Widodo di Kota Malang. Agus menyampaikan peristiwa kebakaran terjadi sekitar pukul 16.15 WIB. Kebakaran terjadi tepat di area gudang yang di dalamnya berisikan tumpukan kardus, filter rokok, dan etiket atau bungkus rokok. Berdasarkan keterangan dari warga, lanjutnya, api berasal dari sisi selatan gudang yang lokasinya berdekatan dengan bangunan mushala. ""Yang gudang tembakau aman,"" ucapnya. Ia memastikan tim dari Unit Pelaksana Teknis Pemadam Kebakaran Kota Malang telah melakukan upaya pemadaman kobaran api. Pihaknya telah mengimbau kepada warga sekitar agar tak mendekati lokasi kebakaran sehingga regu pemadam bisa menjalankan tugas dengan lancar. ""Kondisi bangunan rawan karena bagian temboknya terlihat mau roboh,"" ujar dia. Kepolisian juga menyampaikan sampai saat ini belum ada informasi mengenai korban jiwa maupun luka-luka dalam kejadian itu. Pantauan ANTARA di lokasi, kobaran api yang sempat terlihat dari titik kebakaran sudah mampu dipadamkan. Meski demikian, petugas pemadam kebakaran masih melaksanakan upaya pendinginan untuk memastikan tak ada sisa percikan api di gudang itu. Di bagian depan gudang terlihat beberapa orang tim paramedis beserta sejumlah unit ambulans juga terlihat disiagakan. Pewarta: Ananto Pradana Editor: Vicki Febrianto COPYRIGHT © ANTARA 2026 Dilarang keras mengambil konten, melakukan crawling atau pengindeksan otomatis untuk AI di situs web ini tanpa izin tertulis dari Kantor Berita ANTARA.",https://jatim.antaranews.com/berita/1060276/polisi-selidiki-penyebab-kebakaran-gudang-pabrik-rokok-di-kota-malang,antara_jatim,https://img.antaranews.com/cache/350x233/2026/04/24/1001194327.jpg
