title,published_date,scraped_at,author,category,content,url,source,image_url
Khofifah minta kepala daerah proaktif cek perkembangan harga sembako,"Pewarta: Ananto Pradana Editor : Vicki Febrianto COPYRIGHT © ANTARA 2026 Dilarang keras mengambil konten, melakukan crawling atau pengindeksan otomatis untuk AI di situs web ini tanpa izin tertulis dari Kantor Berita ANTARA.",2026-07-02T05:11:51.460258+00:00,,,"Malang Raya (ANTARA) - Gubernur Jawa Timur Khofifah Indar Parawansa meminta seluruh kepala daerah di provinsi tersebut proaktif mengecek perkembangan harga kebutuhan pokok di pasar guna memastikan kondisinya tetap stabil. Khofifah seusai meninjau harga bahan pangan di Pasar Klojen, Kota Malang, Jawa Timur, Jumat, mengatakan, kepastian mengenai kondisi harga komoditas pangan di pasar merupakan arahan dari Menteri Dalam Negeri (Mendagri) Tito Karnavian yang diberikan setiap pelaksanaan rapat pengendalian inflasi bersama pemerintah daerah. ""Mendagri mengajak seluruh kabupaten, kota, maupun provinsi untuk membahas pengendalian inflasi, dari proses setiap minggunya itu memang diharapkan gubernur, bupati, wali kota ini secara proaktif mengecek terutama (harga) sembako di lapangan,"" kata Khofifah. Dia menyatakan keaktifan pemantauan akan mampu meningkatkan efektivitas dari pengambilan langkah intervensi apabila sewaktu-waktu ditemukan potensi peningkatan harga sembako. Tak hanya itu, masing-masing pemerintah kabupaten dan kota ditegaskannya perlu menguatkan kerja sama antar daerah (KAD), khususnya dengan daerah yang menjadi sentra penghasil komoditas pangan. KAD juga menjadi upaya penting karena sebagai bagian memitigasi terjadinya inflasi akibat minimnya ketersediaan bahan pangan. ""Kami saling mengecek bersama-sama agar daya beli masyarakat tetap terjaga dan bisa menjangkau sembako, itu disiapkan,"" ucap dia. Sementara itu, Khofifah mengemukakan bahwa dari hasil peninjauan harga bahan pangan di Pasar Klojen, komoditas bawang merah mengalami peningkatan harga yang dari awalnya di kisaran harga Rp35-45 ribu menjadi Rp55-60 ribu per kilogram. ""Untuk cabai rawit di sini (Pasar Klojen) ada yang (menjual) Rp100 ribu dan ada yang Rp120 ribu (per kilogram) tetapi di pasar lainnya di Malang bisa Rp80 ribu, maka dari itu perlu dilakukan KAD,"" ucapnya. Tak hanya itu, Khofifah secara khusus meminta Wali Kota Malang untuk mempercepat proses pemenuhan ketersediaan beras stabilitas pasokan dan harga pangan (SPHP) di Pasar Klojen yang sudah habis. Ia memastikan siap membantu pemenuhan pasokan beras SPHP untuk wilayah Kota Malang maupun daerah lain. ""Kami punya stok beras medium SPHP di Jawa Timur ini jumlahnya cukup tinggi, jadi sekitar 3,2 juta ton. Jadi seyogyanya semua bisa tersapa melalui pendistribusian yang disiapkan oleh Bulog, baik untuk SPHP maupun Minyakita,"" tutur dia. Pewarta: Ananto Pradana Editor: Vicki Febrianto COPYRIGHT © ANTARA 2026 Dilarang keras mengambil konten, melakukan crawling atau pengindeksan otomatis untuk AI di situs web ini tanpa izin tertulis dari Kantor Berita ANTARA.",https://jatim.antaranews.com/berita/1069453/khofifah-minta-kepala-daerah-proaktif-cek-perkembangan-harga-sembako,antara_jatim,https://img.antaranews.com/cache/350x233/2026/05/29/1001259674.jpg
Pemkot Malang target tempat relokasi pedagang Pasar Gadang ranpung Juni,"Pewarta: Ananto Pradana Editor : Astrid Faidlatul Habibah COPYRIGHT © ANTARA 2026 Dilarang keras mengambil konten, melakukan crawling atau pengindeksan otomatis untuk AI di situs web ini tanpa izin tertulis dari Kantor Berita ANTARA.",2026-07-02T05:11:52.018787+00:00,,,"Malang, Jawa Timur (ANTARA) - Pemerintah Kota (Pemkot) Malang, Jawa Timur, menyebutkan pembangunan tempat untuk relokasi sementara bagi pedagang Pasar Induk Gadang tuntas keseluruhan pada Juni 2026. Kepala Dinas Koperasi Perindustrian dan Perdagangan (Diskopindag) Kota Malang Eko Sri Yuliadi di Kota Malang, Kamis, mengatakan progres pengerjaan bangunan relokasi pedagang kini tersisa sekitar 15 persen atau dalam tahap pengerjaan akhir. ""Tempat relokasi prosesnya yang sudah selesai sekitar 85 persen dan masih kurang 15 persen, itu untuk tahap finishing, semoga selesai Juni,"" kata Eko. Eko menyampaikan bahwa pembangunan tempat relokasi sepenuhnya tidak menggunakan Anggaran Pendapatan dan Belanja Daerah (APBD) Kota Malang tetapi murni dari hasil swadaya para pedagang. Para pedagang dikatakannya juga mempunyai kesadaran untuk berpindah tempat berdagang secara mandiri demi mendukung kelancaran penataan kawasan Pasar Induk Gadang yang dilakukan oleh Pemkot Malang. ""Tidak ada perubahan atau perpindahan aset milik pemerintah kepada perorangan, sehingga aset tetap milik pemerintah daerah,"" ucap dia. Dia menyampaikan penataan di tempat itu memiliki banyak tujuan, yakni sebagai solusi mengatasi persoalan kemacetan lalu lintas, mengembalikan fungsi jalan, dan menciptakan citra Pasar Induk Gadang sebagai pusat berbelanja dan pusat grosir bahan pangan yang bersih, rapi serta nyaman. Melalui langkah itu pula pihaknya berkeyakinan mampu melancarkan sumbangan retribusi pasar untuk pendapatan asli daerah (PAD) yang per tahun diperkirakan sekitar Rp9,5 miliar. ""Terus juga berdampak terhadap retribusi parkir, karena sudah dikelola oleh Dinas Perhubungan sehingga semuanya tertata dengan baik,"" ucapnya. Selain itu, kata dia, seluruh infrastruktur tempat relokasi rampung terbangun maka pengerjaan akan berlanjut pada pelaksanaan perbaikan jalan akses Pasar Gadang ke arah wilayah Bumiayu. ""Pakai izin pararel dengan pengerjaan pengaspalan jalan karena kemungkinan (perbaikan jalan) dilaksanakan pada pertengahan Juni,"" kata dia. Pewarta: Ananto Pradana Editor: Astrid Faidlatul Habibah COPYRIGHT © ANTARA 2026 Dilarang keras mengambil konten, melakukan crawling atau pengindeksan otomatis untuk AI di situs web ini tanpa izin tertulis dari Kantor Berita ANTARA.",https://jatim.antaranews.com/berita/1069275/pemkot-malang-target-tempat-relokasi-pedagang-pasar-gadang-ranpung-juni,antara_jatim,https://img.antaranews.com/cache/350x233/2026/05/28/1001258383.jpg
Terminal Arjosari Malang layani 8.652 penumpang libur Idul Adha,"Pewarta: Ananto Pradana Editor : Astrid Faidlatul Habibah COPYRIGHT © ANTARA 2026 Dilarang keras mengambil konten, melakukan crawling atau pengindeksan otomatis untuk AI di situs web ini tanpa izin tertulis dari Kantor Berita ANTARA.",2026-07-02T05:11:52.496088+00:00,,,"Malang, Jawa Timur (ANTARA) - Terminal Tipe A (TTA) Arjosari Malang, Jawa Timur, melayani sebanyak 8.652 penumpang bus antara kota dalam provinsi (AKDP) dan antar kota antar provinsi (AKAP) pada libur Idul Adha 1447 H. Pengawas Satuan Pelayanan Terminal TTA Arjosari Malang Balai Pengelola Transportasi Darat (BPTD) Kelas II Jawa Timur Mega Perwira Donowati di Kota Malang, Kamis, mengatakan angka tersebut merupakan catatan akumulasi dari jumlah keberangkatan dan kedatangan penumpang, pada hari H Idul Adha atau Rabu (27/5). ""Berdasarkan catatan kami saat Idul Adha jumlah keberangkatan AKDP sebanyak 3.878 orang dan kedatangan sebanyak 3.694 orang. Sedangkan, keberangkatan penumpang AKAP 665 orang dan kedatangan 415 orang sehingga totalnya 8.652 penumpang,"" kata Mega. Jumlah penumpang saat Idul Adha lebih tinggi jika dibandingkan dengan rata-rata volume harian keberangkatan maupun kedatangan penumpang di terminal tersebut yang totalnya sekitar 3.600an orang, dengan rincian 3.300 penumpang bus AKDP dan 300 penumpang bus AKAP. Meski demikian, Mega menyatakan bahwa jumlah kedatangan dan keberangkatan penumpang kemarin cenderung lebih rendah jika dibandingkan pada Selasa (26/5) yang jumlahnya tercatat sebesar 11.148 penumpang, terdiri dari 9.297 penumpang bus AKDP dan 1.851 penumpang bus AKAP. Penurunan jumlah penumpang disebabkan karena masyarakat banyak yang memilih melakukan perjalanan liburan pada H-1 Idul Adha. ""Pada Selasa itu penumpang sampai membeludak,"" ucapnya. Kondisi itu mengharuskan pengelola Terminal Arjosari mengatur sirkulasi masuk dan keluar bus dengan mempercepat jadwal keberangkatan penumpang menggunakan unit yang tersedia. Langkah itu diambil karena beberapa bus juga mengalami keterlambatan kedatangan imbas kepadatan arus lalu lintas di beberapa daerah. ""Seperti bus dari jalur Probolinggo dan Banyuwangi kemarin terlambat 45 menit dari jadwal kedatangan, penumpang tidak ada yang telantar,"" kata dia. Terminal Arjosari memastikan skema serupa akan tetap dilakukan, sebab potensi kepadatan penumpang masih bisa muncul saat libur Hari Raya Waisak yang bertepatan dengan akhir pekan atau pada Minggu (31/5) dan peringatan Hari Lahir Pancasila pada Senin (1/6). Pewarta: Ananto Pradana Editor: Astrid Faidlatul Habibah COPYRIGHT © ANTARA 2026 Dilarang keras mengambil konten, melakukan crawling atau pengindeksan otomatis untuk AI di situs web ini tanpa izin tertulis dari Kantor Berita ANTARA.",https://jatim.antaranews.com/berita/1069260/terminal-arjosari-malang-layani-8652-penumpang-libur-idul-adha,antara_jatim,https://img.antaranews.com/cache/350x233/2026/05/28/1001258239.jpg
Pemkot Malang kembangkan wisata melalui skema integrasi kawasan,"Pewarta: Ananto Pradana Editor : Vicki Febrianto COPYRIGHT © ANTARA 2026 Dilarang keras mengambil konten, melakukan crawling atau pengindeksan otomatis untuk AI di situs web ini tanpa izin tertulis dari Kantor Berita ANTARA.",2026-07-02T05:11:53.726898+00:00,,,"Malang Raya (ANTARA) - Pemerintah Kota (Pemkot) Malang, Jawa Timur menyiapkan desain pengembangan pariwisata dengan fokus pada upaya pengintegrasian antara kawasan destinasi wisata dengan kampung tematik. Wali Kota Malang Wahyu Hidayat di Kota Malang, Jawa Timur, Kamis, mengatakan, konsep tersebut guna memperkaya opsi pilihan tujuan wisata yang akan memberikan dampak terhadap pemaksimalan potensi di masing-masing lokasi. ""Kami sudah ada skenarionya untuk mengembangkan wisata sehingga keunggulan yang ada di masing-masing tempat bisa dilihat secara keseluruhan, tidak hanya di satu tempat saja,"" kata Wahyu. Dia menjelaskan di Kota Malang sebenarnya terdapat banyak tempat memiliki potensi wisata, tetapi belum dimaksimalkan keseluruhan. Ia mencontohkan wisatawan yang datang ke kota itu dikatakannya begitu mengenali Kayutangan Heritage tetapi masih belum begitu mengenal area Pasar Splendid, padahal dua lokasi tersebut saling berdekatan. Kemudian, skema pengintegrasian ini juga akan mencakup pengembangan kampung-kampung tematik dengan menitikberatkan pada pengenalan keunggulan maupun ciri khas yang dimiliki masing-masing tempat. Berdasarkan data dari Dinas Kepemudaan, Olahraga, dan Pariwisata (Disporapar) setempat menyebutkan jumlah kampung tematik di wilayah setempat berjumlah 23 lokasi tapi yang aktif hanya sekitar 10 lokasi. ""Kami kembangkan untuk dijadikan satu, termasuk tempat yang sebenarnya unggulan karena belum dimanfaatkan dengan baik,"" ucapnya. Pemkot Malang kini masih mengkaji skema pengembangan yang telah disiapkan secara internal dan berencana akan melakukan pembahasan bersama perguruan tinggi. ""Kalau investornya ada beberapa yang datang ke saya, ada tiga tapi konsepnya harus dimatangkan terlebih dahulu. Terus kami sudah mengajukan untuk mendapatkan bantuan dari bank dunia karena ada (program) untuk pengelolaan satu kawasan heritage,"" ucap dia. Pemerintah daerah setempat optimistis jika rencana pengembangan dapat terealisasi sebagaimana skema awal, maka pariwisata di Kota Malang akan lebih luas dikenal oleh masyarakat. Pemkot Malang mematok target 3,4 kunjungan wisata pada 2026, hingga triwulan pertama tahun ini realisasi dari angka yang dicanangkan sebanyak 807.160 orang, terdiri dari 797.365 wisatawan nusantara dan 9.766 merupakan wisatawan mancanegara. Pewarta: Ananto Pradana Editor: Vicki Febrianto COPYRIGHT © ANTARA 2026 Dilarang keras mengambil konten, melakukan crawling atau pengindeksan otomatis untuk AI di situs web ini tanpa izin tertulis dari Kantor Berita ANTARA.",https://jatim.antaranews.com/berita/1069197/pemkot-malang-kembangkan-wisata-melalui-skema-integrasi-kawasan,antara_jatim,https://img.antaranews.com/cache/350x233/2026/01/07/penataan-kawasan-wisata-heritage-kayutangan-2701669.jpg
KAI layani 5.460 penumpang di Stasiun Malang selama libur Idul Adha,"Pewarta: Ananto Pradana Editor : Astrid Faidlatul Habibah COPYRIGHT © ANTARA 2026 Dilarang keras mengambil konten, melakukan crawling atau pengindeksan otomatis untuk AI di situs web ini tanpa izin tertulis dari Kantor Berita ANTARA.",2026-07-02T05:11:53.941615+00:00,,,"Malang, Jawa Timur (ANTARA) - PT Kereta Api Indonesia (KAI) Daerah Operasi 8 Surabaya melayani sebanyak 5.460 penumpang di Stasiun Malang, Kota Malang, Jawa Timur saat momen libur Idul Adha 2026. Manajer Humas PT KAI Daerah Operasi 8 Surabaya Mahendro Trang Bawono dikonfirmasi dari Kota Malang, mengatakan, 5.460 penumpang di Stasiun Malang merupakan akumulasi dari jumlah kedatangan dan keberangkatan penumpang. ""Jumlah penumpang di Stasiun Malang pada libur Idul Adha hari ini ada 2.749 orang berangkat dan 2.711 orang tiba, totalnya 5.460 penumpang,"" kata Mahendro dikonfirmasi dari Kota Malang, Rabu. KAI Surabaya juga memperkirakan selama rangkaian periode libur dan cuti bersama Idul Adha, akhir pekan, Hari Raya Waisak, hingga peringatan Hari Lahir Pancasila atau pada 26 Mei hingga 1 Juni 2026 akan ada 29.837 penumpang datang maupun berangkat dari Stasiun Malang. Rinciannya jumlah penumpang itu, terdiri dari 15.269 penumpang berangkat dan 14.568 penumpang tiba di stasiun itu. Guna mengoptimalkan pelayanan, KAI Daerah Operasi 8 mengoperasionalkan 12 perjalanan kereta api, dengan total kapasitas selama 40 ribu tempat duduk pada periode liburan akhir Mei hingga awal Juni 2026. ""Relasi kereta apinya mulai Malang - Bandung, Malang - Surabaya, Malang - Pasar Senen, Malang - Ketapang (Banyuwangi), Malang - Purwokerto, sampai Malang - Gambir,"" ujarnya. Dalam rangka mendukung kelancaran dan kenyamanan pelaku mobilisasi perjalanan liburan maka pihaknya memaksimalkan penyelenggaraan aktivitas layanan melalui pengoptimalan seluruh fasilitas yang terdapat di Stasiun Malang. Petugas keamanan dan pelayanan di tempat itu telah disiagakan di sejumlah titik guna mempercepat proses boarding yang dilakukan oleh para penumpang. Selain itu, pihaknya mengimbau kepada para calon pelaku perjalanan agar datang lebih awal dari jadwal keberangkatan kereta api sehingga tak sampai terjadi penumpukan antrean. ""Kami mengimbau agar penumpang supaya mengikuti arahan dari petugas sehingga proses keberangkatan berjalan tertib dan lancar,"" tuturnya. Pewarta: Ananto Pradana Editor: Astrid Faidlatul Habibah COPYRIGHT © ANTARA 2026 Dilarang keras mengambil konten, melakukan crawling atau pengindeksan otomatis untuk AI di situs web ini tanpa izin tertulis dari Kantor Berita ANTARA.",https://jatim.antaranews.com/berita/1069089/kai-layani-5460-penumpang-di-stasiun-malang-selama-libur-idul-adha,antara_jatim,https://img.antaranews.com/cache/350x233/2026/05/27/1001256416.jpg
Pemkot Malang mendelegasikan pengelolaan tiga lokasi JPL ke KAI,"Pewarta: Ananto Pradana Editor : Vicki Febrianto COPYRIGHT © ANTARA 2026 Dilarang keras mengambil konten, melakukan crawling atau pengindeksan otomatis untuk AI di situs web ini tanpa izin tertulis dari Kantor Berita ANTARA.",2026-07-02T05:11:54.228549+00:00,,,"Malang Raya (ANTARA) - Pemerintah Kota (Pemkot) Malang, Jawa Timur mengajukan pendelegasian pengelolaan tiga lokasi jalur perlintasan langsung (JPL) kepada PT Kereta Api Indonesia (KAI), dalam rangka meningkatkan keselamatan masyarakat. ""Jadi begini ada pertimbangan meningkatkan keselamatan bagi masyarakat, artinya pengendara maupun pengguna layanan kereta api sehingga diusulkan lah itu (pengelolaannya ke KAI),"" kata Kepala Dinas Perhubungan (Dishub) Kota Malang Widjaja Saleh Putra di Kota Malang, Rabu. Tiga perlintasan yang diajukan untuk diajukan pengelolaannya ke PT KAI adalah JPL 61 dan JPL 62 wilayah Kelurahan Purwodadi, Kecamatan Blimbing serta JPL 81 di Kelurahan Kebonsati, Kecamatan Sukun. Widjaja menjelaskan di tiga perlintasan langsung itu saat ini pengelolaannya masih dilakukan secara swadaya. Pihaknya juga menempatkan personel internal yang khusus melakukan penjagaan di sana. Lebih lanjut, di setiap JPL telah dilengkapi dengan palang perlintasan kereta api yang dioperasionalkan oleh petugas. Sedangkan, untuk sistem informasi jadwal kereta api melintas masih semi manual menggunakan handy talkie. Kondisi itu dinilai menuntut ketelitian lebih dari petugas di tiga perlintasan sebidang untuk memastikan kelancaran layanan kereta api sekaligus menjaga keselamatan masyarakat. ""Sehingga butuh optimalisasi, PT KAI berinisiatif menyampaikan kepada kami soal mana yang bisa dikelola,"" ujarnya. Dikonfirmasi terpisah, Manager Humas PT KAI Daerah Operasi 8 Surabaya Mahendro Trang Bawono mengatakan surat pendelegasian dari daerah merupakan payung hukum dalam pelaksanaan pengelolaan JPL oleh KAI. ""Undang-Undang Nomor 23 Tahun 2007 (tentang Perkeretaapian) itu pengelolaan itu kan dari pemerintah daerah,"" kata dia. Menurut dia, melalui surat tersebut pihaknya bisa memetakan prioritas kebutuhan yang perlu disediakan di setiap perlintasan setelah proses pendataan selesai. Dari mekanisme yang berjalan, KAI akan menyesuaikan kebutuhan di tiga perlintasan langsung dengan ketersediaan anggaran. ""Nanti bisa diketahui apa kebutuhannya, bisa dibangun pos, gardu, palang perlintasannya, hingga penjagaan 24 jam. Untuk yang liar bisa ditutup,"" ujarnya. Pewarta: Ananto Pradana Editor: Vicki Febrianto COPYRIGHT © ANTARA 2026 Dilarang keras mengambil konten, melakukan crawling atau pengindeksan otomatis untuk AI di situs web ini tanpa izin tertulis dari Kantor Berita ANTARA.",https://jatim.antaranews.com/berita/1069032/pemkot-malang-mendelegasikan-pengelolaan-tiga-lokasi-jpl-ke-kai,antara_jatim,https://img.antaranews.com/cache/350x233/2026/05/27/1001256249.jpg
Polisi menduga ledakan rumah di Malang disebabkan petasan racikan,"Pewarta: Ananto Pradana Uploader : Abdullah Rifai COPYRIGHT © ANTARA 2026 Dilarang keras mengambil konten, melakukan crawling atau pengindeksan otomatis untuk AI di situs web ini tanpa izin tertulis dari Kantor Berita ANTARA.",2026-07-02T05:11:54.640767+00:00,,,"Malang Raya (ANTARA) - Kepolisian Resor (Polres) Malang menduga ledakan di sebuah rumah di Dusun Sumbul, Desa Klampok, Kecamatan Singosari, Kabupaten Malang, Jawa Timur, berasal dari petasan racikan yang diproduksi di lokasi kejadian itu. Kepala Seksi Humas Polres Malang AKP Bambang Subinanjar di Malang, Rabu, mengatakan dugaan itu didasari hasil olah tempat kejadian perkara (TKP) awal dan pengumpulan barang bukti, di antaranya selongsong berisi residu serbuk, dan alat yang diduga digunakan untuk meracik petasan itu. ""Tim dari kepolisian setempat bersama Tim Jibom Den Gegana Satuan Brimob dan Bidang Laboratorium Forensik Kepolisian Daerah (Polda) Jawa Timur. melakukan sterilisasi lokasi, olah TKP lanjutan, pengambilan sampel, serta mengamankan 18 barang bukti dari lokasi kejadian,"" kata Bambang. Personel gabungan itu, kata dia, turut mengamankan beberapa barang bukti lain berupa alat pemadat, sumbu petasan, hingga serpihan kertas dengan sisa bubuk. ""Seluruh barang bukti sedang diuji secara laboratoris untuk memastikan kandungannya,"" ucapnya. Polres Malang bersama Polda Jawa Timur kini masih melakukan penyelidikan guna mengungkap asal usul bahan peledak tersebut. Berdasarkan keterangan dari Polres Malang, peristiwa ledakan di sebuah rumah itu terjadi pada Minggu (24/5) malam dan menyebabkan enam orang anggota keluarga mengalami luka-luka. Dari enam orang itu terdapat satu korban bernama Syamsul Arifin (26) mengalami luka bakar sekitar 60 persen dan telah menjalani perawatan intensif di Rumah Sakit Umum Daerah dr Saiful Anwar, Kota Malang. Sedangkan, untuk lima anggota keluarga lainnya, yakni Yatin (52), Nur Vitaniyah (25), Malinda (15), Kenzi Alfaro (3), dan Febriansyah mengalami luka ringan. Ledakan di sebuah rumah di Malang yang diduga diakibatkan petasan itu tidak hanya terjadi kali ini saja, sebab pada Sabtu (23/5) kejadian serupa muncul di Desa Jenggolo, Kecamatan Kepanjen, Kabupaten Malang dan menewaskan satu orang penghuni berinisial S (48). Berkaca dari kejadian itu, Bambang menyampaikan pihaknya terus berupaya meningkatkan upaya pencegahan terulangnya kejadian itu melalui pelaksanaan patroli keamanan lingkungan. ""Kami mengimbau masyarakat agar tidak merakit atau menyimpan bahan petasan karena sangat berbahaya dan berpotensi menimbulkan korban jiwa,"" ujarnya. Pewarta: Ananto Pradana Uploader: Abdullah Rifai COPYRIGHT © ANTARA 2026 Dilarang keras mengambil konten, melakukan crawling atau pengindeksan otomatis untuk AI di situs web ini tanpa izin tertulis dari Kantor Berita ANTARA.",https://jatim.antaranews.com/berita/1069017/polisi-menduga-ledakan-rumah-di-malang-disebabkan-petasan-racikan,antara_jatim,https://img.antaranews.com/cache/350x233/2026/05/27/1001256071.jpg
Produsen besek bambu di Kota Malang banjir pesanan jelang Idul Adha,"Pewarta: Ananto Pradana Editor : Vicki Febrianto COPYRIGHT © ANTARA 2026 Dilarang keras mengambil konten, melakukan crawling atau pengindeksan otomatis untuk AI di situs web ini tanpa izin tertulis dari Kantor Berita ANTARA.",2026-07-02T05:11:54.973749+00:00,,,"Malang, Jawa Timur (ANTARA) - Pelaku usaha kecil menengah (UKM) produsen besek bambu untuk wadah daging kurban di Kota Malang, Jawa Timur dibanjiri pesanan, menjelang Hari Raya Idul Adha 2026. Salah satu pelaku UKM kerajinan dari bahan bambu, bernama Lumima Diass di Kota Malang, Selasa, mengatakan, peningkatan pesanan besek bambu sejak dua bulan menjelang Idul Adha. ""Memang untuk besek ada peningkatan dari segi permintaan, Idul Adha tahun ini kami menerima (pesanan) 1.000 besek. Sedangkan saat hari biasa itu pesanan yang diterima antara 50an sampai 100an besek,"" kata dia. Dalam sehari, kata dia, setiap satu perajin besek di tempat usahanya mampu memproduksi setidaknya 20-30 besek berbagai ukuran. Besek yang diproduksi tersebut memiliki ukuran beragam mulai dari 15x15 sentimeter dengan kapasitas satu kilogram daging, 20x20 sentimeter yang mampu menampung dua kilogram daging, dan ukuran 28x28 sentimeter untuk lima kilogram daging. ""Harga satuan besek yang ukuran 15x15 sentimeter Rp3 ribu, untuk ukuran 20x20 sentimeter Rp5 ribu, dan yang 28x28 sentimeter Rp8 ribu. Pesanan masuk mayoritas dari yayasan tapi beberapa juga ada dari takmir masjid,"" ujarnya. Guna mengantisipasi keterlambatan penyelesaian pesanan, dirinya mengaku sampai harus membuat timeline yang dijadikan sebagai acuan pengerjaan pesanan pelanggan. Langkah itu dikatakannya begitu penting, mengingat kerajinan itu butuh juga perlu melalui proses finishing yang akan menjadi penentu kualitas dan ketahanan besek dari paparan jamur. ""Bahasanya kami tidak bisa menimbun,"" kata dia. Selain itu, sebagai pelaku UKM dia menyampaikan bahwa juga mendapatkan beberapa program pembinaan dari pemerintah daerah hingga pemerintah pusat, seperti pameran, business matching, maupun kurasi produk. ""Kami mengejar pembinaan dari BUMN juga,"" katanya. Terpisah, Wali Kota Malang Wahyu Hidayat menyampaikan pihaknya sudah rutin melakukan pelatihan maupun perluasan akses pasar bagi seluruh pelaku UKM maupun UMKM setempat. ""Kami ada Sahabat UMKM ini menjadi solusi terhadap akses pembiayaan dan pemasaran pelaku usaha, terus ada upaya memberikan kemudahan promosi untuk mengenalkan produk,"" ucapnya. Tak hanya sampai di situ, pihaknya beberapa kali telah memberikan bantuan peralatan guna memudahkan proses produksi. ""Semua kami berikan dengan tujuan agar pelaku usaha ini naik kelas,"" kata dia. Pewarta: Ananto Pradana Editor: Vicki Febrianto COPYRIGHT © ANTARA 2026 Dilarang keras mengambil konten, melakukan crawling atau pengindeksan otomatis untuk AI di situs web ini tanpa izin tertulis dari Kantor Berita ANTARA.",https://jatim.antaranews.com/berita/1068877/produsen-besek-bambu-di-kota-malang-banjir-pesanan-jelang-idul-adha,antara_jatim,https://img.antaranews.com/cache/350x233/2026/05/26/1001254373.jpg
