title,published_date,scraped_at,author,category,content,url,source,editor,image_url
Pendaftar di Malang Bisa Mendaftar SPMB SMA/SMK Mulai Hari Ini,2026-06-11,2026-06-25T03:26:08.596499+00:00,Indah Mei Yunita,Pendidikan,"KEPANJEN - Sistem Penerimaan Murid Baru (SPMB) SMA/SMK dimulai hari ini (11/6). Tahap pertama yakni jalur domisili berlangsung pada 11-12 Juni 2026. Jalur tersebut diperuntukkan bagi calon siswa yang berdomisili di wilayah dalam rayon dan calon siswa SMK yang berdomisili di wilayah dalam rayon atau luar rayon.
“Tahapan SPMB sudah berjalan sekarang berproses tahap pengambilan PIN (Personal Identification Number). Hari ini (9/6) pukul 23.00 terakhir,” ujar Kepala Cabang Dinas Pendidikan (Cabdindik) Kabupaten Malang Dwi Anggraeni.
Per Senin (8/6) pukul 13.00, dari kuota 15.484 siswa SMA dan SMK, terdapat 15.089 calon siswa yang mendapatkan PIN dan sudah ditangani.
“Sedangkan 395 siswa masih belum dan terus berproses,” imbuhnya.
Dia menyebut, informasi terkait SPMB sudah tercantum di situs web SPMB Jatim. Di antaranya, kuota jalur domisili SMA yakni 35 persen dari daya tampung satuan pendidikan. Persentase tersebut terbagi atas jalur domisili reguler untuk lulusan SMP/MTs/sederajat sebelum tahun 2026 sebanyak 1 persen, lulusan SMP/MTs/sederajat tahun 2026 sebanyak 19 persen, dan jalur domisili sebaran lulusan tahun 2026 sebanyak 15 persen. Sementara itu, kuota jalur domisili SMK adalah 10 persen dari daya tampung satuan pendidikan.
Kemudian, calon siswa SMA dapat memilih paling banyak tiga sekolah dengan ketentuan di wilayah dalam rayon. Sedangkan calon siswa SMK dapat memilih maksimal tiga konsentrasi keahlian dalam satu SMK atau SMK yang berbeda di wilayah dalam rayon maupun luar rayon.
Jika calon siswa yang mendaftar melalui jalur domisili reguler sudah melampaui kuota yang ditetapkan, maka penentuan penerimaan dilakukan dengan urutan prioritas. Yakni nilai kemampuan akademik, jarak tempat tinggal terdekat ke sekolah, dan usia. Nilai kemampuan akademik tersebut merupakan gabungan rata-rata nilai rapor dengan bobot 60 persen dan rata-rata nilai Tes Kemampuan Akademik (TKA)
dengan bobot 40 persen.
Sementara itu, jika pendaftar SMK melampaui kuota penentuan penerimaan dilakukan dengan prioritas jarak tempat tinggal terdekat ke sekolah, usia yang lebih tua, dan waktu pendaftaran.(yun/dan)",https://radarmalang.jawapos.com/pendidikan/2606110012/pendaftar-di-malang-bisa-mendaftar-spmb-smasmk-mulai-hari-ini,radar_malang,Mahmudan,https://cdn-jpr.jawapos.com/images/15/2026/04/17/ilustrasi-spmb-google-xqUUd.webp
"Dari Deteksi Anemia hingga Kedaulatan Energi, Gebrakan 4 Guru Besar Baru UMM Hadirkan Manfaat untuk Masyarakat",2026-06-11,2026-06-25T03:26:08.872239+00:00,A. Nugroho,Pendidikan,"MALANG, RADAR MALANG
- Universitas Muhammadiyah Malang (UMM) resmi mengukuhkan empat Guru Besar baru di Aula GKB 4 Lantai 9 Kampus III UMM, Kamis ini (11/6). Keempatnya adalah Prof Dr Ir Sulianto, M.T, Prof Dr Ir Lailis Syafa'ah, M.T, Prof Dr Machmud Effendy, M.Eng, dan Prof Ir Henik Sukorini, MP, Ph.D, IPM.
Pengukuhan ini menjadi langkah strategis Kampus Putih dalam memperluas hilirisasi riset multidisiplin, sekaligus mempertegas komitmen berkelanjutan universitas dalam menghasilkan inovasi aplikatif yang solutif. Hal ini dimaksudkan bagi kemaslahatan masyarakat luas serta kemandirian bangsa.
Pada sesi orasi ilmiah pertama, Prof. Dr. Ir. Sulianto, M.T. memaparkan hasil riset mendalamnya mengenai model pengelolaan sumber daya air berkelanjutan untuk menghadapi ancaman krisis lingkungan global. Ia menyampaikan bahwa metode estimasi hidrologi yang presisi menggunakan data historis sangat krusial dalam menjaga stabilitas ketahanan air nasional demi mendukung kemandirian sebuah negara.
""Topik ini sangat relevan dengan upaya memantapkan sistem pertahanan keamanan negara dan mendorong kemandirian bangsa melalui pemenuhan ketahanan air jangka panjang secara merata,"" jelas Sulianto.
Selanjutnya, Prof Dr Ir Lailis Syafa'ah, M.T di bidang Rekayasa Biomedis memperkenalkan sebuah terobosan teknologi deteksi dini gejala anemia non-invasif tanpa menggunakan jarum suntik. Ia menjelaskan bahwa inovasi mutakhir tersebut memanfaatkan kamera ponsel pintar untuk memotret konjungtiva mata pasien yang kemudian langsung dianalisis menggunakan algoritma kecerdasan buatan secara instan.
""Sinergi komputasi cerdas ini mampu mengeluarkan estimasi indikasi anemia hanya dalam hitungan dua hingga empat detik saja, sebuah lompatan efisiensi yang luar biasa jika dibandingkan dengan pengujian laboratorium konvensional,"" tegas Lailis.
Sementara itu, Prof Dr Machmud Effendy, M.Eng menyoroti urgensi transisi energi nasional melalui optimalisasi sistem pembangkit berbasis energi terbarukan guna mencapai kedaulatan energi yang mandiri. Ia memaparkan bahwa ketergantungan yang terlampau tinggi terhadap pasokan energi fosil konvensional akan memicu penurunan cadangan energi global serta mengancam kesetabilan ekonomi makro nasional.
""Ketergantungan yang tinggi terhadap energi fosil tidak hanya menyebabkan cadangan energi terus menurun, tetapi juga menjadi tantangan serius bagi kedaulatan energi nasional Indonesia di masa depan,"" ungkap Machmud.
Terakhir ada Prof Ir Henik Sukorini, MP, Ph.D, IPM dari bidang Fitopatologi menekankan pentingnya beralih ke sistem pengendalian hayati demi memulihkan kerusakan tanah tropis akibat paparan zat kimia pertanian yang berlebihan. Ia memperingatkan bahwa ketergantungan akut petani terhadap pestisida sintetis telah merusak mikroorganisme tanah dan mengancam keamanan pangan jangka panjang.
""Pengendalian hayati merupakan langkah penyelamatan darurat (emergency exit) yang harus segera diambil oleh seluruh pihak untuk memulihkan tanah tropis kita yang saat ini sedang mengalami degradasi parah,"" pungkas Henik.
Sementara itu, Rektor UMM Prof Dr Nazaruddin Malik, S.E., M.Si menegaskan bahwa penambahan profesor baru ini merupakan momentum penting untuk memperkuat peran universitas sebagai pusat keunggulan akademik yang berdampak nyata bagi peradaban.
""Keempat orasi ilmiah yang disampaikan hari ini tidak hanya meneguhkan kedudukan akademik para profesor, tetapi juga mempertegas komitmen UMM dalam pengembangan ilmu pengetahuan yang relevan dengan kebutuhan nyata masyarakat, bangsa, dan peradaban,"" ujar Nazaruddin.
Acara pengukuhan akbar ini diharapkan tidak sekadar menjadi agenda seremonial akademik tahunan di lingkungan kampus. Kehadiran para pakar baru di puncak karier akademisnya harus menjadi pemantik semangat bagi seluruh sivitas akademika UMM untuk terus menghidupkan ekosistem riset yang membumi. Implementasi nyata dari setiap inovasi lintas disiplin ilmu tersebut menjadi kunci utama untuk menjawab tantangan zaman dan membawa dampak positif bagi kemandirian bangsa yang berkemajuan.
(*)",https://radarmalang.jawapos.com/pendidikan/2606110032/dari-deteksi-anemia-hingga-kedaulatan-energi-gebrakan-4-guru-besar-baru-umm-hadirkan-manfaat-untuk-masyarakat,radar_malang,A. Nugroho,https://cdn-jpr.jawapos.com/images/15/2026/06/11/unggul-empat-guru-besar-baru-yang-dikukuhkan-umm-kamis-ini-116-sAest.webp
Partisipasi Masyarakat Dorong Kemajuan Infrastruktur dan Prestasi SMK NEGA,2026-06-11,2026-06-25T03:26:09.162637+00:00,A. Nugroho,Pendidikan,"KABUPATEN MALANG, RADAR MALANG
- Berbagai prestasi dan peningkatan kualitas pendidikan SMKN 1 Gedangan (SMK NEGA) tak lepas dari partisipasi masyarakat, khususnya para wali murid. Hal tersebut menjadi cerminan bagaimana sekolah mampu menjalin sinergi dan kolaborasi dalam berbagai program sekolah.
Hal ini seperti dikatakan Drs H Mulyadi MPd selaku Ketua Komite SMK NEGA. “Kami berusaha sebaik mungkin memfasilitasi dan mewujudkan program sekolah melalui program partisipasi masyarakat yang bersumber dari seluruh wali murid SMK NEGA,” ujarnya.
Menurutnya, partisipasi masyarakat sendiri diatur dalam Pasal 12 Ayat (2) huruf b UU No. 20 Tahun 2003 tentang Sistem Pendidikan Nasional (Sisdiknas). Dalam aturan tersebut menyatakan bahwa setiap peserta didik memiliki kewajiban untuk ikut menanggung biaya penyelenggaraan pendidikan. Kecuali bagi mereka yang dibebaskan dari kewajiban tersebut sesuai dengan peraturan perundang-undangan yang berlaku.
Terkait hal ini, Kepala SMKN 1 Gedangan Ainun Huda MPd menyatakan berterima kasih atas dukungan yang luar biasa dari seluruh wali murid dan keluarga besar SMK NEGA.
Menurutnya, SMK NEGA dan seluruh tenaga kependidikannya berusaha semaksimal mungkin memberikan pelayanan terbaik bagi para siswa yang dititipkan ke sekolah. ""Semua tidak akan bisa maksimal tanpa adanya partisipasi dan sumbangsih dari masyarakat,” ujar Ainun Huda.
Ainun mengatakan sebagai tanggung jawab dari partisipasi ini, pihak sekolah terus berupaya mengejar prestasi di berbagai bidang. Para guru sebagai pembimbing dan sejumlah siswa berhasil menorehkan prestasi yang membanggakan.
Seperti dengan meraih Juara 1 LKS Dikmen Kabupaten dalam bidang lomba Accounting oleh Ananda Adi Setyawan, dan Cloud Computing oleh Beby Schalke E. Juga Juara 2 bidlom Fashion Technology oleh Andini Winda S.
Di kesempatan lain, prestasi juga diraih Habibie Al K. dan Viona Yusfika P yang menjadi Juara Harapan 1 di ajang Accounting Competition of Asia (ACA). Selain itu, Tim Kuliner SMK NEGA juga meraih Juara 3 dan Juara Favorit dalam Lomba Parade Mie Nusantara.
Terakhir tim sepak bola SMK NEGA meraih Juara 3 Piala Rektor Universitas Kepanjen.
Para lulusan SMKN 1 Gedangan tahun juga sangat membanggakan. Di antaranya yang dengan berhasil masuk di perguruan pinggi negeri (PTN) sebanyak 5 siswa, bekerja sebelum lulus sebanyak 200 siswa, dan 50 siswa sukses berwirausaha.
Berdiri sejak 2010 lalu, sekolah ini beralamat di Jalan Raya Sumberejo, Gedangan, Kabupaten Malang.
SMK NEGA saat ini memiliki beberapa program keahlian. Di antaranya Teknik Kendaraan Ringan (TKR), Akuntansi (AKT), Design Produksi Busana (DPB), Kuliner (KUL), Desain Komunikasi Visual (DKV), dan Sistem Informasi Jaringan dan Aplikasi (SIJA).
Seluruh program keahlian di SMK NEGA bersiap menuju SMK Pusak Keunggulan (SMK PK) dan Teaching Factory (TEFA). Di antaranya, AKT dengan pembuatan bank mini yang bekerja sama dengan Bank Jatim serta KUL dan DPB dengan produksi yang sudah bisa melayani pesanan warga sekitar.
Ada pula TKR dengan layanan balancing, tune up, konversi sepeda motor listrik dan service. Sedangkan, DKV bisa membuat souvenir mug, digital printing dan sablon, cutting, studio foto, serta shooting.
Terakhir ada SIJA. Bekerja sama dengan Icon Plus, mereka yang bisa melayani jasa pelayanaan pasang CCTV dan perangkatnya.
SMK NEGA juga memiliki ekstrakurikuler unggulan. Mulai dari karawitan, pramuka, bela diri, PMR, futsal dan sepak bola. Selain itu, ada bagi yang suka olahraga, ada basket, voli, pencak silat, serta taekwondo.
Tak ketinggalan, SMK NEGA juga memiliki ekstrakurikuler pramuka, tari, band, jurnalistik, dan badan dakwah islam.
Semua kemajuan SMKN 1 Gedangan saat ini tidak lepas dari partisipasi masyarakat. Terbukti dengan infrastruktur yang memadai mulai dari lapangan basket, resto kuliner, bengkel TKR, laboratorium komputer, dan kamar mandi yang dapat digunakan oleh seluruh siswa SMK NEGA.
Apalagi, SMK NEGA juga memiliki 14 orang pegawai tidak tetap (PTT), dan 1 guru tidak tetap (GTT) yang sampai saat ini belum tercover BOSDA maupun BOSNAS.
(bes)",https://radarmalang.jawapos.com/pendidikan/2606110031/partisipasi-masyarakat-dorong-kemajuan-infrastruktur-dan-prestasi-smk-nega,radar_malang,A. Nugroho,https://cdn-jpr.jawapos.com/images/15/2026/06/11/kompak-kehadiran-seluruh-wali-murid-smkn-1-gedangan-saat-pemaparan-program-sekolah-beberapa-waktu-lalu-Sfyc1.webp
"Gelar AXIS School Fest-Workshop X Jawa Pos Radar Malang, XLSMART Dorong Literasi Digital Generasi Muda",2026-06-11,2026-06-25T03:26:09.439798+00:00,A. Nugroho,Pendidikan,"KABUPATEN MALANG, RADAR MALANG
– Sebagai komitmen dari perusahaan telekomunikasi yang paling dicintai pelanggan, XLSMART menggelar acara AXIS School Fest-Workshop X Jawa Pos Radar Malang yang diikuti 450 siswa SMAN 1 Dampit, Selasa lalu (9/6). Acara spesial ini menghadirkan edukasi broadcasting, pengalaman digital baru, serta pembekalan untuk menjadi content creator yang kreatif dan bertanggung jawab.
Tak hanya itu, dalam acara ini XLSMART juga mengenalkan bagaimana konektivitas digital dapat mendukung proses produksi, distribusi, dan pengembangan konten di berbagai platform.
Begitu pula dengan rangkaian aktivitas edukatif dan interaktif lainnya. Mulai dari pengenalan dasar-dasar broadcasting, pemahaman proses produksi konten, teknik membangun ide kreatif, hingga cara menyampaikan pesan secara menarik kepada audiens.
Para peserta juga mendapatkan wawasan mengenai peran teknologi, jaringan, dan paket data dalam mendukung aktivitas kreatif seperti riset konten, pengambilan gambar, editing, publikasi, hingga interaksi dengan audiens secara real-time.
Head Of Sales XLSMART area Malang Jember, Yoyok Nurhadi mengatakan, kegiatan ini menjadi salah satu bentuk nyata bagaimana kekuatan jaringan dan layanan digital XLSMART dapat mendukung kebutuhan generasi muda yang semakin aktif menggunakan internet untuk belajar, berkomunikasi, berkreasi, serta membuka peluang baru di dunia digital.
“XLSMART percaya bahwa menjadi perusahaan yang paling dicintai pelanggan harus diwujudkan melalui layanan yang relevan, jaringan yang andal, serta program yang memberi manfaat langsung bagi masyarakat. Network leadership tidak hanya berbicara mengenai perluasan jaringan dan teknologi, tetapi juga bagaimana konektivitas tersebut dapat mendukung generasi muda untuk berkembang,"" ujarnya.
Yoyok mengatakan bahwa melalui AXIS School Fest-Workshop bersama Jawa Pos Radar Malang, XLSMART ingin mengajak pelajar memanfaatkan internet secara lebih produktif, kreatif, dan positif.
""Dengan dukungan jaringan yang terus kami perkuat, termasuk perluasan 5G Blanket secara bertahap, kami berharap semakin banyak anak muda Indonesia yang dapat melaju tanpa batas dalam mengembangkan potensi mereka,” beber Yoyok.
Melalui pendekatan ini, XLSMART tidak hanya memperkuat kualitas jaringan dan cakupan layanan, tetapi juga membangun kedekatan dengan pelanggan muda melalui program edukatif dan experimential. AXIS sebagai brand yang dekat dengan anak muda terus menghadirkan layanan data yang relevan, mudah diakses, dan sesuai dengan kebutuhan digital sehari-hari, mulai dari belajar online, streaming, gaming, media sosial, hingga pembuatan konten kreatif.
Program School Fest-Workshop X Jawa Pos Radar Malang juga menjadi bagian dari upaya XLSMART untuk memperluas dampak positif konektivitas di daerah. Dengan semakin kuatnya jaringan 4G dan pengembangan 5G Blanket di berbagai wilayah, XLSMART berkomitmen untuk mendukung ekosistem digital yang lebih inklusif, mendorong literasi broadcasting dan kreativitas digital, serta menghadirkan pengalaman pelanggan yang semakin baik, terutama bagi generasi muda yang akan menjadi bagian penting dari masa depan ekonomi digital Indonesia.
Ke depan, XLSMART akan terus menghadirkan berbagai kegiatan yang menghubungkan kekuatan jaringan, inovasi layanan, dan kebutuhan masyarakat, khususnya generasi muda. Melalui semangat 'Bersama, Melaju Tanpa Batas', XLSMART berkomitmen menjadi perusahaan telekomunikasi yang semakin dekat dan paling dicintai pelanggan, sekaligus mendukung Indonesia yang semakin terkoneksi, kreatif, dan siap menghadapi masa depan digital.
PT XLSMART Telecom Sejahtera Tbk (XLSMART) memang terus memperkuat komitmennya dalam menghadirkan konektivitas yang lebih luas, stabil, dan relevan bagi pelanggan, sejalan dengan strategi network leadership dan perluasan 5G Blanket di berbagai wilayah Indonesia. Komitmen ini juga menjadi bagian dari aspirasi XLSMART untuk menjadi perusahaan telekomunikasi yang paling dicintai pelanggan, dengan menghadirkan layanan yang tidak hanya kuat secara jaringan, tetapi juga dekat dengan kebutuhan masyarakat.
Penguatan jaringan tersebut menjadi fondasi penting bagi XLSMART untuk menghadirkan pengalaman digital yang lebih baik, tidak hanya di kota-kota besar, tetapi juga di kawasan penyangga, area pendidikan, komunitas anak muda, serta wilayah dengan aktivitas digital yang terus berkembang.
Melalui jaringan yang semakin luas dan andal, XLSMART ingin memastikan konektivitas dapat memberikan manfaat nyata bagi pelanggan dalam belajar, berkreasi, memproduksi konten, serta mengakses peluang baru di industri digital.
(bes)",https://radarmalang.jawapos.com/pendidikan/2606110030/gelar-axis-school-fest-workshop-x-jawa-pos-radar-malang-xlsmart-dorong-literasi-digital-generasi-muda,radar_malang,A. Nugroho,https://cdn-jpr.jawapos.com/images/15/2026/06/11/inovatif-xlsmart-melalui-axis-school-fest-workshop-menghadirkan-edukasi-broadcasting-dan-pengalaman-digital-baru-untuk-450-siswa-sman-1-dampit-pada-selasa-96-XP672.webp
Mau Jadi Guru? Ini Jurusan Kuliah yang Banyak Dibutuhkan di Dunia Pendidikan,2026-06-11,2026-06-25T03:26:09.740037+00:00,Choirun Nisa,Pendidikan,"MALANG, RADAR MALANG
– Profesi guru masih menjadi salah satu pilihan karier yang diminati banyak lulusan SMA.
Selain berperan penting dalam mencerdaskan generasi muda, kebutuhan tenaga pendidik di berbagai jenjang pendidikan juga terus terbuka.
Bagi siswa yang bercita-cita menjadi guru, terdapat sejumlah jurusan pendidikan yang dapat dipilih sesuai minat dan jenjang pendidikan yang ingin diajar. Dilansir dari laman Guru Binar, beberapa program studi pendidikan bahkan memiliki peluang kerja yang cukup besar karena kebutuhan tenaga pengajar yang masih tinggi di Indonesia.
Jurusan untuk Mengajar Anak Usia Dini
Salah satu jurusan yang banyak dibutuhkan adalah Pendidikan Guru Pendidikan Anak Usia Dini (PG PAUD). Program studi ini mempersiapkan mahasiswa untuk menjadi pendidik anak usia dini dengan bekal ilmu pendidikan, psikologi anak, seni, hingga kesehatan dan gizi.
Menurut laman Guru Binar, kebutuhan guru PAUD masih cukup besar karena banyak lembaga pendidikan anak usia dini yang belum memiliki tenaga pengajar sesuai kualifikasi pendidikan. Selain itu, peluang menjadi Aparatur Sipil Negara (ASN) di bidang pendidikan anak usia dini juga masih terbuka.
Selain PG PAUD, terdapat pula Pendidikan Guru Taman Kanak-Kanak (PGTK) yang berfokus pada pendidikan anak usia 4–6 tahun. Mahasiswa akan dibekali kemampuan mengajar, mendampingi perkembangan anak, serta menciptakan pembelajaran yang kreatif dan menyenangkan.
Peluang di Sekolah Dasar dan Madrasah
Bagi yang ingin mengajar di tingkat dasar, Pendidikan Guru Madrasah Ibtidaiyah (PGMI) menjadi salah satu pilihan yang menjanjikan. Jurusan ini memadukan pembelajaran ilmu umum dan pendidikan agama Islam.
Data yang dikutip Guru Binar menunjukkan jumlah Madrasah Ibtidaiyah di Indonesia mencapai puluhan ribu unit, sehingga kebutuhan tenaga pendidik di sektor ini masih cukup tinggi. Lulusan PGMI tidak hanya berpeluang menjadi guru kelas, tetapi juga dapat mengajar mata pelajaran agama maupun berkiprah di lembaga pendidikan Islam.
Persiapkan Kompetensi Sejak Kuliah
Menjadi guru tidak hanya membutuhkan penguasaan materi pelajaran, tetapi juga keterampilan mengajar, komunikasi, dan manajemen kelas. Karena itu, mahasiswa jurusan pendidikan umumnya akan mendapatkan pengalaman praktik mengajar melalui program magang maupun praktik lapangan.
Calon mahasiswa juga disarankan memilih jurusan sesuai minat dan jenjang pendidikan yang ingin diajar agar proses belajar di perguruan tinggi dapat dijalani dengan lebih optimal.",https://radarmalang.jawapos.com/pendidikan/2606110019/mau-jadi-guru-ini-jurusan-kuliah-yang-banyak-dibutuhkan-di-dunia-pendidikan,radar_malang,Aditya Novrian,https://cdn-jpr.jawapos.com/images/15/2026/06/10/ilustrasi-seorang-guru-yang-sedang-mengajar-di-depan-kelas-sumber-analitica-blog-hyKGE.webp
"Dari SMP hingga S3, Ini Peluang Beasiswa 2026 yang Bisa Dimanfaatkan",2026-06-10,2026-06-25T03:26:10.038029+00:00,Choirun Nisa,Pendidikan,"MALANG, RADAR MALANG
– Kesempatan memperoleh bantuan pendidikan pada tahun 2026 terbuka untuk berbagai jenjang, mulai dari pelajar sekolah hingga mahasiswa program doktoral.
Beragam program telah disiapkan oleh pemerintah, perguruan tinggi, perusahaan, maupun lembaga filantropi. Pilihan beasiswa tahun ini mencakup dukungan biaya pendidikan, penelitian, hingga pengembangan kompetensi.
Peluang untuk Pelajar Sekolah
Siswa SMP dan SMA dapat mengikuti Beasiswa DataPrint yang memberikan bantuan dana pendidikan sebesar Rp500 ribu bagi pelajar dan mahasiswa.
Selain itu, terdapat Beasiswa Mentari Lazismu UMY yang memberikan bantuan dana Rp700 ribu bagi siswa SD, SMP, dan SMA sederajat. Bagi siswa SMA kelas 11, tersedia pula Beasiswa Amartha Cendekia dengan bantuan pendidikan dan program pengembangan diri.
Dukungan bagi Mahasiswa dan Peneliti
Untuk mahasiswa tingkat akhir, Kementerian Pemuda dan Olahraga menyediakan Bantuan Biaya Penyelesaian Skripsi, Tesis, dan Disertasi dengan nominal hingga Rp10 juta.
Sementara itu, tenaga kependidikan dan dosen dapat memanfaatkan Beasiswa Tut Wuri Handayani yang membiayai studi S2 dan S3, termasuk biaya pendidikan, penelitian, buku, hingga biaya hidup. Program ini ditujukan bagi tenaga kependidikan PNS di lingkungan Kemdiktisaintek, LLDIKTI, dan perguruan tinggi negeri.
Kesempatan Terbuka Luas
Menurut UMN, banyaknya program beasiswa menunjukkan bahwa akses pendidikan tinggi semakin terbuka bagi masyarakat dari berbagai latar belakang.
Karena itu, pelajar dan mahasiswa disarankan untuk aktif mencari informasi, memantau jadwal pendaftaran, serta menyesuaikan pilihan beasiswa dengan kebutuhan dan jenjang pendidikan yang sedang ditempuh.",https://radarmalang.jawapos.com/pendidikan/2606100043/dari-smp-hingga-s3-ini-peluang-beasiswa-2026-yang-bisa-dimanfaatkan,radar_malang,Aditya Novrian,https://cdn-jpr.jawapos.com/images/15/2026/06/10/ilustrasi-mahasiswa-yang-sedang-menggunakan-toga-sumber-primakara-university-3WFgk.webp
"Dihadiri Kakanwil Kemenag Jatim, MTsN 2 Kota Malang Lepas 256 Lulusan Berprestasi",2026-06-10,2026-06-25T03:26:10.335692+00:00,A. Nugroho,Pendidikan,"KOTA MALANG, RADAR MALANG
— MTsN 2 Kota Malang menggelar Purnawiyata Matsandatama Angkatan ke-46 Kelas IX Tahun Pelajaran 2025/2026 di Hotel Tychi Malang. Sebanyak 256 siswa mengikuti prosesi pelepasan yang berlangsung khidmat dan penuh haru bersama orang tua/wali dengan mengusung tema “Tumbuh dalam Cerita, Terukir dalam Kenangan, Melangkah Menuju Cita.”
Acara istimewa ini dihadiri Kepala Kantor Wilayah Kementerian Agama Provinsi Jawa Timur, Dr. H. Akhmad Sruji Bahtiar, M.Pd.I dan Kepala Kantor Kementerian Agama Kota Malang, KH. Achmad Shampton, S.HI., M.Ag. Hadir pula jajaran pejabat Kementerian Agama, pengawas madrasah, kepala madrasah negeri se-Kota Malang, para purnatugas kepala madrasah, serta seluruh keluarga besar MTsN 2 Kota Malang.
Dalam sambutannya, Kepala MTsN 2 Kota Malang, Anita Yusianti, M.Pd., menyampaikan rasa syukur atas keberhasilan 256 siswa yang telah menyelesaikan pendidikan dengan baik. Anita mengapresiasi sinergi yang terjalin antara madrasah, guru, tenaga kependidikan, peserta didik, dan orang tua sehingga MTsN 2 Kota Malang terus menorehkan prestasi membanggakan di tingkat kota, provinsi, hingga nasional.
Dalam kesempatan ini, Anita juga mengungkapkan bahwa rata-rata nilai Tes Kompetensi Akademik (TKA) siswa kelas IX mencapai 91,67. ""Ini adalah capaian yang mencerminkan kualitas akademik lulusan Matsandatama,"" bebernya.
Sebagai bentuk apresiasi atas kerja keras dan dedikasi siswa, madrasah memberikan penghargaan kepada peserta didik berprestasi di bidang akademik maupun non-akademik. Penghargaan tersebut menjadi bukti komitmen MTsN 2 Kota Malang dalam mengembangkan potensi siswa secara menyeluruh.
Kepala Kantor Kementerian Agama Kota Malang, KH. Achmad Shampton, S.HI., M.Ag., dalam sambutannya berpesan agar para lulusan senantiasa menjaga adab dan menghormati guru di mana pun berada.
Menurutnya, kesuksesan tidak hanya ditentukan oleh kecerdasan dan prestasi.
""Tetapi juga oleh sikap hormat kepada guru serta rasa syukur kepada orang tua yang telah mendampingi perjalanan pendidikan kalian,"" ungkap Shampton.
Senada dengan itu, Kepala Kantor Wilayah Kementerian Agama Provinsi Jawa Timur, Dr. H. Akhmad Sruji Bahtiar, M.Pd.I., menegaskan bahwa adab merupakan fondasi utama dalam meraih keberkahan ilmu.
Akhmad Sruji mengajak seluruh lulusan untuk terus menjaga hubungan baik dengan guru dan mengamalkan ilmu yang telah diperoleh. ""Semua harus menjadi generasi yang berkarakter, berintegritas, dan mampu memberikan manfaat bagi masyarakat,"" tandasnya.
Suasana haru semakin terasa melalui pembacaan Janji Almamater, kesan dan pesan perwakilan siswa, persembahan lagu untuk guru, serta tayangan memori perjalanan belajar selama tiga tahun.
Momen tersebut menjadi pengingat akan kebersamaan, perjuangan, dan prestasi yang telah diukir bersama selama menempuh pendidikan di MTsN 2 Kota Malang.
Purnawiyata Matsandatama Angkatan ke-46 bukan sekadar seremoni pelepasan, melainkan momentum untuk meneguhkan nilai-nilai karakter, adab, dan semangat meraih cita-cita. Seluruh lulusan dilepas dengan harapan mampu menjadi generasi Matsandatama yang unggul dalam prestasi, dan kuat dalam karakter. Mereka juga diharapkan siap melanjutkan pendidikan ke jenjang yang lebih tinggi demi masa depan yang gemilang. (*)",https://radarmalang.jawapos.com/pendidikan/2606100047/dihadiri-kakanwil-kemenag-jatim-mtsn-2-kota-malang-lepas-256-lulusan-berprestasi,radar_malang,A. Nugroho,https://cdn-jpr.jawapos.com/images/15/2026/06/10/optimistis-kepala-kantor-wilayah-kementerian-agama-provinsi-jawa-timur-dr-h-akhmad-sruji-bahtiar-mpdi-saat-memberi-sambutan-ASi7x.webp
