title,published_date,scraped_at,author,category,content,url,source,editor,image_url
4.000 Pelajar SD dan SMP di Kota Malang Bakal Dapat Jatah Seragam Gratis ,2026-06-05,2026-06-25T03:26:24.223637+00:00,Andika Satria Perdana,Pendidikan,"MALANG KOTA, RADAR MALANG - Tahun ini, kuota bantuan seragam gratis di Kota Malang menyasar empat ribu pelajar. Yang menjadi prioritas yakni warga kurang mampu.
Sebagai informasi, pada 2025 jatah seragam gratis diberikan kepada seluruh siswa baru SD dan SMP negeri. Karena penyusutan anggaran pada 2026 ini, kuotanya mengalami penyusutan. Tahun lalu anggarannya Rp 6 miliar. Sementara tahun ini berkurang menjadi Rp 1,5 miliar.
Kepala Dinas Pendidikan dan Kebudayaan (Disdikbud) Kota Malang Suwarjana menyampaikan, pendataan penerima bantuan bakal dilakukan setelah Sistem Penerimaan Murid Baru (SPMB). Orang tua akan dikumpulkan sekolah untuk mendapatkan penjelasan terkait mekanisme bantuan seragam.
”Dalam tahap sosialisasi itu, wali murid akan mengisi formulir,” kata Jana. Formulir berisi tentang pertanyaan seputar kemampuan pembelian seragam. Dia menuturkan, kuota 4.000 itu akan dibagi untuk dua jenjang.
Pada jenjang SD negeri, ada 2.000 pelajar yang mendapat bantuan seragam gratis. Untuk jenjang SMP negeri juga ada 2.000 pelajar yang mendapatkannya. ”Tahun lalu setiap jenjang kuotanya 13 ribu pelajar,” imbuh Jana.
Pria kelahiran Bantul itu menambahkan, meski ada penyesuaian anggaran, pihaknya tetap melaksanakan program bantuan seragam gratis. Tujuannya untuk meringankan beban masyarakat kurang mampu. ”Untuk jenjang SMA atau SMK bukan menjadi wewenang Pemkot Malang. Sehingga (kami) tidak menganggarkan,” tandasnya.
Wakil Ketua Komisi D DPRD Kota Malang Suryadi meminta penyampaian bantuan harus benar-benar tepat sasaran. Pemkot Malang diminta tak sekadar mendata. Namun juga wajib melakukan verifikasi.
Dia menegaskan, jangan sampai pihak yang sangat membutuhkan tidak mendapat bantuan itu. Sebab, nominal seragam cukup tinggi bagi warga kurang mampu. Mencapai ratusan ribu rupiah.
”Jangan sampai anak tidak sekolah karena tidak punya seragam. Pemkot juga harus memberi kelonggaran agar pelajar tidak langsung menggunakan seragam baru,” tegasnya.
(adk/by)",https://radarmalang.jawapos.com/pendidikan/2606050010/4000-pelajar-sd-dan-smp-di-kota-malang-bakal-dapat-jatah-seragam-gratis,radar_malang,Bayu Mulya Putra,https://cdn-jpr.jawapos.com/images/15/2026/04/30/ubah-skema-seragam-gratis-sejumlah-siswa-smpn-5-malang-menunggu-bus-halokes-untuk-pulang-kemarin-pemkot-malang-tidak-lagi-memberikan-seragam-gratis-kepada-seluruh-siswa-baru-foto-darmonoradar-malang-YJKKA.webp
Lolos SNBT 2026? Simak Tahapan Alur Daftar Ulang di Universitas Brawijaya,2026-06-05,2026-06-25T03:26:24.505615+00:00,Salshabila Abidah Ardelia,Pendidikan,"MALANG, RADAR MALANG
– Universitas Brawijaya (UB) resmi membuka proses daftar ulang bagi calon mahasiswa baru jalur SNBT 2026 secara digital demi memastikan validitas data akademik. Seluruh tahapan wajib diselesaikan secara cermat karena kegagalan melakukan registrasi hingga batas waktu akan membuat status kelulusan peserta otomatis gugur.
Jadwal dan Laman Resmi Pemberkasan
Pemberkasan online berlangsung mulai tanggal 26 Mei hingga 9 Juni 2026 melalui situs
admisi.ub.ac.id.
Calon mahasiswa yang melewati tenggat waktu ini dianggap mengundurkan diri dari universitas.
Alur Pembuatan Akun & Verifikasi
Peserta wajib membuat akun admisi baru menggunakan email valid, khususnya Gmail. Setelah itu, lakukan verifikasi berkas SNBT dengan memasukkan nama, nomor pendaftaran, dan tanggal lahir.
Ketentuan Unggah Foto dan Dokumen Penting
Mahasiswa harus mengunggah foto formal terbaru ukuran 4×6 berlatar belakang merah. Surat Pernyataan dan Pakta Integritas merupakan dokumen wajib yang harus diunduh, diisi, lalu diunggah kembali ke sistem.
Tes Kesehatan & Bebas Narkoba
Fakultas nonkesehatan mensyaratkan mengunggah scan Surat Keterangan Pemeriksaan Buta Warna dari faskes atau Klinik UB bagi prodi tertentu. Sementara itu, tes bebas narkoba 3 parameter dilaksanakan di UB bersamaan dengan pengambilan jas almamater.
Bagi Fakultas Bidang Kesehatan (FK, FKG, FKH, FIKES), seluruh rangkaian tes fisik, psikologi, buta warna, dan bebas narkoba wajib dilakukan di Rumah Sakit Universitas Brawijaya (RSUB).
Pengumuman dan Pembayaran UKT
Nominal UKT proporsional dapat diakses di dashboard
mulai 18 Juni 2026. Bagi pendaftar beasiswa KIP-Kuliah, pengumuman penerimaan akan diinformasikan menyusul, termasuk tata cara pembayaran UKT.
Layanan Bantuan (Helpdesk)
UB menyediakan layanan aduan resmi melalui sistem tiket di
Halo SELMA
dengan memilih subjek ""SNBT"" untuk mengatasi kendala teknis.
Selesaikan setiap tahapan daftar ulang ini lebih awal agar seluruh berkas terverifikasi dengan aman dan status mahasiswa resmi UB terjaga.",https://radarmalang.jawapos.com/pendidikan/2606050056/lolos-snbt-2026-simak-tahapan-alur-daftar-ulang-di-universitas-brawijaya,radar_malang,Aditya Novrian,https://cdn-jpr.jawapos.com/images/15/2026/06/05/tahapan-alur-daftar-ulang-di-universitas-brawijaya-bagi-calon-mahasiswa-baru-jalur-snbt-2026-BAJeC.webp
"Polemik Lahan untuk 4 Sekolah, UM Pilih Mengacu pada Hasil Pertemuan Terbaru ",2026-06-05,2026-06-25T03:26:24.791023+00:00,Nabila Amelia,Pendidikan,"MALANG KOTA, RADAR MALANG - Pada 6 Maret 2026 lalu ada pertemuan di Dinas Pendidikan (Disdik) Jatim. Pertemuan itu membahas kelanjutan pemakaian lahan milik Universitas Negeri Malang (UM) oleh empat sekolah.
Yakni SDN Percobaan 1, SDN Sumbersari 3, SMPN 4 Malang, dan SMAN 8 Malang. ”Ada sejumlah pihak yang hadir dalam pertemuan itu,” kata Direktur Sarana, Prasarana, dan Aset (DSPA) UM Prof Apif Miptahul Hajji ST MSc PhD, kemarin (4/6).
Pihak yang hadir seperti Kepala Biro Keuangan dan Barang Milik Negara (BMN) untuk Kementerian Pendidikan Tinggi, Sains, dan Teknologi (Kemdiktisaintek). Selain itu ada BKAD Provinsi Jatim, Disdik Jatim, perwakilan dari empat sekolah, dan UM.
”Dalam pertemuan itu, opsi perpanjangan sebenarnya sudah tidak ada,” sebut Apif. Kemudian, Kepala Biro Keuangan dan BMN untuk Kemendiktisaintek akhirnya memutuskan memberikan batas waktu tambahan. Batas waktu yang diberikan selama dua tahun sejak pertemuan di Disdik Provinsi Jatim.
Selama batas waktu yang diberikan itu, baik pemkot maupun pemprov harus segera mempersiapkan lahan untuk memindahkan kegiatan belajar mengajar. Jika nanti sudah menemukan lahan baru, lahan lama yang sebelumnya tercatat sebagai milik kementerian akan diserahkan kepada UM.
”Karena kami sebagai PTNBH (Perguruan Tinggi Negeri Badan Hukum) ke depan akan membutuhkan sarana prasarana yang lebih memadai,” tambah guru besar di bidang Ilmu Fisika tersebut. Sampai saat ini pihaknya tetap mengacu pada hasil pertemuan terakhir di Disdik Jatim pada 6 Maret lalu itu.
Untuk diketahui, masa pinjam pakai lahan untuk tiga sekolah itu sebenarnya berakhir pada Februari 2026. Menurut ketentuan dari pemerintah pusat, sebelum masa pinjam pakai berakhir, Pemkot Malang maupun Pemprov Jatim diwajibkan mengajukan perpanjangan.
Perpanjangan harus dilakukan enam bulan sebelum pinjam pakai berakhir. Namun sampai dengan masa pinjam pakai habis, tidak ada permohonan perpanjangan pinjam pakai dari Pemkot Malang maupun Pemprov Jatim kepada kementerian.
(mel/by)",https://radarmalang.jawapos.com/pendidikan/2606050012/polemik-lahan-untuk-4-sekolah-um-pilih-mengacu-pada-hasil-pertemuan-terbaru,radar_malang,Bayu Mulya Putra,https://cdn-jpr.jawapos.com/images/15/2026/04/09/banyak-jalur-um-membuka-beberapa-jalur-seleksi-mandiri-salah-satunya-adalah-seleksi-mandiri-leadership-umacid-1DnNU.webp
Muncul Opsi Merger SD di Lahan Milik UM ,2026-06-05,2026-06-25T03:26:25.084526+00:00,Nabila Amelia,Pendidikan,"MALANG KOTA, RADAR MALANG
- Masa perpanjangan pinjam lahan milik Universitas Negeri Malang (UM) untuk sekolah di bawah naungan Pemkot Malang hanya berlangsung dua tahun. Setelah itu, tiga sekolah yakni SDN Percobaan 1, SDN Sumbersari 3, dan SMPN 4 Malang harus pindah.
Hingga kini Pemkot Malang belum memutuskan skema apa yang akan diambil ke depannya. Opsi pertama dan yang paling memungkinkan yakni SDN Percobaan 1 dan SDN Sumbersari 3 bakal dimerger dengan sekolah lain.
Sebagai contoh SDN Percobaan 1 bisa dimerger dengan SDN Sumbersari 1. Lalu SDN Sumbersari 3 dimerger dengan SDN Sumbersari 2 (selengkapnya baca grafis). ”Untuk SMPN 4 Malang ini yang tidak memungkinkan dimerger, jadi mau tidak mau harus relokasi,” ujar Kabid Pendidikan Dasar dan Menengah Dinas Pendidikan dan Kebudayaan (Disdikbud) Kota Malang Muflikh Adhim.
Butuh lahan yang cukup luas untuk bangunan sekolah tersebut. Sebab, di SMPN 4 Malang ada 27 rombongan belajar (rombel). Belum lagi kebutuhan untuk gedung lainnya. Seperti laboratorium IPA, ruang komputer, perpustakaan, hingga ruang guru.
Adhim mengaku masih menunggu informasi lebih lanjut dari Badan Keuangan dan Aset Daerah (BKAD) Kota Malang. Terutama untuk informasi kesediaan lahan atau aset bangunan yang memungkinkan dipakai. Namun hingga kini belum ada kabar lebih lanjut.
Setidaknya, bila memutuskan membangun gedung sekolah yang baru, putusan harus ada maksimal pada pertengahan tahun ini. Sebab butuh persiapan dan rencana anggaran yang matang untuk merealisasikannya.
Termasuk apabila diputuskan relokasi sekolah menggunakan gedung yang sudah ada. Itu juga harus segera di putuskan lokasinya agar siswa dan guru bisa menyesuaikan diri dengan jarak terbaru. Sementara itu, keputusan final dari UM yakni bisa meminjamkan lahan lagi dua tahun ke depan.
Meski begitu, masih ada peluang untuk memperpanjang masa peminjaman lagi. ”Tapi kalau akhirnya memang harus pindah, sebaiknya memang disusun mulai sekarang jadi saat ini masih kami usahakan,” lanjut Adhim.
Di tempat lain, Kepala SMPN 4 Kota Malang Panca yani Dinihari berharap sekolahnya tidak dipindah. Sebab fasilitas sekolah saat ini sudah cukup memadai dan lengkap untuk membantu kegiatan belajar mengajar. Sementara ruang baru atau bangunan baru kemungkinan besar fasilitasnya tidak selengkap sekarang.
Meski begitu, pihaknya menerima saja opsi terakhir kalau harus pindah. Sebab kewenangan pengaturan sekolah ada di ranah Pemkot Malang. ”Kami siap kapan saja dipindah, asal tidak mendadak dan lokasi baru bisa memenuhi kebutuhan 27 rombel. Termasuk lab komputer, aula, ruang guru, dan kebutuhan ruang lainnya,” kata Dini.
Untuk diketahui, masa pinjam pakai lahan untuk tiga sekolah itu sebenarnya berakhir pada Februari 2026. Selain ketiganya, ada SMAN 8 Malang yang juga meminjam lahan milik UM. Kewenangan untuk sekolah itu kini berada di bawah Pemprov Jatim.
Menurut ketentuan dari pemerintah pusat, sebelum masa pinjam pakai berakhir, Pemkot Malang maupun Pemprov Jatim diwajibkan mengajukan perpanjangan. Perpanjangan harus dilakukan enam bulan sebelum pinjam pakai berakhir.
Namun sampai dengan masa pinjam pakai habis, tidak ada permohonan perpanjangan pinjam pakai dari Pemkot Malang maupun Pemprov Jatim kepada kementerian. ”Karena itu pada 6 Maret 2026 ada pertemuan di Dinas Pendidikan (Disdik) Provinsi Jawa Timur yang membahas kelanjutan pemakaian lahan,” kata Direktur Sarana, Prasarana, dan Aset (DSPA) UM Prof Apif Miptahul Hajji ST MSc PhD, kemarin (4/6).
Pertemuan dilakukan dengan berbagai pihak. Pihak yang hadir seperti Kepala Biro Keuangan dan Barang Milik Negara (BMN) untuk Kementerian Pendidikan Tinggi, Sains, dan Teknologi (Kemdiktisaintek). Selain itu ada BKAD Provinsi Jatim, Disdik Jatim, perwakilan dari empat sekolah, dan UM.
”Dalam pertemuan itu, opsi perpanjangan sebenarnya sudah tidak ada,” sebut Apif. Kemudian, Kepala Biro Keuangan dan BMN untuk Kemendiktisaintek akhirnya memutuskan memberikan batas waktu lagi.
Batas waktu yang diberikan selama dua tahun sejak pertemuan di Disdik Provinsi Jatim.
Selama batas waktu yang diberikan itu, baik pemkot maupun pemprov harus segera mempersiapkan lahan untuk memindahkan kegiatan belajar mengajar. Jika nanti sudah menemukan lahan baru, lahan lama yang sebelumnya tercatat sebagai milik kementerian akan diserahkan kepada UM.
”Karena kami sebagai PT NBH (Perguruan Tinggi Negeri Badan Hukum) ke depan akan membutuhkan sarana prasarana yang lebih memadai,” tambah guru besar di bidang Ilmu Fisika tersebut. Sampai saat ini pihaknya tetap mengacu pada hasil pertemuan terakhir di Disdik Jatim pada 6 Maret lalu itu.
(aff/mel/by)",https://radarmalang.jawapos.com/pendidikan/2606050052/muncul-opsi-merger-sd-di-lahan-milik-um,radar_malang,A. Nugroho,https://cdn-jpr.jawapos.com/images/15/2026/06/05/ilustrasi-merge-freepik-Urfif.webp
Muncul Opsi Merger Dua SD yang Berdiri di Lahan Milik UM ,2026-06-05,2026-06-25T03:26:25.378074+00:00,Nahdiatul Affandiah,Pendidikan,"MALANG KOTA, RADAR MALANG - Masa perpanjangan pinjam lahan milik Universitas Negeri Malang (UM) untuk sekolah di bawah naungan Pemkot Malang hanya berlangsung dua tahun. Setelah itu, tiga sekolah yakni SDN Percobaan 1, SDN Sumbersari 3, dan SMPN 4 Malang harus pindah.
Hingga kini Pemkot Malang belum memutuskan skema apa yang akan diambil ke depannya. Opsi pertama dan yang paling memungkinkan yakni SDN Percobaan 1 dan SDN Sumbersari 3 bakal dimerger dengan sekolah lain.
Sebagai contoh SDN Percobaan 1 bisa dimerger dengan SDN Sumbersari 1. Lalu SDN Sumbersari 3 dimerger dengan SDN Sumbersari 2.
”Untuk SMPN 4 Malang ini yang tidak memungkinkan dimerger, jadi mau tidak mau harus relokasi,” ujar Kabid Pendidikan Dasar dan Menengah Dinas Pendidikan dan Kebudayaan (Disdikbud) Kota Malang Muflikh Adhim.
Butuh lahan yang cukup luas untuk bangunan sekolah tersebut. Sebab, di SMPN 4 Malang ada 27 rombongan belajar (rombel). Belum lagi kebutuhan untuk gedung lainnya. Seperti laboratorium IPA, ruang komputer, perpustakaan, hingga ruang guru.
Adhim mengaku masih menunggu informasi lebih lanjut dari Badan Keuangan dan Aset Daerah (BKAD) Kota Malang. Terutama untuk informasi kesediaan lahan atau aset bangunan yang memungkinkan dipakai. Namun hingga kini belum ada kabar lebih lanjut.
Setidaknya, bila memutuskan membangun gedung sekolah yang baru, putusan harus ada maksimal pada pertengahan tahun ini. Sebab butuh persiapan dan rencana anggaran yang matang untuk merealisasikannya.
Termasuk apabila diputuskan relokasi sekolah menggunakan gedung yang sudah ada. Itu juga harus segera diputuskan lokasinya agar siswa dan guru bisa menyesuaikan diri dengan jarak terbaru. Sementara itu, keputusan final dari UM yakni bisa meminjamkan lahan lagi dua tahun ke depan.
Meski begitu, masih ada peluang untuk memperpanjang masa peminjaman lagi. ”Tapi kalau akhirnya memang harus pindah, sebaiknya memang disusun mulai sekarang jadi saat ini masih kami usahakan,” lanjut Adhim.
Di tempat lain, Kepala SMPN 4 Kota Malang Pancayani Dinihari berharap sekolahnya tidak dipindah. Sebab fasilitas sekolah saat ini sudah cukup memadai dan lengkap untuk membantu kegiatan belajar mengajar. Sementara ruang baru atau bangunan baru kemungkinan besar fasilitasnya tidak selengkap sekarang.
Meski begitu, pihaknya menerima saja opsi terakhir kalau harus pindah. Sebab kewenangan pengaturan sekolah ada di ranah Pemkot Malang.
”Kami siap kapan saja dipindah, asal tidak mendadak dan lokasi baru bisa memenuhi kebutuhan 27 rombel. Termasuk lab komputer, aula, ruang guru, dan kebutuhan ruang lainnya,” kata Dini.
(aff/by)",https://radarmalang.jawapos.com/pendidikan/2606050011/muncul-opsi-merger-dua-sd-yang-berdiri-di-lahan-milik-um,radar_malang,Bayu Mulya Putra,https://cdn-jpr.jawapos.com/images/15/2026/05/23/universitas-negeri-malang-um-Czopr.webp
"4.000 Pelajar di Kota Malang Dapat Jatah Seragam Gratis, Ini Alasannya",2026-06-05,2026-06-25T03:26:25.640572+00:00,Andika Satria Perdana,Pendidikan,"MALANG KOTA, RADAR MALANG
- Kuota seragam gratis untuk para pelajar di Kota Malang telah ditetapkan. Tahun ini, bantuan itu menyasar empat ribu pelajar. Yang menjadi prioritas yakni warga kurang mampu.
Sebagai informasi, pada 2025 jatah seragam gratis diberikan ke pada seluruh siswa baru SD dan SMP negeri. Karena penyusutan anggaran pada 2026 ini, kuotanya mengalami penyusutan. Tahun lalu anggarannya Rp 6 miliar. Sementara tahun ini berkurang menjadi Rp 1,5 miliar.
Kepala Dinas Pendidikan dan Kebudayaan (Disdikbud) Kota Malang Suwarjana menyampaikan, pendataan penerima bantuan bakal dilakukan setelah Sistem Penerimaan Murid Baru (SPMB). Orang tua akan dikumpulkan sekolah untuk mendapatkan penjelasan terkait mekanisme bantuan seragam.
”Dalam tahap sosialisasi itu, wali murid akan mengisi formulir,” kata Jana. Formulir berisi tentang pertanyaan seputar kemampuan pembelian seragam. Dia menuturkan, kuota 4.000 itu akan dibagi untuk dua jenjang.
Pada jenjang SD negeri, ada 2.000 pelajar yang mendapat bantuan seragam gratis. Untuk jenjang SMP negeri juga ada 2.000 pelajar yang mendapatkannya. ”Tahun lalu setiap jenjang kuotanya 13 ribu pelajar,” imbuh Jana.
Pria kelahiran Bantul itu menambahkan, meski ada penyesuaian anggaran, pihaknya tetap melaksanakan program bantuan seragam gratis. Tujuannya untuk meringankan beban masyarakat kurang mampu. ”Untuk jenjang SMA atau SMK bukan menjadi wewenang Pemkot Malang. Sehingga (kami) tidak menganggarkan,” tandasnya.
Wakil Ketua Komisi D DPRD Kota Malang Suryadi meminta penyampaian bantuan harus benarbenar tepat sasaran. Pemkot Malang diminta tak sekadar mendata. Namun juga wajib melakukan verifikasi.
Dia menegaskan, jangan sampai pihak yang sangat membutuhkan tidak mendapat bantuan itu. Sebab, nominal seragam cukup tinggi bagi warga kurang mampu. Mencapai ratusan ribu rupiah. ”Jangan sampai anak tidak sekolah karena tidak punya seragam. Pemkot juga harus memberi kelonggaran agar pelajar tidak langsung menggunakan seragam baru,” tegasnya.
(adk/by)",https://radarmalang.jawapos.com/pendidikan/2606050046/4000-pelajar-di-kota-malang-dapat-jatah-seragam-gratis-ini-alasannya,radar_malang,A. Nugroho,https://cdn-jpr.jawapos.com/images/15/2026/06/05/ilustrasi-penerimaan-seragam-freepik-pAU5M.webp
Prestasi MTsN 4 Malang Tembus Tingkat Internasional,2026-06-05,2026-06-25T03:26:25.978779+00:00,A. Nugroho,Pendidikan,"MALANG, RADAR MALANG
– MTsN 4 Malang (Matsanema) terus menorehkan prestasi di berbagai ajang, mulai tingkat provinsi, nasional, hingga internasional.
Di tingkat internasional, tim Matsanema FC meraih Juara III Bangkok National Super Cup di Thailand. Sejumlah siswa juga berhasil meraih medali perak pada ASEAN Olympiad 2025 di Malaysia.
Sementara di tingkat nasional, siswa MTsN 4 Malang mencatat prestasi pada ajang Cerdas Cermat SISCOM Fest, kejuaraan pencak silat, serta masuk Top 6 Putera Pelajar Ketahanan Pangan Indonesia. Di tingkat Provinsi Jawa Timur, siswa juga berprestasi dalam bidang akademik, olahraga, dan seni, termasuk melalui Olimpiade Madrasah Indonesia (OMI), O2SN, dan festival musik.
Kepala MTsN 4 Malang Khusnul Fiqriyani Fatmayanti, M.Pd. mengatakan berbagai capaian tersebut merupakan hasil kolaborasi antara madrasah, orang tua, alumni, pemerintah, dan masyarakat dalam mendukung pengembangan potensi peserta didik.
“Prestasi siswa tidak lahir dari kerja satu pihak, melainkan dari dukungan dan kerja sama berbagai elemen,” ujarnya.
Ke depan, MTsN 4 Malang berkomitmen terus meningkatkan mutu pendidikan serta memperluas kesempatan berprestasi bagi siswa agar mampu bersaing di tingkat nasional maupun internasional. (*)",https://radarmalang.jawapos.com/pendidikan/2606050045/prestasi-mtsn-4-malang-tembus-tingkat-internasional,radar_malang,A. Nugroho,https://cdn-jpr.jawapos.com/images/15/2026/06/05/level-internasional-siswa-mtsn-4-malang-meraih-medali-perak-pada-asean-olympiad-2025-di-malaysia-ouPY6.webp
Ikut JGTS agar Siswa Makin Bijak Bermedia Sosial,2026-06-05,2026-06-25T03:26:26.245628+00:00,A. Nugroho,Pendidikan,"KOTA MALANG, RADAR MALANG
– Jurnalis Goes to School (JGTS) siap hadir untuk mengedukasi para siswa baru untuk bijak bermedia sosial. Kegiatan ini merupakan kerja sama Jawa Pos Radar Malang bersama Dinas Pendidikan dan Kebudayaan (Disdikbud) Kota Malang, Cabang Dinas Pendidikan wilayah Kabupaten Malang, serta Cabang Dinas Pendidikan wilayah Kota Malang dan Kota Batu.
Kegiatan ini diselenggarakan sebagai langkah untuk membangun kesadaran etika digital para siswa, melindungi pengguna dari kejahatan siber, dan meningkatkan kemampuan berpikir kritis dalam menyaring informasi.
Hal ini penting agar masyarakat dapat terhindar dari penyebaran hoaks, menjaga kesehatan mental, serta menjaga jejak digital tetap positif.
JGTS dilaksanakan selama Masa Pengenalan Lingkuangan Sekolah (MPLS) untuk SMP/MTs, SMA/MA dan SMK pada bulan Juni-Juli 2026.
Nantinya, materi difokuskan bagaimana para siswa mengetahui tentang Undang-Undang Informasi dan Transaksi Elektronik (ITE).
Program dilaksanakan dengan durasi waktu 180 menit. Pemateri dalam JGT# ini adalah redaktur senior Jawa Pos Radar Malang.
Yang spesial, melalui JGTS, nantinya kegiatan MPLS di sekolah juga akan dipublikasikan di koran dan website Jawa Pos Radar Malang. Info lebih lanjut bisa menghubungi Nur di nomor 0858 5168 6917 atau Siti 0812 2583 7639. (bes)",https://radarmalang.jawapos.com/pendidikan/2606050042/ikut-jgts-agar-siswa-makin-bijak-bermedia-sosial,radar_malang,A. Nugroho,https://cdn-jpr.jawapos.com/images/15/2026/06/05/jurnalis-goes-to-school-jm27M.webp
"SMAN 1 Batu Terus Ukir Prestasi, Perkuat Daya Saing Akademik dan Global",2026-06-05,2026-06-25T03:26:26.519810+00:00,A. Nugroho,Pendidikan,"KOTA BATU, RADAR MALANG
– SMA Negeri 1 Batu terus menunjukkan kiprahnya sebagai salah satu sekolah unggulan di Kota Batu melalui berbagai capaian prestasi sepanjang tahun ajaran 2025/2026. Di bidang akademik, siswa SMAN 1 Batu berhasil menorehkan prestasi pada berbagai ajang bergengsi, di antaranya Festival dan Lomba Seni Sastra Siswa Nasional (FLS3N), Lomba Debat Bahasa Indonesia (LDBI), serta National Schools Debating Championship (NSDC).
Prestasi tersebut menjadi bukti bahwa siswa tidak hanya unggul dalam penguasaan ilmu pengetahuan, tetapi juga memiliki kemampuan komunikasi, berpikir kritis, kreativitas, dan apresiasi seni yang terus berkembang. Selain itu, berbagai ekstrakurikuler sekolah juga aktif mengharumkan nama sekolah melalui raihan prestasi di tingkat provinsi, nasional, hingga internasional.
Keberhasilan tersebut sejalan dengan meningkatnya capaian siswa dalam seleksi masuk perguruan tinggi negeri. Pada jalur Seleksi Nasional Berdasarkan Prestasi (SNBP) tahun 2026, sebanyak 53 siswa SMAN 1 Batu berhasil diterima di berbagai perguruan tinggi negeri favorit. Jumlah tersebut meningkat signifikan dibandingkan tahun sebelumnya yang mencapai 34 siswa.
Sementara itu, pada jalur Seleksi Nasional Berdasarkan Tes (SNBT), sebanyak 84 siswa berhasil diterima di perguruan tinggi negeri. Selain diterima di PTN, beberapa siswa juga diterima di berbagai universitas di luar negeri seperti Malaysia, Singapura, China, Taiwan, dan Australia.
Kepala SMAN 1 Batu Anto Dwi Cahyono, S.Pd., M.M., mengatakan bahwa peningkatan tersebut merupakan hasil kerja keras seluruh warga sekolah.
“Kami bersyukur atas peningkatan jumlah siswa yang diterima melalui SNBP maupun SNBT. Ini menunjukkan bahwa budaya belajar, pendampingan akademik, dan semangat berprestasi di SMAN 1 Batu terus tumbuh,” ujarnya.
Tidak hanya fokus pada prestasi akademik, SMAN 1 Batu juga terus memperluas wawasan global siswa melalui berbagai program internasional. Salah satu program unggulan yang dijalankan adalah pertukaran pelajar dan kolaborasi pendidikan dengan sejumlah negara, seperti Malaysia, Singapura, Vietnam, dan Taiwan.
Program ini memberikan kesempatan bagi siswa untuk mengenal budaya, sistem pendidikan, serta membangun jejaring internasional sejak dini. Di sisi lain, sekolah juga aktif mendukung berbagai program pemerintah daerah maupun pusat, salah satunya Program SIKAP (Sekolah Inovatif Ketahanan Pangan).
Melalui program tersebut, siswa terlibat dalam budidaya tanaman pangan seperti labu siam dan cabai serta pemeliharaan ikan lele dan nila.
Menurut Anto, program ini tidak hanya mendukung ketahanan pangan, tetapi juga menanamkan karakter mandiri, peduli lingkungan, dan jiwa kewirausahaan kepada siswa.
Lebih lanjut, Anto menegaskan bahwa berbagai capaian yang diraih saat ini bukanlah tujuan akhir.
“Ke depan, kami ingin semakin banyak siswa yang berprestasi. Kami juga terus mendorong peningkatan kompetensi guru dan tenaga kependidikan agar dapat meraih prestasi serta memberikan layanan pendidikan terbaik bagi siswa,” tuturnya.
Dengan semangat kolaborasi, inovasi, dan budaya unggul yang terus diperkuat, SMAN 1 Batu optimistis mampu mencetak generasi berkarakter, berwawasan global, dan siap menghadapi tantangan masa depan. (*)",https://radarmalang.jawapos.com/pendidikan/2606050040/sman-1-batu-terus-ukir-prestasi-perkuat-daya-saing-akademik-dan-global,radar_malang,A. Nugroho,https://cdn-jpr.jawapos.com/images/15/2026/06/05/distri-adi-setiawan-sman-1-batu-CgVle.webp
