title,published_date,scraped_at,author,category,content,url,source,editor,image_url
"Jelang Masuk Sekolah, Orang Tua Perlu Siapkan Anak dari Rumah, Bukan Sekadar Belanja Perlengkapan",2026-06-25,2026-06-25T03:25:37.571819+00:00,Choirun Nisa,Pendidikan,"MALANG, RADAR MALANG
– Menjelang tahun ajaran baru, banyak orang tua fokus pada urusan membeli seragam, tas, dan alat tulis untuk anak. Padahal, persiapan anak kembali ke sekolah seharusnya dimulai dari rumah, termasuk membangun rutinitas, kedisiplinan, hingga kesiapan mental agar anak tidak kaget saat kembali belajar.
Mulai dari Jadwal Tidur hingga Rutinitas Pagi
Salah satu hal pertama yang perlu dibenahi orang tua adalah pola tidur anak. Selama libur sekolah, tidak sedikit anak yang terbiasa tidur lebih malam dan bangun lebih siang. Kebiasaan ini berpotensi menyulitkan mereka saat harus kembali masuk sekolah pagi hari.
Karena itu, orang tua disarankan mulai mengembalikan jam tidur anak secara bertahap beberapa hari sebelum sekolah dimulai. Tidur cukup dan bangun pagi secara konsisten akan membantu anak lebih siap mengikuti kegiatan belajar di sekolah.
Selain itu, rutinitas pagi juga perlu dilatih kembali. Orang tua bisa membiasakan anak menyiapkan seragam, tas, buku, dan alat tulis sejak malam sebelumnya agar pagi hari tidak dipenuhi kepanikan dan keterlambatan.
Libatkan Anak agar Lebih Antusias
Orang tua disarankan untuk melibatkan anak dalam memilih perlengkapan sekolah. Keterlibatan ini penting untuk menumbuhkan rasa memiliki sekaligus antusiasme menghadapi hari pertama sekolah.
Anak bisa diajak memilih tas, tempat minum, alat tulis, atau kotak bekal yang mereka sukai. Meski terlihat sederhana, cara ini dapat membantu membangun suasana positif terhadap sekolah, terutama bagi siswa yang baru masuk jenjang baru atau masih merasa cemas.
Di sisi lain, orang tua tetap perlu membuat daftar kebutuhan agar belanja sekolah tetap terkontrol dan tidak berlebihan. Dengan begitu, persiapan sekolah tetap efisien tanpa mengabaikan kebutuhan utama anak.
Bangun Komunikasi dan Semangat Belajar
Tak kalah penting, orang tua juga dianjurkan menjalin komunikasi yang baik dengan pihak sekolah atau guru. Informasi Pendidikan Indonesia menilai kerja sama antara guru dan orang tua dapat membantu anak beradaptasi, menyelesaikan kesulitan belajar, dan merasa lebih aman di lingkungan sekolah.
Selain komunikasi, anak juga perlu dibekali motivasi bahwa sekolah bukan hanya soal nilai, melainkan tempat belajar banyak hal, mulai dari disiplin, tanggung jawab, hingga membangun pertemanan. Orang tua bisa mendorong semangat ini dengan memberi apresiasi atas usaha anak, terutama setelah hari-hari pertama sekolah.
Persiapan yang dimulai dari rumah akan membantu anak masuk sekolah dengan lebih tenang. Karena itu, menjelang tahun ajaran baru, orang tua tidak hanya perlu menyiapkan perlengkapan, tetapi juga membangun kebiasaan dan suasana yang mendukung kesiapan anak belajar kembali.",https://radarmalang.jawapos.com/pendidikan/2606250017/jelang-masuk-sekolah-orang-tua-perlu-siapkan-anak-dari-rumah-bukan-sekadar-belanja-perlengkapan,radar_malang,Aditya Novrian,https://cdn-jpr.jawapos.com/images/15/2026/06/24/siswa-sd-yang-sedang-berbaris-di-lapangan-sekolah-sumber-sdn-srondolwetan-01-pemerintah-kota-semarang-ft7eE.webp
"Tak Hanya Buku dan Seragam, Ini Hal yang Perlu Disiapkan Siswa Jelang Tahun Ajaran Baru",2026-06-24,2026-06-25T03:25:38.176673+00:00,Choirun Nisa,Pendidikan,"MALANG, RADAR MALANG
– Menjelang dimulainya tahun ajaran baru 2026/2027, persiapan siswa tidak cukup hanya membeli buku, tas, atau seragam baru. Orang tua dan guru juga perlu memperhatikan kesiapan anak dari sisi kebiasaan harian, mental, hingga kemampuan beradaptasi agar hari pertama sekolah berjalan lebih lancar.
Perlengkapan Sekolah Bukan Satu-satunya Bekal
Persiapan perlengkapan sekolah memang tetap menjadi hal dasar yang perlu dilakukan sebelum anak kembali ke ruang kelas. Seragam, tas, alat tulis, buku, hingga bekal sekolah perlu dipastikan tersedia sejak beberapa hari sebelum hari pertama masuk.
Namun, DPPAPP DKI Jakarta menekankan bahwa persiapan tidak berhenti pada urusan belanja. Anak juga sebaiknya dilibatkan dalam memilih perlengkapan sekolahnya sendiri agar lebih antusias menyambut sekolah. Selain menumbuhkan semangat, cara ini juga dapat melatih kemandirian anak sejak awal.
Agar belanja kebutuhan sekolah lebih terencana, orang tua disarankan membuat daftar kebutuhan lebih dulu. Langkah sederhana ini dinilai dapat membantu pengeluaran keluarga menjadi lebih hemat sekaligus memastikan tidak ada perlengkapan penting yang tertinggal.
Pola Tidur dan Rutinitas Harian Perlu Dikembalikan
Salah satu tantangan yang kerap muncul setelah libur panjang adalah perubahan pola tidur anak. Banyak siswa terbiasa tidur larut selama liburan sehingga kesulitan bangun pagi ketika sekolah dimulai kembali.
Karena itu, orang tua dianjurkan mulai mengatur ulang jadwal tidur anak beberapa hari sebelum masuk sekolah. Jam tidur yang cukup dan konsisten akan membantu anak lebih segar saat belajar, sekaligus mencegah keterlambatan di hari-hari pertama sekolah.
Selain pola tidur, rutinitas pagi juga sebaiknya mulai dibiasakan kembali. Menyiapkan seragam, alat tulis, dan perlengkapan sekolah pada malam sebelumnya dapat membuat suasana pagi lebih tertib dan tidak terburu-buru.
Bekal Mental dan Sosial Sama Pentingnya
Persiapan masuk sekolah juga perlu menyentuh aspek mental dan sosial anak. Pentingnya mengajarkan anak cara bersosialisasi agar mereka lebih nyaman saat bertemu guru maupun teman baru di lingkungan sekolah.
Di samping itu, orang tua juga perlu mengenalkan hak dan tanggung jawab anak di sekolah, termasuk aturan dasar yang perlu dipatuhi. Dengan pemahaman itu, anak akan lebih siap menghadapi rutinitas belajar dan berinteraksi di lingkungan baru.
Informasi Pendidikan Indonesia juga menyoroti pentingnya membangun semangat belajar anak sejak awal. Sekolah tidak hanya dipahami sebagai tempat mencari nilai, tetapi juga ruang untuk belajar, berteman, dan mengembangkan karakter.",https://radarmalang.jawapos.com/pendidikan/2606240038/tak-hanya-buku-dan-seragam-ini-hal-yang-perlu-disiapkan-siswa-jelang-tahun-ajaran-baru,radar_malang,Aditya Novrian,https://cdn-jpr.jawapos.com/images/15/2026/06/24/kegiatan-siswa-sdn-model-malang-pengenalan-arsip-sejak-dini-kunjungan-edukatif-ke-depot-arsip-kota-malang-sumber-dinas-perpustakaan-umum-dan-arsip-daerah-kota-malang-pemerintah-kota-malang-bdMQt.webp
"Ospek Segera Dimulai, Ini Persiapan Mental yang Perlu Dilakukan Mahasiswa Baru",2026-06-24,2026-06-25T03:25:38.568063+00:00,Choirun Nisa,Pendidikan,"MALANG, RADAR MALANG
– Menjelang dimulainya ospek atau Pengenalan Kehidupan Kampus bagi Mahasiswa Baru (PKKMB), mahasiswa baru tidak hanya perlu menyiapkan dokumen, perlengkapan, dan dresscode. Persiapan mental juga menjadi hal penting agar maba bisa menjalani rangkaian kegiatan kampus dengan lebih tenang, percaya diri, dan siap beradaptasi dengan lingkungan baru.
Pahami Ospek sebagai Proses Adaptasi ke Dunia Kampus
Salah satu hal pertama yang perlu ditanamkan mahasiswa baru adalah cara memandang ospek itu sendiri. Ospek bukan sekadar rangkaian kegiatan formal, melainkan bagian dari proses adaptasi menuju dunia kampus. Melalui kegiatan ini, mahasiswa akan dikenalkan pada sistem perkuliahan, aturan akademik, fasilitas kampus, hingga organisasi kemahasiswaan yang akan menjadi bagian dari kehidupan mereka selama menempuh studi.
Karena itu, mahasiswa baru perlu menyiapkan mental dengan menganggap ospek sebagai ruang belajar, bukan beban. Sikap ini penting agar maba tidak mudah cemas ketika menghadapi jadwal padat, aturan yang harus dipatuhi, atau situasi baru yang belum pernah dialami sebelumnya. Dengan memahami tujuan ospek sejak awal, mahasiswa akan lebih siap menyesuaikan diri dengan lingkungan kampus yang menuntut kemandirian dan inisiatif lebih tinggi dibanding masa sekolah.
Rasa tegang menjelang ospek merupakan hal yang wajar, terutama bagi mahasiswa yang baru pertama kali masuk perguruan tinggi. Namun, kecemasan tersebut dapat dikurangi jika mahasiswa memahami bahwa ospek adalah tahap pengenalan yang dirancang untuk membantu mereka beradaptasi, bukan sekadar kegiatan seremonial di awal perkuliahan.
Siap Menghadapi Jadwal Padat dan Tuntutan Disiplin
Persiapan mental juga berkaitan dengan kesiapan menghadapi ritme kegiatan yang padat. Selama ospek, mahasiswa biasanya akan mengikuti seminar, pengenalan fakultas, kegiatan kelompok, hingga sesi pengarahan dari dosen atau panitia. Karena itu, mahasiswa perlu membiasakan diri untuk hadir tepat waktu, mengikuti arahan, dan menjaga fokus selama kegiatan berlangsung.
Pentingnya memantau jadwal ospek sejak awal agar mahasiswa dapat menyiapkan diri dengan lebih baik. Dengan mengetahui agenda kegiatan, maba bisa mengatur waktu istirahat, mempersiapkan kebutuhan, sekaligus mengurangi rasa panik karena tidak tahu apa yang akan dihadapi. Langkah sederhana seperti menyiapkan perlengkapan sejak malam hari, tidur cukup, dan mengecek lokasi kegiatan juga dapat membantu mahasiswa menjalani ospek dengan lebih tenang.
Selain soal jadwal, mahasiswa baru juga perlu siap menghadapi peraturan kampus, termasuk ketentuan pakaian, tata tertib, hingga kedisiplinan selama kegiatan. Kesiapan mental untuk menaati aturan akan membantu maba menjalani ospek dengan lebih lancar dan tidak mudah tertekan. Fase ini penting karena dunia kampus menuntut mahasiswa lebih mandiri dalam mengatur waktu, menyiapkan kebutuhan, dan bertanggung jawab terhadap setiap kegiatan yang diikuti.
Bangun Sikap Proaktif dan Jaga Pola Pikir Positif
Ospek juga menjadi momen awal mahasiswa membangun relasi dengan teman baru, kakak tingkat, dan dosen. Karena itu, mahasiswa baru perlu menyiapkan mental untuk lebih terbuka dalam berinteraksi. Sikap proaktif, seperti berani bertanya, menyapa teman satu kelompok, atau ikut berdiskusi, akan sangat membantu proses adaptasi di kampus.
Ospek dapat menjadi kesempatan penting untuk mulai membangun jaringan sosial yang nantinya berguna selama masa kuliah. Dengan mengenal lebih banyak orang sejak awal, mahasiswa akan lebih mudah mendapatkan informasi, dukungan, dan teman belajar di kemudian hari. Selain itu, keberanian untuk aktif selama ospek juga bisa membantu mahasiswa merasa lebih percaya diri dan lebih cepat menyesuaikan diri dengan lingkungan akademik yang baru.
Di samping itu, mahasiswa juga perlu menjaga pola pikir positif selama mengikuti ospek. Tantangan yang muncul, seperti jadwal padat, rasa lelah, atau harus beradaptasi dengan banyak orang baru, sebaiknya dipandang sebagai bagian dari proses belajar. Dengan cara itu, mahasiswa akan lebih siap menghadapi masa transisi dari sekolah ke perkuliahan. Dengan persiapan mental yang matang, ospek tidak lagi hanya dipandang sebagai kegiatan wajib, melainkan sebagai langkah awal mengenal dunia kampus dengan lebih siap, nyaman, dan percaya diri.",https://radarmalang.jawapos.com/pendidikan/2606240036/ospek-segera-dimulai-ini-persiapan-mental-yang-perlu-dilakukan-mahasiswa-baru,radar_malang,Aditya Novrian,https://cdn-jpr.jawapos.com/images/15/2026/06/24/mahasiswa-baru-unmer-merayakan-hari-keberagaman-indonesia-2025-sumber-biro-kemahasiswaan-dan-alumni-iG36w.webp
Terobosan Kepala SMKN 1 Turen Malang dalam Meningkatkan Kualitas SDM Sekolah,2026-06-24,2026-06-25T03:25:38.966349+00:00,Indah Mei Yunita,Pendidikan,"KEUNGGULAN Sumber Daya Manusia (SDM) di SMKN 1 Turen tak lepas dari peran Suyitno. Dengan menerapkan
entrepreneurial leadership
, pria yang didapuk menjadi Kepala SMKN 1 Turen itu mengembangkan layanan pendidikan guna memaksimalkan konsep BMW (Bekerja, Melanjutkan, dan Wirausaha).
Dalam kepemimpinannya tersebut, dia mampu mencetak berbagai prestasi bagi sekolah yang terletak di Jalan Panglima Sudirman Nomor 4 Kelurahan Turen itu.
“Saya menggabungkan konsep kewirausahaan ke dalam manajemen sekolah,” ujar Suyitno kemarin (23/6).
Menurutnya, kepemimpinan secara konvensional kurang relevan dengan era persaingan yang ketat. Persaingan bukan lagi antarlembaga, melainkan antar alumni saat memasuki dunia kerja maupun jenjang pendidikan yang lebih tinggi.
Melalui
, Suyitno menanamkan
mindset
berwirausaha. Salah satunya berani mengambil risiko. Minimal risiko untuk menyediakan logistik, pembiayaan, waktu, dan kerja ekstra. Kemudian sikap pantang menyerah demi mencapai tujuan yang lebih baik.
“Di samping persaingan ketat, saat ini juga sudah memasuki era VUCA (
volatility, uncertainty, complexity, ambiguity
). Semuanya serba tidak pasti, sehingga perlu menerapkan
ini,” kata Suyitno.
Gaya kepemimpinan tersebut dia terapkan dalam mengelola lembaga sekaligus finansialnya. Dari sisi lembaga, sebagai sekolah yang berbentuk Badan Layanan Umum Daerah (BLUD), pihaknya mengelola beberapa kegiatan bisnis. Di antaranya
business center, accounting business center,
tempat servis ponsel, kuliner, busana, penyewaan aset, dan fotokopi.
Produk-produknya juga diminati pasar mancanegara. Hal tersebut ditunjukkan dengan partisipasi SMKN 1 Turen dalam Centrestage Hong Kong 2025 dan Hongkong Instyle 2026.
“Dari sisi siswa, kami mengembangkan praktik berwirausaha di koperasi siswa (kopsis) yang dikelola siswa. Dari sana, mereka belajar mengelola usaha dagang,” kata dia.
Kemudian, juga ada bank mini yang melakukan kegiatan transaksi. Siswa-siswi juga secara khusus melaksanakan kewirausahaan mandiri. Baik secara individu maupun berkelompok. Contohnya ada siswa yang berjualan dimsum.
Pihaknya juga memfasilitasi seluruh siswa dengan menerapkan penilaian berbasis kolaborasi proyek. Setiap akhir semester, mereka bisa bekerja sama dengan UMKM untuk menganalisis produk.
“Siswa-siswi tidak hanya belajar menjual, tetapi juga mempresentasikan tentang usaha tersebut. Termasuk menghitung BEP (
break event point
),” lanjutnya.
Namun, tidak hanya memfasilitasi siswa yang ingin berwirausaha saja. Melalui
, dia juga memfasilitasi siswa-siswi yang ingin melanjutkan ke jenjang pendidikan yang lebih tinggi. Sehingga konsep BMW yang dikembangkan SMK dapat terwujud. (
yun/dan).",https://radarmalang.jawapos.com/pendidikan/2606240050/terobosan-kepala-smkn-1-turen-malang-dalam-meningkatkan-kualitas-sdm-sekolah,radar_malang,Mahmudan,https://cdn-jpr.jawapos.com/images/15/2026/06/24/kepala-smkn-1-turen-malang-fGH7i.webp
UNISMA Raih Peringkat Dunia dalam Times Higher Education Sustainability Impact Ratings 2026,2026-06-24,2026-06-25T03:25:39.268112+00:00,A. Nugroho,Pendidikan,"MALANG, RADAR MALANG
- Universitas Islam Malang (UNISMA) kembali menorehkan prestasi membanggakan di tingkat internasional. Berdasarkan hasil pemeringkatan Times Higher Education (THE) Sustainability Impact Ratings 2026, UNISMA berhasil masuk dalam kelompok peringkat 1001–1500 dunia. Hal ini merupakan sebuah capaian yang menunjukkan komitmen universitas dalam mendukung Tujuan Pembangunan Berkelanjutan atau Sustainable Development Goals (SDGs) yang dicanangkan Perserikatan Bangsa-Bangsa (PBB).
Pemeringkatan THE Impact Rankings merupakan salah satu pemeringkatan internasional bergengsi yang menilai kontribusi perguruan tinggi terhadap pembangunan berkelanjutan melalui berbagai aspek. Seperti pendidikan berkualitas, pengentasan kemiskinan, kesetaraan gender, kesehatan dan kesejahteraan, serta kemitraan global.
Dalam pemeringkatan tahun 2026 ini, UNISMA memperoleh sejumlah capaian yang membanggakan pada beberapa indikator SDGs, di antaranya SDG 5: Gender Equality yang berhasil menempati peringkat 101-200 dunia, menjadi salah satu capaian terbaik yang diraih universitas. Selain itu, UNISMA juga meraih peringkat 401-600 dunia pada kategori SDG 2: Zero Hunger dan SDG 4: Quality Education, yang menunjukkan komitmen kuat universitas dalam mendukung ketahanan pangan dan penyelenggaraan pendidikan berkualitas.
Pada kategori SDG 1: No Poverty, UNISMA berada pada peringkat 601-800 dunia, sementara untuk SDG 17: Partnerships for the Goals menempati peringkat 801-1000 dunia. Di kategori SDG 3: Good Health and Well-Being, UNISMA juga berhasil masuk dalam kelompok 1001+ dunia.
Capaian ini menjadi bukti nyata bahwa UNISMA tidak hanya berfokus pada peningkatan kualitas akademik, tetapi juga berperan aktif dalam menciptakan dampak positif bagi masyarakat, lingkungan, dan pembangunan berkelanjutan. Berbagai program pendidikan, penelitian, pengabdian kepada masyarakat, serta kerja sama nasional dan internasional yang terus dikembangkan menjadi faktor penting dalam mendukung pencapaian tersebut.
Rektor Universitas Islam Malang menyampaikan apresiasi kepada seluruh sivitas akademika, alumni, mitra, dan para pemangku kepentingan yang telah berkontribusi dalam perjalanan kemajuan UNISMA. Prestasi ini menjadi motivasi untuk terus meningkatkan kualitas layanan pendidikan tinggi sekaligus memperkuat kontribusi universitas dalam menjawab berbagai tantangan global.
Sejalan dengan visi menjadi perguruan tinggi unggul berstandar internasional, UNISMA akan terus mengembangkan inovasi, memperluas jejaring kemitraan, dan memperkuat implementasi program-program yang mendukung pencapaian SDGs. Dengan semangat “UNISMA Menjadi Kampus Berkelas Dunia”, capaian ini diharapkan semakin memperkokoh posisi UNISMA sebagai perguruan tinggi yang memberikan manfaat luas bagi masyarakat, bangsa, dan dunia. (*)",https://radarmalang.jawapos.com/pendidikan/2606240052/unisma-raih-peringkat-dunia-dalam-times-higher-education-sustainability-impact-ratings-2026,radar_malang,A. Nugroho,https://cdn-jpr.jawapos.com/images/15/2026/06/24/unggul-unisma-raih-peringkat-dunia-dalam-times-higher-education-sustainability-impact-ratings-2026-yVhYD.webp
Ini Biaya yang Dibutuhkan untuk Perbaikan Sekolah Rusak di SDN 4 Sukowilangun Malang,2026-06-24,2026-06-25T03:25:39.538585+00:00,Indah Mei Yunita,Pendidikan,"KALIPARE – Atap gedung SDN 4 Sukowilangun yang ambruk awal tahun lalu bakal segera diperbaiki. Anggaran perbaikan diperkirakan akan menghabiskan Rp 900 juta. Hal itu tercantum dalam Sistem Pengadaan Secara Elektronik (SPSE) Kabupaten Malang.
Kepala Dinas Perumahan, Kawasan Permukiman, dan Cipta Karya (DPKPCK) Kabupaten Malang Farid Habibah menyampaikan, perbaikan gedung menggunakan Anggaran Pendapatan dan Belanja Daerah (APBD) 2026. Pagu yang disediakan Rp 900 juta.
“Pembangunan fisik dimulai setelah teken kontrak,” ujar Habibah kemarin (23/6).
Tahap penandatanganan kontrak bakal berakhir pekan ini, tepatnya lusa (26/6).
“Tanggal mulai pembangunan fisik menjadi urusan penyedia. Kalau kami, begitu tanda tangan kontrak, seharusnya langsung kerja,” terang pejabat eselon II B Pemkab Malang itu.
Sebagai informasi, rusaknya gedung tersebut sudah terlihat sejak September 2025. Saat itu, plafon di salah satu ruang kelas turun. Kondisi tersebut semakin parah hingga sekitar awal Januari lalu, yakni atap gedung ambruk.
Kejadian itu membuat 58 siswa terpaksa belajar di rumah warga. Sekitar 100 meter dari sekolah. Oleh karena itu, demi kelancaran proses belajar mengajar, pemkab segera bertindak untuk memperbaiki gedung tersebut.
“Secara psikologis, rusaknya gedung dan berpindahnya tempat belajar mengajar juga dikhawatirkan memengaruhi motivasi belajar anak-anak,” imbuhnya.
Oleh karena itu, perbaikan tetap dilaksanakan tahun ini meskipun ambruknya gedung tersebut terjadi ketika APBD 2026 sudah digedok. Sehingga ada diskresi anggaran dengan urgensi siswa harus bisa belajar dengan nyaman dan aman. Yakni kewenangan pejabat pemerintah untuk mengambil tindakan keuangan secara mandiri dalam situasi tertentu. Yakni melalui review inspektorat dan Badan Keuangan dan Aset Daerah (BKAD) Kabupaten Malang.
Anggaran tersebut memperbaiki satu gedung yang terdiri atas tiga ruang kelas dan satu ruang guru. Ruang kelas tersebut meliputi kelas empat, lima, dan enam. Masing-masing ruangan berukuran 7x8 meter.(
yun/dan
).",https://radarmalang.jawapos.com/pendidikan/2606240049/ini-biaya-yang-dibutuhkan-untuk-perbaikan-sekolah-rusak-di-sdn-4-sukowilangun-malang,radar_malang,Mahmudan,https://cdn-jpr.jawapos.com/images/15/2026/06/24/sdn-4-sukowilangun-kalipare-malang-s9kFS.webp
"Dua Tahap SPMB SMA-SMK Berlalu, Jumlah Pendaftar di Dua Sekolah Ini yang Paling Banyak ",2026-06-24,2026-06-25T03:25:39.833698+00:00,Nahdiatul Affandiah,Pendidikan,"MALANG KOTA, RADAR MALANG – Dua tahap dalam Seleksi Penerimaan Murid Baru (SPMB) SMA-SMK Negeri di Kota Malang sudah berlalu. Tahap satu yakni jalur domisili. Di tahap itu ada 2.003 pelajar yang diterima.
Di tahap dua ada jalur afirmasi, mutasi, dan prestasi hasil lomba. Ada 3.293 pelajar yang diterima. Dari data Panitia SPMB Cabang Dinas (Cabdin) Pendidikan Kota Malang-Kota Batu, diketahui ada dua sekolah dengan jumlah pendaftar terbanyak.
Di tingkat SMA negeri, ada SMAN 9 Malang. Di jalur domisili saja, sekolah itu diserbu 1.230 pendaftar. Sementara yang diterima hanya 123 pelajar saja.
Jalur mutasi, afirmasi, dan prestasi hasil lomba di sana juga diserbu pendaftar. Total ada 244 pelajar yang mendaftar ke SMAN 9 Malang. Namun, yang diterima hanya 141 saja.
Di tingkat SMK negeri, konsentrasi keahlian yang paling banyak diminati yakni Teknik Grafika di SMK Negeri 4 Malang. Di jalur domisili, ada 584 pendaftar yang berminat masuk ke jurusan itu. Namun hanya 14 pelajar yang diterima.
”Kuota SMK negeri di jalur-jalur sebelumnya memang sedikit. Karena kuota jalur prestasi akademik yang paling banyak porsinya,” kata Robby Zunaidi, Panitia SPMB Cabang Dinas (Cabdin) Pendidikan Kota Malang-Kota Batu.
Di tempat lain, Ketua Musyawarah Kerja Kepala Sekolah (MKKS) SMK Negeri Kota Malang Gunawan Dwiyono menuturkan bahwa sejauh ini beberapa wali murid ada yang datang ke posko SPMB di sekolah-sekolah. Kebanyakan mereka bingung cara mendaftar online, meski sudah ada sosialisasi dan kesempatan uji coba.
Beberapa kendala yang disampaikan seperti nilai TKA tak muncul. Khusus untuk kendala itu, wali murid bakal langsung diarahkan ke Posko SPMB Cabdin Kota Malang-Kota Batu. ”Kewenangan di sekolah hanya untuk pengambilan PIN,” ujar Gunawan.
Beberapa wali murid saat itu ada yang bingung letak koordinat rumah dengan sekolah. Namun sejauh ini seluruh permasalahan itu sudah tertangani karena pendaftaran terpusat dan sepenuhnya dilakukan sistem.
(aff/by)",https://radarmalang.jawapos.com/pendidikan/2606240013/dua-tahap-spmb-sma-smk-berlalu-jumlah-pendaftar-di-dua-sekolah-ini-yang-paling-banyak,radar_malang,Bayu Mulya Putra,https://cdn-jpr.jawapos.com/images/15/2026/06/23/diserbu-pendaftar-smkn-4-malang-jadi-salah-satu-sekolah-dengan-jumlah-pendaftar-spmb-terbanyak-smkn4malangschid-f1vsI.webp
1.200 Pelajar Diprediksi Tak Lolos SPMB SMA-SMK Negeri di Kota Malang ,2026-06-24,2026-06-25T03:25:40.112132+00:00,Nahdiatul Affandiah,Pendidikan,"MALANG KOTA, RADAR MALANG - Seleksi Penerimaan Murid Baru (SPMB) jenjang SMA/SMK memasuki tahap tiga. Dimulai pada hari ini (24/6) dengan dibukanya jalur prestasi akademik untuk jenjang SMA negeri. Total ada 886 kuota yang tersedia di jalur tersebut.
Bila ditotal sampai kemarin, dari 12.249 pelajar yang mengakses PIN SPMB jenjang SMA/SMK, baru 5.296 siswa yang diterima. Masih ada sekitar 6.953 pendaftar lagi yang bakal berjuang di tahap SPMB selanjutnya.
Dengan total kuota yang tersisa 5.664 kursi, bakal ada 1.200 pelajar yang tak bisa masuk SMA/SMK negeri di Kota Malang. ”Angka (proyeksi) itu kemungkinan berkurang, karena tidak semua pengakses PIN bisa masuk kualifikasi sebagai pendaftar jalur prestasi akademik,” kata Robby Zunaidi, Panitia SPMB Cabang Dinas (Cabdin) Pendidikan Kota Malang-Kota Batu.
Masih ada kemungkinan pendaftar tambahan juga dari luar kota. Sebab melalui jalur prestasi akademik, pendaftar diperbolehkan memilih satu sekolah di luar rayon.
Dari pantauan
Jawa Pos Radar Malang
, nilai pendaftar SPMB SMA/SMK di tahap pertama terbilang tinggi. Itu dihitung dari 60 persen nilai rata-rata rapor dan 40 persen nilai Tes Kemampuan Akademik (TKA). Banyak pendaftar di tahap pertama yang diterima memiliki nilai rata-rata 84 hingga 95.
Tahun ini seluruh jalur penerimaan di jenjang SMA negeri memang mengutamakan nilai. Meski mendaftar jalur domisili atau afirmasi, prioritas utama yang dipertimbangkan yakni rata-rata nilai siswa. ”Kalau punya rata-rata di atas 9 seharusnya sudah aman dan kemungkinan besar lolos jalur prestasi,” tambah Robby.
Pendaftar yang perlu waspada yakni yang memiliki nilai rata-rata di bawah 80. Meski siswa dengan nilai tinggi sudah terjaring melalui jalur domisili, tak menutup kemungkinan pendaftar yang nilainya sangat tinggi langsung mengikuti jalur prestasi akademik.
Persaingan masuk ke SMA negeri memang cukup ketat. Tercatat ada 5.000 pelajar yang mengakses PIN untuk masuk SMA negeri. Sementara yang diterima baru sekitar 2.678 pelajar saja. ”Artinya masih sekitar 2 ribu siswa yang belum lolos, sementara kuota tinggal 886 kursi saja,” lanjut Robby.
Sementara itu, jalur prestasi akademik di tingkat SMK negeri bakal dibuka mulai 30 Juni sampai 1 Juli mendatang. Kuotanya cukup banyak. Mencapai 4.778 kursi. Total ada 7.249 pendaftar yang sudah mengakses PIN untuk jenjang SMK negeri. Dari total itu, yang diterima baru 2.618 siswa
(aff/by)",https://radarmalang.jawapos.com/pendidikan/2606240012/1200-pelajar-diprediksi-tak-lolos-spmb-sma-smk-negeri-di-kota-malang,radar_malang,Bayu Mulya Putra,https://cdn-jpr.jawapos.com/images/15/2026/06/07/mengantre-wali-murid-dan-siswa-calon-pendaftar-mengikuti-tahapan-pengambilan-pin-spmb-di-sman-4-kota-malang-kemarin-batas-terakhir-verifikasi-pin-tanggal-9-juni-pukul-2359-e9c5J.webp
