title,published_date,scraped_at,author,category,content,url,source,editor,image_url
"Jelang Demo Day, AI Sekolah Rakyat Garapan FILKOM UB Kian Matang",2026-06-17,2026-06-25T03:25:52.667767+00:00,Kholid Amrullah,Pendidikan,"MALANG KOTA, RADAR MALANG -
Pengembangan kecerdasan artifisial (AI) untuk mendukung pembelajaran di Sekolah Rakyat memasuki tahap pematangan akhir. Melalui program Artificial Intelligence Talent Factory (AITF), mahasiswa Fakultas Ilmu Komputer (FILKOM) Universitas Brawijaya bersama Kementerian Komunikasi dan Digital (Komdigi) serta Kementerian Sosial (Kemensos) terus menyempurnakan sistem yang ditargetkan siap dipresentasikan pada Demo Day akhir Juni mendatang.
Upaya tersebut dilakukan melalui kegiatan Konsinyering Persiapan Demo Day AITF yang berlangsung di Grand Mercure Malang Mirama, 17–20 Juni 2026. Kegiatan ini menjadi forum akselerasi pengembangan dua use case utama AITF, yakni AI untuk Sekolah Rakyat dan sistem pemetaan kemiskinan serta bantuan sosial.
Yohanes Paulus Pical yang hadir mewakili Kepala Pusdiklatbangprof Kemensos, mengatakan pihaknya mendukung penuh pengembangan AI yang saat ini sedang disiapkan oleh peserta AITF. Menurutnya, hasil pengembangan tersebut diharapkan dapat membantu peningkatan layanan pendidikan di Sekolah Rakyat.
“Untuk sementara masih dalam tahap piloting di SRMA 22. Ke depan kami berharap dapat digunakan di seluruh Sekolah Rakyat yang berada di bawah Kementerian Sosial,” ujarnya.
Ia menambahkan, Kemensos menaruh harapan besar agar learning management system (LMS) berbasis AI yang tengah dikembangkan dapat mulai dimanfaatkan pada tahun ajaran baru mendatang.
“Kami berharap siswa baru maupun siswa yang naik kelas nantinya sudah bisa menggunakan LMS berbasis AI yang saat ini sedang dikembangkan,” katanya.
Sementara itu, Ketua Tim Teknis AITF Komdigi, Badar Agung Nugroho, menjelaskan bahwa konsinyering menjadi tahapan penting untuk menyempurnakan hasil Workshop 3 yang sebelumnya telah memperoleh berbagai masukan dari pengguna, tim teknis, maupun pemangku kepentingan.
Menurutnya, fokus kegiatan kali ini adalah memastikan model AI dan minimum viable product (MVP) yang dikembangkan peserta benar-benar siap sebelum dipresentasikan pada Demo Day.
“Tujuan kegiatan ini adalah mematangkan hasil dari workshop sebelumnya. Kami mengevaluasi kembali berbagai perbaikan yang sudah dilakukan, mulai dari penyempurnaan model, penambahan fitur, hingga perbaikan bug agar hasilnya lebih siap saat Demo Day,” jelasnya.
Badar menuturkan, salah satu indikator kesiapan produk adalah kemampuan sistem menghasilkan keluaran yang sesuai dengan kebutuhan pengguna. Untuk use case Sekolah Rakyat, misalnya, sistem diharapkan mampu membantu penyusunan materi pembelajaran, pembuatan soal, hingga penyediaan konten pendukung pembelajaran berbasis AI.
Dekan FILKOM UB, Tri Astoto Kurniawan, mengatakan proses penyempurnaan dilakukan berdasarkan masukan yang diperoleh saat Workshop 3. Dalam forum tersebut, tim pengembang berdiskusi langsung dengan pengguna sehingga ditemukan sejumlah kebutuhan yang perlu disesuaikan.
“Dalam pengembangan sistem memang sering ditemukan perbedaan pemahaman antara pengembang dan pengguna. Melalui kegiatan ini kami menyamakan persepsi agar solusi yang dihasilkan benar-benar menjawab kebutuhan di lapangan,” ujarnya.
Menurut Tri Astoto, konsinyering selama empat hari diperlukan agar mahasiswa, dosen pembimbing, dan tim teknis dapat fokus menyelesaikan pengembangan sebelum memasuki tahap akhir program.
“Workshop berikutnya akan langsung memasuki tahap Graduation dan Demo Day. Karena itu proses akselerasi ini penting agar produk yang ditampilkan benar-benar siap,” katanya.
FILKOM UB sendiri menjadi salah satu perguruan tinggi yang dipercaya dalam pengembangan AITF 2026 bersama Institut Teknologi Sepuluh Nopember (ITS) dan Universitas Gadjah Mada (UGM). Khusus di UB, pengembangan difokuskan pada dua use case strategis, yaitu Sekolah Rakyat serta pemetaan kemiskinan dan bantuan sosial di Jawa Timur.
Melalui kolaborasi antara perguruan tinggi, pemerintah, dan pemangku kepentingan, hasil pengembangan AI tersebut diharapkan tidak hanya menjadi proyek pembelajaran mahasiswa, tetapi juga dapat memberikan kontribusi nyata bagi penyelesaian berbagai persoalan sosial di Indonesia. (akb)",https://radarmalang.jawapos.com/pendidikan/2606170054/jelang-demo-day-ai-sekolah-rakyat-garapan-filkom-ub-kian-matang,radar_malang,Kholid Amrullah,https://cdn-jpr.jawapos.com/images/15/2026/06/17/peserta-aitf-2026-berfoto-bersama-usai-pembukaan-kegiatan-konsinyering-di-malang-rabu-176-6mhdH.webp
"Mahasiswa Baru Wajib Tahu, Ini Barang yang Perlu Disiapkan Sebelum Kuliah",2026-06-17,2026-06-25T03:25:52.951453+00:00,Choirun Nisa,Pendidikan,"MALANG, RADAR MALANG
– Memasuki dunia perkuliahan menjadi momen yang dinantikan banyak lulusan SMA. Namun, selain menentukan jurusan dan kampus tujuan, mahasiswa baru juga perlu mempersiapkan berbagai kebutuhan yang akan menunjang aktivitas belajar selama kuliah.
Persiapan yang matang dapat membantu mahasiswa beradaptasi lebih cepat dengan lingkungan kampus dan mengurangi kendala saat perkuliahan dimulai.
Laptop dan Perangkat Digital Jadi Kebutuhan Utama
Di era pembelajaran berbasis teknologi, laptop menjadi salah satu perlengkapan yang hampir wajib dimiliki mahasiswa. Perangkat ini digunakan untuk mengakses materi kuliah, mengerjakan tugas, membuat presentasi, hingga mengikuti kelas daring.
Selain laptop, mahasiswa juga dianjurkan menyiapkan smartphone, flashdisk, atau hard disk eksternal sebagai media penyimpanan data. Laman UMN menyebut kebutuhan spesifikasi laptop dapat berbeda sesuai program studi yang dipilih, terutama bagi mahasiswa jurusan desain, film, teknik, atau teknologi informasi yang memerlukan perangkat dengan kemampuan lebih tinggi.
Dokumen Akademik Jangan Sampai Terlewat
Selain perlengkapan belajar, mahasiswa baru juga perlu memastikan seluruh dokumen akademik tersimpan dengan baik. Beberapa dokumen yang wajib disiapkan antara lain kartu tanda mahasiswa atau bukti daftar ulang, ijazah, transkrip nilai, KTP, kartu keluarga, pas foto, hingga bukti pembayaran kuliah.
Laman Universitas Ciputra menyarankan mahasiswa menyimpan dokumen tersebut dalam satu map khusus dan membuat salinan digital sebagai cadangan. Langkah ini dinilai penting untuk mengantisipasi kebutuhan administrasi selama masa perkuliahan.
Persiapan Mental Sama Pentingnya dengan Barang Kuliah
Tidak hanya perlengkapan fisik, mahasiswa baru juga perlu mempersiapkan diri secara mental. Dunia perkuliahan menuntut kemandirian yang lebih tinggi dibandingkan masa sekolah, mulai dari mengatur jadwal, menyelesaikan tugas, hingga mengelola waktu secara mandiri.
Bagi mahasiswa perantau, kemampuan beradaptasi dengan lingkungan baru, mengatur keuangan, dan menjaga kesehatan juga menjadi bagian penting dari persiapan sebelum kuliah. Selain itu, mengikuti kegiatan pengenalan kampus dapat membantu mahasiswa memahami sistem akademik sekaligus membangun relasi dengan teman dan dosen sejak awal.",https://radarmalang.jawapos.com/pendidikan/2606170051/mahasiswa-baru-wajib-tahu-ini-barang-yang-perlu-disiapkan-sebelum-kuliah,radar_malang,Aditya Novrian,https://cdn-jpr.jawapos.com/images/15/2026/06/17/ilustrasi-mahasiswa-sedang-berdiskusi-sumber-universitas-multimedia-nusantara-UnpB1.webp
"Digitalisasi Warung Kelontong, Kolaborasi Mahasiswa FILKOM dan FEB UB Raih Pendanaan P2MW 2026 Melalui Startup Stoqin",2026-06-17,2026-06-25T03:25:53.693774+00:00,Kholid Amrullah,Pendidikan,"MALANG KOTA, RADAR MALANG
- Kolaborasi mahasiswa Fakultas Ilmu Komputer
(FILKOM)
dan Fakultas Ekonomi dan Bisnis (FEB) Universitas Brawijaya (UB) berhasil meraih pendanaan Program Pembinaan Mahasiswa Wirausaha (P2MW) 2026 melalui startup bernama Stoqin.
Pengumuman pendanaan tersebut dirilis Kementerian Pendidikan Tinggi, Sains, dan Teknologi pada 22 Mei 2026 melalui daftar proposal P2MW yang lolos pendanaan.
Stoqin dikembangkan sebagai aplikasi
all-in-one mobile marketplace
grosir dan kasir digital yang terintegrasi dengan analisis penjualan berbasis kecerdasan buatan (
Artificial Intelligence/AI
). Platform ini ditujukan untuk membantu pengelolaan warung kelontong melalui pencatatan transaksi, manajemen stok, hingga akses ke distributor grosir.
Founder Stoqin, Johan Arizona, mahasiswa Teknologi Informasi FILKOM UB angkatan 2023, mengatakan platform tersebut hadir untuk mendukung digitalisasi usaha ritel mikro.
“Stoqin memiliki visi untuk menjadi platform digital yang memberdayakan warung kelontong tradisional agar lebih efisien, menguntungkan, dan berkelanjutan di era ekonomi digital,” ujarnya.
Menurut tim pengembang, lahirnya Stoqin dilatarbelakangi oleh masih banyaknya warung kelontong di Indonesia yang dikelola secara manual. Melalui fitur
Point of Sale
(POS) berbasis ponsel pintar, pemilik warung dapat melakukan pencatatan transaksi dan pengelolaan stok secara lebih terstruktur.
Tim pengembang Stoqin terdiri atas mahasiswa Departemen Teknologi Informasi FILKOM UB, yakni Johan Arizona, Dimas Yoga Pratama, dan Muhammad Rizqullah Almadinah. Sementara aspek bisnis dan keuangan diperkuat oleh mahasiswa FEB UB, Nafi Satul Fuadhah dan Syarmi Ayesha Putri Samira.
Pengembangan startup tersebut mendapat pendampingan dan arahan dari
Dr. Okta Purnawirawan, S.Pd., M.Pd., Gr.
selaku dosen pembimbing.
Okta mengapresiasi inisiatif mahasiswa dalam mengembangkan solusi digital yang menyasar pelaku usaha mikro. Menurutnya, produk yang dikembangkan memiliki potensi untuk menjawab kebutuhan digitalisasi sektor ritel tradisional.
Selain berfokus pada aspek bisnis, pengembangan Stoqin juga dinilai sejalan dengan sejumlah tujuan pembangunan berkelanjutan (
Sustainable Development Goals/SDGs
), antara lain SDG 8 tentang pekerjaan layak dan pertumbuhan ekonomi, SDG 9 tentang industri, inovasi dan infrastruktur, serta SDG 11 tentang kota dan komunitas berkelanjutan.
Keberhasilan memperoleh pendanaan P2MW 2026 diharapkan menjadi langkah awal bagi tim untuk mengembangkan platform dan memperluas manfaatnya bagi pelaku usaha mikro di Indonesia. (roy/akb)",https://radarmalang.jawapos.com/pendidikan/2606170044/digitalisasi-warung-kelontong-kolaborasi-mahasiswa-filkom-dan-feb-ub-raih-pendanaan-p2mw-2026-melalui-startup-stoqin,radar_malang,Kholid Amrullah,https://cdn-jpr.jawapos.com/images/15/2026/06/17/dok-filkom-ub-6cH3z.webp
Mengenal Lebih Dekat Laboratorium Robotika FILKOM UB,2026-06-17,2026-06-25T03:25:53.979875+00:00,Kholid Amrullah,Pendidikan,"MALANG KOTA, RADAR MALANG
- Fakultas Ilmu Komputer Universitas Brawijaya
(FILKOM UB)
terus mendorong pengembangan teknologi masa depan melalui berbagai fasilitas riset yang dimiliki. Salah satu pusat inovasi yang aktif menghasilkan berbagai karya dan prestasi adalah
Laboratorium Robotika dan Embedded System
FILKOM UB.
Di bawah koordinasi
Wijaya Kurniawan, S.T., M.T., Ph.D.,
laboratorium ini menjadi wadah pengembangan riset, pembelajaran, serta inovasi teknologi yang melibatkan dosen dan mahasiswa.
Salah satu hasil pengembangannya adalah Tim ATOM Humanoid FILKOM UB yang terdiri dari tiga robot humanoid, yakni ATOM, Blacktop, dan Samsul. Ketiganya terus dikembangkan untuk mendukung riset sekaligus mengikuti berbagai kompetisi robotika tingkat nasional maupun internasional.
Laboratorium ini sempat menjadi sorotan pada peringatan Hari Kemerdekaan Republik Indonesia tahun 2025 di Universitas Brawijaya. Saat itu, robot humanoid hasil pengembangan mahasiswa FILKOM UB tampil memberikan penghormatan bersama jajaran pimpinan universitas saat upacara berlangsung.
Baru-baru ini, Tim ATOM Humanoid FILKOM UB juga berhasil lolos tahap
technical qualification
pada ajang FIRA RoboWorld Cup and Summit 2026 untuk kategori
HuroCup Kid Size United Soccer
.
Dalam pengembangannya, tim menggunakan robot berbasis ROBOTIS OP3 yang telah dimodifikasi untuk mendukung kemampuan berjalan, mendeteksi objek, menjaga keseimbangan, hingga melakukan tendangan secara mandiri.
Robot tersebut mengintegrasikan berbagai teknologi seperti
computer vision
,
humanoid locomotion
motion control
, dan
sensor fusion
. Dengan dukungan kamera dan sensor Inertial Measurement Unit (IMU), robot mampu mengenali lingkungan serta mengambil keputusan secara otomatis saat berada di lapangan pertandingan.
“Keunggulan utama tim kami adalah penerapan riset berbasis proyek yang sangat terstruktur,” ujar Dinda, perwakilan Tim ATOM.
Di bawah pembinaan
Dr.Eng. Gembong Edhi Setyawan, S.T., M.T.,
tim menerapkan sistem
transfer learning
dan
introductory training
untuk menjaga regenerasi anggota dan keberlanjutan pengembangan teknologi.
Sementara itu, Dekan FILKOM UB
Ir. Tri Astoto Kurniawan, S.T., M.T., Ph.D., IPM.
memberikan perhatian khusus terhadap perkembangan riset robotika di lingkungan fakultas. Pihak fakultas terus melakukan pendampingan dan evaluasi terhadap berbagai agenda kompetisi yang akan diikuti tim.
Berdasarkan hasil evaluasi, Tim ATOM saat ini diarahkan untuk mempersiapkan diri menghadapi Lomba Robot Sepak Bola Humanoid Unlimited 2026 yang akan digelar di Universitas Diponegoro (Undip) pada 18–19 September 2026.
Berbagai penyempurnaan terus dilakukan, mulai dari pengembangan perangkat lunak, peningkatan performa perangkat keras, hingga optimalisasi sistem mekanik robot. Persiapan tersebut dilakukan untuk menghadapi seleksi wilayah sekaligus meningkatkan daya saing tim pada kompetisi tingkat nasional.
Melalui Laboratorium Robotika dan Embedded System, FILKOM UB berharap dapat terus menghasilkan inovasi teknologi yang tidak hanya mendukung kegiatan akademik dan penelitian, tetapi juga mampu berkontribusi dalam pengembangan robotika di Indonesia. (roy/akb)",https://radarmalang.jawapos.com/pendidikan/2606170043/mengenal-lebih-dekat-laboratorium-robotika-filkom-ub,radar_malang,Kholid Amrullah,https://cdn-jpr.jawapos.com/images/15/2026/06/17/dok-psik-filkom-ub-psjmf.webp
"Catat, Jadwal Jalur Prestasi Non-Akademik SPMB SMP Negeri di Kota Malang Bakal Dimulai 29 Juni ",2026-06-17,2026-06-25T03:25:54.268046+00:00,Nabila Amelia,Pendidikan,"MALANG KOTA, RADAR MALANG - Sesuai jadwal, pendaftaran jalur afirmasi dan mutasi SMP negeri bakal ditutup pada hari ini (17/6). Selanjutnya ada jalur prestasi akademik yang pendaftarannya dibuka pada 22 sampai 24 Juni. Yang terakhir ada jalur prestasi non-akademik yang pendaftarannya dibuka pada 6 sampai 7 Juli mendatang.
Khusus jalur yang terakhir itu, rangkaiannya dimulai pada 29 sampai 30 Juni berupa penyerahan fotokopi sertifikat lomba. Berlanjut dengan verifikasi oleh Disdikbud pada 29 Juni sampai 2 Juli nanti. Sebelum mendaftar secara online, pendaftar harus mengambil hasil verifikasi. Jadwalnya dibuka sehari saja, pada 3 Juli nanti.
Saat ini, SMP-SMP negeri di Kota Malang masih fokus pada seleksi di jalur afirmasi dan mutasi. Seperti dilakukan SMP Negeri 23 Kota Malang. Di jalur afirmasi, mereka membuka kuota untuk 56 murid.
Terdiri dari afirmasi disabilitas sejumlah 11 murid dan 45 murid afirmasi keluarga prasejahtera. Kemudian jalur mutasi dibuka kuota untuk 11 murid. Terdiri dari mutasi kerja orang tua dengan jumlah 7 murid, dan 4 murid mutasi anak tenaga kependidikan (PTK).
”Sejauh ini proses pendaftarannya berlangsung lancar,” kata Guru BK SMPN 23 Kota Malang Diah Puspitasari. Menurut dia, yang bisa lolos mengikuti dua jalur tersebut adalah mereka yang memiliki bukti surat mutasi.
Bukti surat mutasi yang diserahkan dari instansi seperti TNI, Polri, dan guru atau PTK. ”
Alhamdulillah
tidak ada orang tua yang sampai memaksa mendaftar jika bukan dari instansi-instansi yang sesuai syarat,” tegas Diah.
Senada dengan Diah, Kepala SMP Negeri 3 Kota Malang Teguh Edy Purwanta menyatakan bahwa yang mendaftar di jalur mutasi dan afirmasi tidak bisa sembarangan. ”Karena hanya diperuntukkan bagi anak-anak yang orang tuanya dari anggota TNI, Polri, BUMN, atau ASN,” tuturnya.
Teguh menyebut kuota jalur afirmasi yang dibuka di tempatnya untuk 72 murid. Meliputi afirmasi ABK sebanyak 14 murid dan afirmasi keluarga prasejahtera sebanyak 58 murid. Kemudian untuk jalur mutasi sebanyak 14 murid. Meliputi 6 murid mutasi anak PTK dan 8 murid mutasi kerja orang tua.
Teguh sendiri juga menjadi Plt Kepala SMP Negeri 24 Kota Malang. Di sana, jalur afirmasi membuka kuota untuk 56 murid. Sementara jalur mutasi dibuka kuota untuk 11 murid.
(mel/by)",https://radarmalang.jawapos.com/pendidikan/2606170016/catat-jadwal-jalur-prestasi-non-akademik-spmb-smp-negeri-di-kota-malang-bakal-dimulai-29-juni,radar_malang,Bayu Mulya Putra,https://cdn-jpr.jawapos.com/images/15/2026/06/06/verifikasi-beberapa-wali-murid-melakukan-update-data-secara-manual-di-posko-spmb-disdikbud-kota-malang-kemarin-56-nahdiatul-affandiahradar-malang-722SK.webp
  SD dan TK di Kota Malang Buka SPMB Offline untuk Penuhi Pagu,2026-06-17,2026-06-25T03:25:54.639613+00:00,Nahdiatul Affandiah,Pendidikan,"MALANG KOTA
-
RADAR MALANG
-Pendaftaran online untuk jenjang TK dan SD sudah rampung beberapa waktu lalu. Namun, masih ada 1.300 kuota siswa di SD negeri dan 134 di TK negeri yang belum terisi. Untuk itu, masing-masing sekolah mulai membuka pendaftaran secara
offline
.
Perinciannya di jenjang TK, ada empat sekolah yang belum terpenuhi pagunya. Dari total keseluruhan membuka untuk 270 kursi. Kouta yang terisi dari pendaftaran online hanya 127 kursi. Paling banyak kuota tersisa di TK Pembina 1, dari pagu 90 siswa baru terisi 37 saja.
”Kalau dari SD negeri masih ada 97 sekolah yang pagunya belum terpenuhi,” ujar Panitia SPMB Dinas Pendidikan dan Kebudayaan Kota Malang Suradi. Dari 8.568 kursi yang dibuka tahun ini, dari pendaftaran online baru terisi 7.268 siswa. Untuk itu, tiap satuan pendidikan yang belum memenuhi pagu diminta memperpanjang pendaftaran melalui SPMB offline.
Aturan penerimaan pada SPMB offline itu tak seketat saat online. Wali murid hanya perlu membawa Kartu Keluarga (KK) dan akta kelahiran saat mendaftar. Tak perlu ada ketentuan jarak atau usia seperti pendaftaran online lagi.
Beberapa SD negeri yang masih menyisakan banyak pagu seperti SDN Bareng 1. Dari total 56 pagu yang dibuka, masih terisi 16. Sehingga kuotanya masih ada 40 yang tersisa.
Kepala SDN Bareng 1 Sarengat menuturkan, penurunan pendaftar baru terjadi tahun ini. Pihaknya saat ini masih berusaha memenuhi pagu itu dari pendaftaran offline. ”Kalau ada siswa dari luar Kota Malang juga kami persilakan mendaftar,” ujarnya.
Sarengat heran kenapa pendaftar di sekolahnya jarang. Padahal SDN Bareng 1 masuk peringkat 4 terbaik sekolah di Kecamatan Klojen. Selain itu, capaian nilai TKA para siswa juga termasuk baik, bahkan ada yang meraih angka 96,67 di mata pelajaran matematika.
(aff/gp)",https://radarmalang.jawapos.com/pendidikan/2606170025/sd-dan-tk-di-kota-malang-buka-spmb-offline-untuk-penuhi-pagu,radar_malang,Galih R Prasetyo,https://cdn-jpr.jawapos.com/images/15/2026/06/16/belajar-siswa-sdn-kebonsari-1-fokus-mengikuti-aktivitas-pembelajaran-di-kelas-pada-bulan-mei-lalu-foto-nahdiatul-affandiah-o7pqT.webp
"Opsi Daftar di Jalur Afirmasi SMP Negeri Ditambah, Warga Desil 5 Bisa Mengakses dengan Syarat Tambahan",2026-06-17,2026-06-25T03:25:54.954634+00:00,Nahdiatul Affandiah,Pendidikan,"MALANG KOTA, RADAR MALANG - Selesai dengan jalur domisili, Seleksi Penerimaan Murid Baru (SPMB) SMP negeri kini membuka jalur afirmasi dan mutasi. Pendaftarannya dibuka mulai Senin lalu (15/6). Sampai kemarin sore (16/6) pukul 15.00, tercatat sudah ada 2.306 pendaftar.
Sementara itu, total kuota dari jalur afirmasi dan mutasi hanya 2.205 kursi. Untuk diketahui, jalur afirmasi diperuntukkan bagi calon peserta didik dari kalangan keluarga yang ekonominya kurang mampu. Penyandang disabilitas juga masuk di dalamnya.
Sementara jalur mutasi diperuntukkan bagi pelajar yang harus pindah domisili karena orang tuanya dipindahtugaskan oleh instansi atau perusahaan. Seperti diberitakan, banyak pendaftar yang terlempar di jalur domisili. Persentasenya mencapai 40 persen dari total pendaftar.
Dari 9.263 pendaftar jalur domisili SMP negeri di Kota Malang, hanya 2.939 saja yang diterima. Kini hanya tersisa empat jalur untuk masuk SMP negeri. Yang pertama jalur afirmasi dengan kuota 25 persen. Berikutnya jalur mutasi dengan kuota 5 persen.
Selanjutnya ada jalur prestasi akademik dengan kuota 20 persen. Yang terakhir yakni jalur prestasi non-akademik dengan kuota 10 persen.
Dari pantauan
Jawa Pos Radar Malang
, beberapa wali murid masih kebingungan terkait pembagian desil di jalur afirmasi.
Desil sendiri merupakan metode pengelompokan masyarakat berdasar tingkat kesejahteraan ekonomi. Di dalamnya dibagi dalam 10 kelompok. Semakin kecil angkanya, semakin rendah pula tingkat ekonominya. Di jalur afirmasi, warga yang masuk desil 1 sampai 4 bisa langsung mendaftar.
”Kecuali yang daftar dari desil 5, memang ada syarat tambahan yaitu mendapat salah satu jenis bantuan dari pemerintah,” ujar Suradi, Panitia SPMB Dinas Pendidikan dan Kebudayaan (Disdikbud) Kota Malang. Sejak dibuka pada 15 Juni lalu, sudah ada dua wali murid dari desil 5 yang mendaftar.
Mereka tetap bisa masuk sistem SPMB jalur afirmasi karena menambahkan bantuan Program Keluarga Harapan (PKH). Namun mayoritas pendaftar memang dari desil 1 sampai 4. Begitu juga dengan pendaftar disabilitas, sudah ada beberapa siswa yang mengakses.
Meski belum bisa dihitung pasti berapa pendaftarnya. ”Yang jelas kalau dirinci tahun ini kami membuka 365 kursi untuk afirmasi ABK (Anak Berkebutuhan Khusus) dan 1.475 kursi untuk keluarga kurang mampu,” lanjut Suradi.
Kebingungan penentuan desil yang bisa mendaftar jalur afirmasi itu juga dialami posko SPMB di sekolah-sekolah. Menurut Kepala SMPN 8 Kota Malang Sri Nuryani, beberapa wali murid sempat datang untuk menanyakannya.
Sebab di juknis hanya menyertakan ketentuan desil 1 sampai 4 saja yang bisa mendaftar. Namun saat SPMB jalur afirmasi dibuka, pilihannya ada untuk warga desil 5.
”Kemarin baru di-
clear
-kan, ternyata memang ada syarat tambahannya untuk desil 5,” ujar Sri. Meski begitu, dia memastikan bahwa SPMB tahun ini di sekolahnya cukup lancar. Baik jalur domisili, mutasi, maupun afirmasi sudah banyak yang mengakses dan kuotanya hampir penuh.
Selain wali murid yang kebingungan menentukan desil, Sri juga banyak menerima pertanyaan terkait jalur mutasi. Menurut dia, aturan untuk itu sudah jelas.
Yakni jalur itu khusus bagi Aparatur Sipil Negara (ASN). Seperti TNI, Polri, PNS, hingga guru. ”Banyak yang datang dari mutasi jabatan swasta, itu langsung kami tolak,” lanjut Sri.
(aff/by)",https://radarmalang.jawapos.com/pendidikan/2606170014/opsi-daftar-di-jalur-afirmasi-smp-negeri-ditambah-warga-desil-5-bisa-mengakses-dengan-syarat-tambahan,radar_malang,Bayu Mulya Putra,https://cdn-jpr.jawapos.com/images/15/2026/06/08/terapkan-aturan-baru-kepala-disdikbud-kota-malang-suwarjana-ikut-memantau-pelayanan-di-posko-spmb-kemarin-darmonoradar-malang-GGCFD.webp
"Gandeng Kemenag, Jawa Pos Radar Malang Gelar Diklat Jurnalistik untuk LAZ Se-Malang Raya",2026-06-17,2026-06-25T03:25:55.237180+00:00,A. Nugroho,Pendidikan,"KOTA MALANG, RADAR MALANG
- Inovasi tanpa henti dilakukan Jawa Pos Radar Malang untuk menyebarkan virus literasi. Termasuk untuk terus memberikan pemahaman bagaimana membuat berita yang aktual dan sesuai fakta.
Kali ini, bersama Kementerian Agama (Kemenag) Kota Malang, media terbaik di Malang Raya ini akan menyelenggarakan Diklat Jurnalistik untuk Lembaga Amil Zakat (LAZ).
Menggandeng PT Cita Intan Selaras, Jawa Pos Radar Malang akan mengedukasi peserta membuat buku antologi perdana karya LAZ se-Malang Raya.
Ditujukan untuk memberi edukasi jurnalistik kepada LAZ se-Malang Raya, kegiatan ini diharapkan bisa berdampak langsung. Terutama meningkatkan kemampuan peserta dalam menyebarkan praktik baik yang dilakukan amil, maupun kontribusi luar biasa dari para donatur.
Praktik baik yang bisa dikemas dengan berita yang ciamik dan bernilai branding.
Selain itu, dengan kegiatan ini, LAZ diharapkan semakin update dan akurat dalam memberitakan sumbangsih positif lembaga ini untuk membantu mensejahterakan warga se-Malang Raya.
Diklat sendiri bakal dilaksanakan 29 Juni mendatang. Bertempat di Kantor Jawa Pos Radar Malang, peserta hanya cukup berkontribusi sebesar 450 ribu rupiah. Dengan kontribusi ini, peserta akan mendapatkan fasilitas yang lengkap. Mulai dari sertitikat, makan dan snack, serta pembuatan buku antologi sampai dengan cetak.
Untuk peserta yang belum mendaftar bisa langsung mengisi link pendaftaran berikut : https://bit.ly/diklatLAZradarmalang. Info lebih lanjut tentang acara ini bisa mengubungi Imel di nomor 0812 2583 7699.
(bes)",https://radarmalang.jawapos.com/pendidikan/2606170032/gandeng-kemenag-jawa-pos-radar-malang-gelar-diklat-jurnalistik-untuk-laz-se-malang-raya,radar_malang,A. Nugroho,https://cdn-jpr.jawapos.com/images/15/2026/06/17/gandeng-kemenag-jawa-pos-radar-malang-gelar-diklat-jurnalistik-untuk-laz-se-malang-raya-N6O3u.webp
