title,published_date,scraped_at,author,category,content,url,source,subtitle
"Kepala Bakorwil Malang Asep Kusdinar, Ajak Sekolah Bangun Branding Positif dan Budaya Bermedia Sosial yang Beretika",2026-07-01,2026-07-02T05:46:40.712918+00:00,Kontributor,,"Malang, SeputarMalang.Com – Kepala Badan Koordinasi Wilayah (Bakorwil) III Malang Asep Kusdinar, S.Hut., M.H. mengajak seluruh satuan pendidikan untuk membangun branding sekolah yang positif sekaligus menumbuhkan budaya bermedia sosial yang beretika sebagai bagian dari penguatan karakter dan komunikasi publik di era digital. Pesan tersebut disampaikan Asep saat membuka Media Talkshow School PR Upgrade: Strategi Branding Sekolah di Era Digital yang diselenggarakan oleh Malang Posco Media bekerja sama dengan Dinas Pendidikan Provinsi Jawa Timur di East Java Super Corridor (EJSC) Bakorwil III Malang, Rabu (1/7/2026). Kegiatan ini diikuti puluhan kepala sekolah, guru, tenaga kehumasan, dan pengelola media sosial sekolah dari wilayah Malang Raya. Dalam sambutannya, Asep menegaskan bahwa transformasi digital telah mengubah cara masyarakat memperoleh informasi sekaligus membentuk persepsi terhadap lembaga pendidikan. Karena itu, sekolah dituntut mampu mengelola komunikasi publik secara profesional melalui berbagai platform digital. “Di era digital, media sosial telah menjadi wajah pertama sebuah institusi. Apa yang dipublikasikan sekolah akan membentuk persepsi masyarakat. Oleh karena itu, manfaatkan media sosial untuk menyampaikan prestasi, inovasi, program unggulan, serta berbagai praktik baik yang dimiliki sekolah,” ujar Asep. Menurutnya, branding sekolah bukan sekadar meningkatkan popularitas, tetapi membangun kepercayaan publik melalui komunikasi yang terbuka, jujur, dan konsisten. “Branding yang baik lahir dari kualitas layanan, prestasi, inovasi, dan komunikasi yang dilakukan secara berkelanjutan. Ketika sekolah mampu menyampaikan informasi yang positif dan bermanfaat, maka kepercayaan masyarakat akan tumbuh dengan sendirinya,” imbuhnya. Lebih jauh, Asep mengingatkan bahwa pemanfaatan media sosial harus selalu diiringi dengan etika dan tanggung jawab sebagai warga digital. “Bijaklah dalam menggunakan media sosial. Pastikan setiap informasi yang dibagikan telah terverifikasi, tidak mengandung hoaks, tidak menyebarkan ujaran kebencian, serta tidak memicu perpecahan. Jadikan media sosial sebagai ruang untuk mengedukasi, menginspirasi, dan mempererat persaudaraan,” tegasnya. Ia juga menekankan pentingnya menjaga adab dalam setiap interaksi di ruang digital. “Teknologi berkembang sangat cepat, tetapi adab tidak boleh tertinggal. Etika dalam berkomunikasi harus tetap dijunjung tinggi, baik saat membuat konten maupun ketika memberikan komentar. Mari membiasakan penggunaan bahasa yang santun, menghargai perbedaan pendapat, tidak melakukan perundungan siber, serta selalu mengedepankan nilai-nilai saling menghormati. Jejak digital akan selalu menjadi cerminan karakter kita,” jelasnya. Asep menilai sekolah memiliki peran strategis dalam membentuk generasi muda yang tidak hanya unggul dalam akademik, tetapi juga memiliki literasi digital, etika komunikasi, dan karakter yang kuat. “Guru tidak hanya mengajarkan ilmu pengetahuan, tetapi juga memberikan teladan dalam memanfaatkan teknologi secara bertanggung jawab. Pendidikan karakter harus hadir pula di ruang digital agar peserta didik tumbuh menjadi generasi yang cerdas, berintegritas, dan berakhlak mulia,” katanya. Melalui kegiatan ini, Asep berharap terbangun sinergi yang semakin kuat antara pemerintah, media massa, dan dunia pendidikan dalam meningkatkan kapasitas kehumasan sekolah serta memperluas penyebarluasan informasi publik yang positif. “Kolaborasi menjadi kunci. Pemerintah, media, dan sekolah harus saling mendukung untuk membangun ekosistem informasi yang sehat. Ketika komunikasi publik berjalan dengan baik, kepercayaan masyarakat terhadap dunia pendidikan juga akan semakin meningkat,” pungkasnya. Sementara itu, Kepala Dinas Pendidikan Provinsi Jawa Timur Dr. Aries Agung Paewai, S.STP., M.M. mendorong setiap sekolah untuk memperkuat strategi branding melalui pengelolaan media sosial yang profesional, kreatif, dan adaptif terhadap perkembangan teknologi. Menurutnya, setiap sekolah memiliki banyak prestasi dan kisah inspiratif yang layak dipublikasikan sehingga dapat memperkuat citra pendidikan Jawa Timur. Media Talkshow ini menghadirkan praktisi media dan komunikasi sebagai narasumber yang membahas strategi membangun citra sekolah, pengelolaan kehumasan, penyusunan konten digital yang efektif, hingga pemanfaatan media sosial sebagai sarana komunikasi publik. Diharapkan, kegiatan ini mampu meningkatkan kapasitas humas sekolah dalam membangun reputasi lembaga yang kredibel, adaptif, dan dipercaya masyarakat. “Penguatan kapasitas kehumasan sekolah dan literasi digital merupakan bagian dari upaya membangun sumber daya manusia unggul yang akan menjadi fondasi terwujudnya kawasan Malang Raya Megapolitan serta pengembangan Jawa Timur bagian selatan sebagai pusat pertumbuhan ekonomi baru. Karena itu, budaya komunikasi yang positif, etis, dan bertanggung jawab harus menjadi karakter bersama seluruh ekosistem pendidikan.” tutup Asep. Tags: Asep Kusdinar Bakorwil III Bakorwil Malang",https://seputarmalang.com/pendidikan/kepala-bakorwil-malang-asep-kusdinar-ajak-sekolah-bangun-branding-positif-dan-budaya-bermedia-sosial-yang-beretika/2907/,seputar_malang,
Kepala Bakorwil Malang: Inovasi BBIB Singosari Jadi Kunci Percepatan Swasembada Daging Nasional,2026-06-29,2026-07-02T05:46:41.512976+00:00,Kontributor,,"Malang, SeputarMalang.Com – Kepala Badan Koordinasi Wilayah (Bakorwil) III Malang, Asep Kusdinar, menegaskan bahwa inovasi yang dikembangkan Balai Besar Inseminasi Buatan (BBIB) Singosari merupakan salah satu kunci strategis dalam mempercepat terwujudnya swasembada daging nasional sekaligus meningkatkan daya saing sektor peternakan Indonesia. Hal tersebut disampaikan Asep Kusdinar usai mendampingi Gubernur Jawa Timur Khofifah Indar Parawansa dalam kunjungan kerja ke BBIB Singosari, Kabupaten Malang, Minggu (28/6/2026). Dalam kunjungan tersebut, Gubernur Jawa Timur meninjau berbagai fasilitas produksi semen beku ternak unggul, termasuk Belgian Blue, Wagyu, Limousin, Simmental, Angus, Brahman, Sapi Bali, Sapi Madura, Peranakan Ongole, hingga Friesian Holstein. Menurut Asep, keberhasilan BBIB Singosari mengembangkan dan memproduksi semen beku berbagai rumpun ternak unggul menunjukkan bahwa Indonesia telah memiliki kapasitas teknologi reproduksi peternakan yang mampu bersaing di tingkat internasional. “BBIB Singosari merupakan aset strategis bangsa yang harus terus kita optimalkan. Inovasi yang dihasilkan tidak hanya meningkatkan kualitas genetik ternak, tetapi juga menjadi fondasi penting dalam mempercepat pencapaian swasembada daging nasional,” ujar Asep. Ia mengatakan, Pemerintah Provinsi Jawa Timur melalui Bakorwil Malang siap memperkuat koordinasi lintas sektor dan lintas daerah agar pemanfaatan teknologi inseminasi buatan semakin luas, terutama di wilayah Malang Raya dan kawasan selatan Jawa Timur yang memiliki potensi besar dalam pengembangan peternakan. Menurutnya, peran Bakorwil tidak hanya sebagai koordinator pembangunan wilayah, tetapi juga menjadi penghubung antara pemerintah pusat, pemerintah provinsi, pemerintah kabupaten/kota, dunia usaha, akademisi, hingga kelompok peternak agar berbagai inovasi dapat diimplementasikan secara optimal. “Kami ingin memastikan bahwa inovasi yang lahir di BBIB Singosari tidak berhenti di laboratorium atau balai penelitian, tetapi benar-benar sampai kepada para peternak sehingga mampu meningkatkan produktivitas, kualitas ternak, serta kesejahteraan masyarakat,” tegasnya. Asep juga mengapresiasi capaian BBIB Singosari yang hingga semester pertama tahun 2026 telah memproduksi 895.559 dosis semen beku dengan stok mencapai sekitar 4,7 juta dosis. Selain mampu memenuhi sekitar 70 persen kebutuhan nasional, BBIB Singosari juga telah mengekspor lebih dari 35 ribu dosis semen beku ke berbagai negara. Menurutnya, capaian tersebut membuktikan bahwa Jawa Timur memiliki peran strategis sebagai pusat pengembangan teknologi peternakan nasional. “Ini menjadi kebanggaan sekaligus tanggung jawab bagi Jawa Timur. Ke depan kita harus semakin memperkuat kolaborasi agar inovasi ini mampu mempercepat peningkatan populasi dan kualitas ternak di seluruh daerah,” katanya. Lebih lanjut, Asep mendukung optimisme Gubernur Jawa Timur bahwa Indonesia memiliki peluang besar mewujudkan swasembada daging dalam tiga tahun ke depan apabila seluruh daerah memperkuat sinergi melalui optimalisasi program inseminasi buatan, peningkatan kualitas bibit ternak, serta pendampingan yang berkelanjutan kepada peternak. “Kunci keberhasilan swasembada daging adalah kolaborasi. Ketika pemerintah pusat, pemerintah daerah, lembaga riset, dan peternak bergerak bersama, saya optimistis cita-cita tersebut dapat diwujudkan. Bakorwil Malang siap menjadi bagian dari penguatan sinergi tersebut,” pungkasnya. Kunjungan Gubernur Jawa Timur ke BBIB Singosari juga menjadi bentuk dukungan Pemerintah Provinsi Jawa Timur terhadap pengembangan teknologi peternakan sebagai salah satu pilar ketahanan pangan daerah sekaligus penguatan ekonomi berbasis sektor agribisnis. Tags: Asep Kusdinar Bakorwil III Bakorwil Malang BBIB Singosari",https://seputarmalang.com/lokasi/jawa-timur/kepala-bakorwil-malang-inovasi-bbib-singosari-jadi-kunci-percepatan-swasembada-daging-nasional/2904/,seputar_malang,
"Berdiskusi dengan Ketua PWI Jatim, Kepala Bakorwil Malang Ajak Perkuat Narasi Pengembangan Potensi Selatan Jatim Menuju Malang Megapolitan",2026-06-26,2026-07-02T05:46:42.506991+00:00,Sam Idoeb,,"SURABAYA, 25 JUNI 2026 – Kepala Badan Koordinasi Wilayah (Bakorwil) Malang Asep Kusdinar melakukan diskusi bersama Ketua Persatuan Wartawan Indonesia (PWI) Jawa Timur Lutfil Hakim di Kantor PWI Jawa Timur, Jalan Taman Apsari Surabaya, Kamis (25/6). Pertemuan tersebut membahas berbagai potensi strategis kawasan Jawa Timur bagian selatan sekaligus pentingnya membangun narasi bersama dalam mendorong percepatan pembangunan menuju kawasan Malang Megapolitan. Dalam diskusi yang berlangsung hangat tersebut, Asep Kusdinar menegaskan bahwa wilayah kerja Bakorwil Malang memiliki karakteristik yang sangat beragam, mulai dari kawasan perkotaan, pegunungan, pertanian, hingga wilayah pesisir yang memiliki potensi besar untuk dikembangkan secara terpadu. Menurutnya, setiap daerah di kawasan Jawa Timur bagian selatan memiliki habit, karakter sosial, budaya, serta keunggulan ekonomi yang berbeda-beda sehingga memerlukan pendekatan pembangunan yang disesuaikan dengan karakteristik masing-masing wilayah. “Setiap daerah memiliki kekhasan dan karakter yang menjadi kekuatan pembangunan. Karena itu, pengembangan kawasan Jawa Timur bagian selatan harus dibangun berdasarkan potensi lokal sehingga mampu tumbuh secara berkelanjutan dan memberikan kesejahteraan bagi masyarakat,” ujar Asep. Ia menjelaskan, konsep Malang Megapolitan tidak hanya dimaknai sebagai pengembangan kawasan perkotaan semata, tetapi juga sebagai upaya membangun konektivitas antardaerah, memperkuat pusat-pusat pertumbuhan ekonomi baru, meningkatkan daya saing wilayah, sekaligus mengoptimalkan potensi pariwisata, pertanian, industri kreatif, pendidikan, dan investasi. Menurut Asep, pembangunan kawasan selatan Jawa Timur membutuhkan kolaborasi seluruh pemangku kepentingan, termasuk media massa, agar berbagai potensi yang dimiliki semakin dikenal masyarakat luas maupun investor. “Media memiliki peran strategis dalam membangun optimisme sekaligus memperkenalkan potensi-potensi besar yang dimiliki Selatan Jawa Timur. Narasi pembangunan yang positif akan menjadi energi bersama dalam mempercepat kemajuan kawasan,” katanya. Ia menambahkan, pembangunan tidak hanya membutuhkan infrastruktur fisik, tetapi juga penguatan komunikasi publik agar masyarakat memahami arah pembangunan dan ikut terlibat dalam prosesnya. Sementara itu, Ketua PWI Jawa Timur Lutfil Hakim menyambut baik gagasan pengembangan kawasan Malang Megapolitan sebagai salah satu strategi memperkuat pertumbuhan ekonomi Jawa Timur. Menurutnya, media memiliki tanggung jawab untuk menghadirkan informasi yang objektif, edukatif, sekaligus mampu membangun optimisme publik terhadap berbagai agenda pembangunan daerah. “Kami siap menjadi mitra strategis pemerintah dalam menyampaikan informasi pembangunan secara profesional dan berimbang. Potensi Selatan Jawa Timur sangat besar dan perlu terus diperkenalkan kepada masyarakat luas melalui pemberitaan yang berkualitas,” ujarnya. Lutfil juga menilai, kolaborasi antara pemerintah dan media merupakan bagian penting dalam membangun ekosistem komunikasi publik yang sehat sehingga berbagai potensi daerah dapat terpublikasikan secara lebih luas dan memberikan dampak positif bagi pembangunan. Diskusi tersebut diharapkan menjadi awal penguatan sinergi antara Bakorwil Malang dan insan pers dalam mengawal pembangunan kawasan Jawa Timur bagian selatan, sekaligus memperkuat posisi Malang Raya sebagai salah satu pusat pertumbuhan ekonomi baru melalui konsep Malang Megapolitan yang berdaya saing, inklusif, dan berkelanjutan. Tags: Bakorwil III Malang Megapolitan PWI Jatim",https://seputarmalang.com/pelayanan-publik/berdiskusi-dengan-ketua-pwi-jatim-kepala-bakorwil-malang-ajak-perkuat-narasi-pengembangan-potensi-selatan-jatim-menuju-malang-megapolitan/2900/,seputar_malang,
Hijrah sebagai Perjalanan Spiritualitas dan Perubahan Sosial,2026-06-16,2026-07-02T05:46:45.035418+00:00,Abdillah,,"SeputarMalang.Com – Tahun Baru Hijriyah mengajak untuk menengok ke dalam diri. Tahun baru ini bukan sekadar pergantian angka dalam kalender atawa almanak, melainkan momentum perenungan tentang makna hijrah, perubahan, dan pembaruan kehidupan. Sedikit flasback, Kalender Hijriyah bertitik awal dari peristiwa hijrah Nabi Muhammad SAW dan para sahabat dari Makkah ke Madinah pada tahun 622 Masehi. Secara historikal, hijrah saat itu merupakan peristiwa transformasi besar yang mengubah umat Islam dari komunitas kecil yang tertindas menjadi masyarakat yang mandiri, berdaya, dan mampu membangun tatanan sosial masyarakat madani. Dari sejarah tersebut, mari mengambil makna hijrah sesungguhnya. Adalah melampaui konteks perpindahan geografis. Hijrah merupakan perpindahan cara berpikir, cara hidup, dan cara memandang masa depan. Hijrah adalah keberanian meninggalkan keadaan yang buruk menuju keadaan yang lebih baik. Dus, hijrah berkaitan dengan perjuangan, pengorbanan, dan pembaruan diri. Artinya, hijrah bukan sekadar soal ekspresi simbolik dan manifestasi keberagamaan yang dinampak-nampakkan, melainkan transformasi moral. Sebagai ekspresi lahiran wa batinan upaya memetieskan narasi hoaks menuju literasi cerdas, mereduksi kemalasan menuju produktivitas, mencuaikan kebencian menuju kasih sayang, menghindari korupsi menuju kejujuran, memencilkan egoisme menuju kepedulian sosial. Hijrah adalah perjalanan yang tidak pernah selesai. Entitas yang bukan tujuan, melainkan proses. Karena setiap manusia harus selalu berada dalam perjalanan menuju versi dirinya yang lebih baik. Sebagaimana air yang terus mengalir mencari muara, demikian pula kehidupan manusia yang senantiasa bergerak menuju kesempurnaan yang hanya dimiliki oleh Allah SWT. Dan sejatinya, manusia dipandang sebagai makhluk yang harus selalu berada dalam perjalanan spiritual untuk menemukan jati diri dan mendekat kepada Sang Khalik. Eling lan Waspada dan Kesadaran Perubahan Dalam tradisi spiritual Jawa, prinsip menemukan jati diri ini dapat ditemukan dalam konsep. Eling berarti kesadaran diri terhadap asal-usul, tujuan hidup, dan hubungan manusia dengan Sang Khalik. Sementara waspada berarti kemampuan membaca perubahan dan tantangan yang ada di sekitar. Kedua nilai tersebut secara subtantif sejalan dengan prinsip manajemen strategis yang menuntut refleksi internal sekaligus kemampuan membaca lingkungan eksternal. Karenanya, spiritualitas Jawa dan konsep hijrah (Islam) sama-sama mengajarkan pentingnya keseimbangan antara refleksi batin dan tindakan nyata dalam bentuk kata dan laku. Di dunia modern, konsep hijrah memiliki relevansi yang kuat dengan teori perubahan, change management. Dalam ilmu manajemen, organisasi yang mampu bertahan bukanlah organisasi yang paling besar, melainkan yang paling adaptif terhadap perubahan lingkungan (Kotter, 1996). Pun demikian dalam konteks manajemen diri, self-management Pada era digital saat ini, tantangan perubahan hadir dalam bentuk yang berbeda. Revolusi teknologi, kecerdasan buatan, perubahan pola kerja, dan ketidakpastian ekonomi global menuntut individu maupun organisasi untuk terus beradaptasi. Pada lingkungan sosial yang terdigitalisasi, tantangan terbesar era kecerdasan buatan dan otomasi bukanlah mengelola perubahan, melainkan mampu menciptakan perubahan itu sendiri. Dalam konteks ini, spirit hijrah menjadi sungguh relevan. Karena hijrah membudayakan keberanian, meninggalkan pola lama yang tidak lagi efektif menuju cara baru yang lebih produktif dan bermakna. Namun demikian, manajemen modern juga mengingatkan bahwa perubahan yang berhasil harus dimulai dari kesadaran internal. Dalam The 7 Habits of Highly Effective People, karya Stephen Covey (1989) menegaskan bahwa perubahan yang berkelanjutan berawal dari private victory sebelum menghasilkan public victory Gagasan ini selaras dengan sabdaNya dalam QS. Ar-Ra’d ayat 11, “Sesungguhnya Allah tidak merubah keadaan sesuatu kaum sehingga mereka merubah keadaan yang ada pada diri mereka sendiri.” Pesan langit tersebut menegaskan bahwa perubahan sosial dimulai dari perubahan diri sendiri. Dengan kata lain, hijrah merupakan proses yang menjadi fondasi bagi perubahan yang lebih luas. Bagi organisasi, institusi bisnis dan non-bisnis, komunitas, maupun individu, Tahun Baru Hijriyah dapat dimaknai sebagai momentum melakukan muhasabah. Sebagaimana institusi bisnis melakukan evaluasi tahunan terhadap capaian dan targetnya. Momentum tahu baru hijriyah, sabagai vocal point untuk mengevaluasi perjalanan hidup. Apa yang perlu dipertahankan, diperbaiki, atau ditinggalkan. Dalam bahasa manajemen, proses ini dikenal sebagai continuous improvement, perbaikan berkelanjutan (Deming, 1986). Makna hijrah tidak hanya relevan dalam ranah spiritual, tetapi juga dalam kehidupan profesional dan organisasi modern. Hijrah mengajarkan bahwa perubahan membutuhkan visi, keberanian, disiplin, dan komitmen. Nilai inti dari hijrah adalah arketipe kehidupan manusia yang senantiasa bergerak menuju kesempurnaan yang hanya dimiliki oleh Allah SWT. Nilai tersebut menjadi fondasi bagi individu yang tangguh, organisasi yang adaptif, dan masyarakat yang mampu menghadapi tantangan kehidupan masa depan tanpa kehilangan akar moral dan budaya. Akhirnya, Wallahu a’lam bish-shawab Tags: Hijrah ngopini Opini Tahun Baru Islam",https://seputarmalang.com/opini/hijrah-sebagai-perjalanan-spiritualitas-dan-perubahan-sosial/2897/,seputar_malang,
Kepala Bakorwil Malang Dampingi Gubernur Jatim Sidak Pasar Klojen,2026-05-29,2026-07-02T05:46:45.765221+00:00,Kontributor,,"Malang, SeputarMalang.Com – Pemerintah Provinsi Jawa Timur terus memperkuat langkah konkret dalam menjaga stabilitas harga dan ketersediaan bahan kebutuhan pokok di pasar tradisional. Upaya tersebut ditunjukkan melalui inspeksi mendadak (sidak) yang dilakukan Gubernur Jawa Timur Khofifah Indar Parawansa di Pasar Klojen, Jum’at (29/5/2026). Dalam kegiatan tersebut, Kepala Bakorwil Malang Asep Kusdinar turut mendampingi Gubernur untuk memastikan kondisi riil harga serta distribusi bahan pokok di pasar tradisional Kota Malang tetap terkendali menjelang libur panjang dan Hari Raya Iduladha. Sidak dilakukan dengan meninjau langsung lapak-lapak pedagang sekaligus berdialog dengan masyarakat dan pelaku usaha pasar. Dari hasil pemantauan ditemukan adanya keterbatasan stok beras medium SPHP dan Minyakita di sejumlah kios pasar. Kondisi tersebut menjadi perhatian serius Pemerintah Provinsi Jawa Timur untuk segera dilakukan langkah koordinatif bersama pihak terkait, termasuk Bulog dan pemerintah daerah. Kepala Bakorwil Malang Asep, menyampaikan bahwa kehadiran Pemerintah Provinsi Jawa Timur di pasar tradisional merupakan bagian dari upaya menjaga keterjangkauan harga sekaligus memastikan distribusi bahan pokok berjalan lancar di wilayah Malang Raya. “Bakorwil Malang mendukung penuh langkah cepat Ibu Gubernur dalam memastikan stabilitas harga bahan kebutuhan pokok di pasar tradisional. Pasar rakyat menjadi salah satu indikator penting kondisi ekonomi masyarakat, sehingga pengawasan distribusi dan ketersediaan stok harus terus diperkuat melalui kolaborasi lintas sektor,” ujarnya. Menurutnya, koordinasi dan gotong royong antar pemangku kepentingan menjadi kunci dalam mengantisipasi potensi inflasi daerah, terutama pada komoditas strategis seperti beras, minyak goreng, cabai, dan bawang merah. Dalam sidak tersebut, Gubernur Khofifah juga memantau perkembangan harga sejumlah komoditas pangan yang mengalami fluktuasi. Pemerintah Provinsi Jawa Timur terus mendorong langkah mitigatif melalui penguatan distribusi, kerja sama antar daerah (KAD), serta pengendalian pasokan agar daya beli masyarakat tetap terjaga. Bakorwil Malang menegaskan komitmennya untuk terus bersinergi bersama Pemerintah Kabupaten/Kota, instansi vertikal, dan stakeholder terkait dalam menjaga stabilitas ekonomi wilayah, khususnya melalui penguatan pengawasan distribusi bahan pokok serta pemetaan dinamika harga di pasar tradisional. Langkah ini diharapkan mampu memberikan rasa aman dan solusi kepada masyarakat terhadap ketersediaan kebutuhan pokok sekaligus menjaga stabilitas inflasi daerah di wilayah Malang Raya. Tags: Bakorwil III Bakorwil Malang KAD Kerjasama Antar Daerah Khofifah",https://seputarmalang.com/lokasi/jawa-timur/kepala-bakorwil-malang-dampingi-gubernur-jatim-sidak-pasar-klojen/2889/,seputar_malang,Kehadiran Pemerintah Provinsi Jawa Timur di Pasar Tradisional Merupakan Bagian dari Upaya Menjaga Keterjangkauan Harga Bahan Pokok di Malang Raya
